uid,title,journal_fix,journal_short,year_fix,keywords_fix,authors_fix,environment,category
WOS:000189304200005,"Resistance to, and accumulation of, uranium by bacteria from a uranium-contaminated site",Geomicrobiology Journal,Geomicrobiology Journal,2004,"arthrobacter,bacteria,deinococcus radiodurans,poly phosphate granules,resistance,toxicity,uranium,uranyl phosphates","suzuki_y,banfield_jf",all,all
WOS:000359607200010,Effect of sludge age on methanogenic and glycogen accumulating organisms in an aerobic granular sludge process fed with methanol and acetate,Microbial Biotechnology,Microbial Biotechnology,2015,NA,"pronk_m,abbas_b,kleerebezem_r,van_loosdrecht_m_c_m",all,all
WOS:000350294100001,An efficient process for wastewater treatment to mitigate free nitrous acid generation and its inhibition on biological phosphorus removal,Scientific Reports,Scientific Reports,2015,NA,"zhao_jianwei,wang_dongbo,li_xiaoming,yang_qi,chen_hongbo,zhong_yu,an_hongxue,zeng_guangming",all,all
WOS:000341348500011,"High-temperature EBPR process: The performance, analysis of PAOs and GAOs and the fine-scale population study of Candidatus ""Accumulibacter phosphatis""",Water Research,Water Research,2014,"enhanced biological phosphorus removal,temperature,polyphosphate accumulating organisms,glycogen accumulating organisms,accumulibacter clades,ppk1","ong_ying_hui,chua_adeline_seak_may,fukushima_toshikazu,ngoh_gek_cheng,shoji_tadashi,michinaka_atsuko",all,all
WOS:000187431000018,The microbial community analysis of a 5-stage BNR process with step feed system,Water Science and Technology,Water Science and...,2003,"biological nutrient removal (bnr),community analysis,dpaos,fluorescence in-situ hybridization (fish),16s rdna analysis,paos","lee_hw,lee_sy,lee_jo,kim_hg,park_jb,choi_e,park_yk",all,all
WOS:000255321100004,Detection and prevention of enhanced biological phosphorus removal deterioration caused by zoogloea overabundance,Environmental Technology,Environmental Technology,2008,"enhanced biological phosphorus removal,exocellular polymeric material,glycogen accumulating organisms,polyphosphate accumulating organisms,zoogloea ramigera","montoya_t,borras_l,aguado_d,ferrer_j,seco_a",all,all
WOS:000071872100009,Development of a revised metabolic model for the growth of phosphorus-accumulating organisms,Water Environment Research,Water Environment Research,1998,"biological phosphorus removal,metabolic model,kinetics,revised metabolic model,phosphorus-accumulating organisms,phosphorus release,activated sludge model no. 2,acetate uptake,ph","filipe_cdm,daigger_gt",all,all
WOS:000358702700042,Diameter control and stability maintenance of aerobic granular sludge in an A/O/A SBR,Separation and Purification Technology,Separation and Purification...,2015,"denitrifying phosphate removal aerobic granules,small diameter,sludge discharge mode,low nutrient loading rate,aoa sba","zhang_cuiya,zhang_hanmin,yang_fenglin",all,all
WOS:000263933200001,Development of the modified activated sludge model describing nitrite inhibition of aerobic phosphate uptake,Water Science and Technology,Water Science and...,2009,"activated sludge model,aerobic phosphate uptake,biological phosphorus removal,denitrifying poly-phosphate accumulating organisms,inhibition,nitrite,sequencing batch reactor","yoshida_y,kim_y,saito_t,tanaka_k",all,all
WOS:000271439600017,Distributions and activities of ammonia oxidizing bacteria and polyphosphate accumulating organisms in a pumped-flow biofilm reactor,Water Research,Water Research,2009,"pumped-flow biofilm reactor,microbial distributions,ammonia oxidizing bacteria,polyphosphate accumulating organisms,fluorescence in situ hybridization,micro-sensors","wu_guangxue,nielsen_michael,sorensen_ketil,zhan_xinmin,rodgers_michael",all,all
WOS:000366618300012,Roles of extracellular polymeric substances in enhanced biological phosphorus removal process,Water Research,Water Research,2015,"activated sludge,enhanced biological phosphorus removal (ebpr),extracellular polymeric substances (eps),mechanism,phosphorus (p) recovery","li_wen-wei,zhang_hai-ling,sheng_guo-ping,yu_han-qing",all,all
WOS:000326768300032,Nutrient removal performance and microbial community analysis of a combined ABR-MBR (CAMBR) process,Chemical Engineering Journal,Chemical Engineering Journal,2013,"anaerobic processes,aerobic processes,membrane bioreactors,optimization,municipal wastewater,nutrient removal","wu_peng,ji_xiaoming,song_xiaokang,shen_yaoliang",all,all
WOS:000500521700001,A High Throughput Isolation Method for Phosphate-Accumulating Organisms,Scientific Reports,Scientific Reports,2019,NA,"anand_ajeeta,aoyagi_hideki",all,all
WOS:000384712900003,Combining simultaneous nitrification-endogenous denitrification and phosphorus removal with post-denitrification for low carbon/nitrogen wastewater treatment,Bioresource Technology,Bioresource Technology,2016,"simultaneous nitrification-endogenous denitrification and phosphorus removal (sndpr),post-denitrification (pd),partial nitrification (pn),phosphorus accumulating organisms (paos),glycogen accumulating organisms (gaos)","wang_xiaoxia,wang_shuying,zhao_ji,dai_xian,peng_yongzhen",all,all
WOS:000443610300016,Process Recovery after CaO Addition Due to Granule Formation in a CSTR Co-Digester-A Tool to Influence the Composition of the Microbial Community and Stabilize the Process?,Microorganisms,Microorganisms,2016,"over-acidification,process recovery,phosphate accumulating organisms,granule formation","liebrich_marietta,kleyboecker_anne,kasina_monika,miethling-graff_rona,kassahun_andrea,wuerdemann_hilke",all,all
WOS:000319333600010,Metabolic model for the filamentous 'Candidatus Microthrix parvicella' based on genomic and metagenomic analyses,Isme Journal,Isme Journal,2013,"microthrix parvicella,filamentous bacteria,activated sludge bulking and foaming,lipid-accumulating bacteria,triacylglycerol,whole genome sequence","mcilroy_simon_jon,kristiansen_rikke,albertsen_mads,karst_soren_michael,rossetti_simona,nielsen_jeppe_lund,tandoi_valter,seviour_robert_james,nielsen_per_halkjaer",all,all
WOS:000236102300007,"Identifying causes for N2O accumulation in a lab-scale sequencing batch reactor performing simultaneous nitrification, denitrification and phosphorus removal",Journal of Biotechnology,Journal of Biotechnology,2006,"n2o,pao,gao,sbr,denitrification,simultaneous nitrification,denitrification and phosphorus removal (sndpr)","lemaire_r,meyer_r,taske_a,crocetti_gr,keller_j,yuan_zg",all,all
WOS:000243743700016,Effect of initial pH control on enhanced biological phosphorus removal from wastewater containing acetic and propionic acids,Chemosphere,Chemosphere,2007,"enhanced biological phosphorus removal (ebpr),initial ph,glycogen,polyhydroxyalkanoates (pha),propionic acid,acetic acid","liu_yan,chen_yinguang,zhou_qi",all,all
WOS:000471087400016,"Simultaneous nitrification, denitrification and phosphorus removal in a sequencing batch reactor (SBR) under low temperature",Chemosphere,Chemosphere,2019,"simultaneous nitrification and denitrification,low temperature,polyphosphate accumulating organisms,denitrifying phosphorus removal,n2o emission","li_can,liu_shufeng,ma_tao,zheng_maosheng,ni_jinren",all,all
WOS:000262571700014,Polyhydroxyalkanoate synthesis using different carbon sources by two enhanced biological phosphorus removal microbial communities,Process Biochemistry,Process Biochemistry,2009,"volatile fatty acid (vfa),enhanced biological phosphorus removal (ebpr) polyhydroxyalkanoate (pha),polyphosphate accumulating organisms (pao)","pijuan_maite,casas_carles,baeza_juan_antonio",all,all
WOS:000252443000009,Bioenergetic models for acetate and phosphate transport in bacteria important in enhanced biological phosphorus removal,Environmental Microbiology,Environmental Microbiology,2008,NA,"burow_luke_c,mabbett_amanda_n,mcewan_alastair_g,bond_philip_l,blackall_linda_l",all,all
WOS:000247896100016,On-line monitoring of the enhanced biological phosphorus removal process using respirometry and titrimetry,Biochemical Engineering Journal,Biochemical Engineering Journal,2007,"ebpr,monitoring,pao,respirometry,titrimetry","guisasola_a,vargas_m,marcelino_m,lafuente_j,casas_c,baeza_j_a",all,all
WOS:000084712400003,Modelling phosphate transport and assimilation in microalgae; how much complexity is warranted?,Ecological Modelling,Ecological Modelling,2000,"polyphosphate,phosphate,growth dynamics,model","john_eh,flynn_kj",all,all
WOS:000418533400203,Effect of electron acceptor on community structures of denitrifying polyphosphate accumulating organisms in anaerobic-anoxic-oxic (A(2)O) process using DNA based stable-isotope probing (DNA-SIP),Chemical Engineering Journal,Chemical Engineering Journal,2018,"denitrifying phosphorus removal,dna based stable-isotope probing (dna-sip),high throughput sequencing,electron acceptor,community structures","guo_yu,zeng_wei,li_ning,peng_yongzhen",all,all
WOS:000329274900008,Seasonal bacterial community dynamics in a full-scale enhanced biological phosphorus removal plant,Water Research,Water Research,2013,"enhanced biological phosphorus removal,""candidatus accumulibacter phosphatis"",activated sludge","flowers_jason_j,cadkin_tracey_a,mcmahon_katherine_d",all,all
WOS:000247960300009,Distributed state simulation of endogenous processes in biological wastewater treatment,Biotechnology and Bioengineering,Biotechnology and Bioengineering,2007,"distributed states,endogenous,degradation,modeling,phosphorus removal,population dynamics,wastewater treatment","schuler_andrew_j,jassby_david",all,all
WOS:000177989100023,Flow cytometric sorting and RFLP analysis of phosphate accumulating bacteria in an enhanced biological phosphorus removal system,Water Science and Technology,Water Science and...,2002,"community analysis,flow cytometory,ebpr,enhanced biological phosphorus removal,pao,phosphate-accumulating bacterium,rflp","kawaharasaki_m,manome_a,kanagawa_t,nakamura_k",all,all
WOS:000503330400082,Do Microplastics Affect Biological Wastewater Treatment Performance? Implications from Bacterial Activity Experiments,Acs Sustainable Chemistry and Engineering,Acs Sustainable Chemistry...,2019,"microplastics,ammonium-oxidizing bacteria,nitrite-oxidizing bacteria,denitrifiers,polyphosphate-accumulating organisms,wastewater treatment","liu_huan,zhou_xu,ding_wanqing,zhang_zehao,nghiem_long_d,sun_jing,wang_qilin",all,all
WOS:000458221200049,Polyphosphate-accumulating organisms in full-scale tropical wastewater treatment plants use diverse carbon sources,Water Research,Water Research,2019,"enhanced biological phosphorus removal (ebpr),high temperature,polyphosphate-accumulating organisms (pao),candidatus accumulibacter,tetrasphaera,carbon source,volatile fatty acids (vfas),amino acids,sugars,alcohols","qiu_guanglei,zuniga-montanez_rogelio,law_yingyu,thi_sara_swa,thi_quynh_ngoc_nguyen,eganathan_kaliyamoorthy,liu_xianghui,nielsen_per_h,williams_rohan_b_h,wuertz_stefan",all,all
WOS:000386242500031,The impact of zinc oxide nanoparticles on phosphorus removal and the microbial community in activated sludge in an SBR,Rsc Advances,Rsc Advances,2016,NA,"wang_s_t,wang_w_q,zhang_z_r,you_h",all,all
WOS:000220160000003,"Enhanced biological phosphorus removal from wastewater by biomass with different phosphorus contents, part II: Anaerobic adenosine triphosphate utilization and acetate uptake rates",Water Environment Research,Water Environment Research,2003,"enhanced biological phosphorus removal,activated sludge,acetate transport,bacterial storage products,polyphosphate,glycogen","schuler_aj,jenkins_d",all,all
WOS:000301630200028,Heterogeneity of Intracellular Polymer Storage States in Enhanced Biological Phosphorus Removal (EBPR) - Observation and Modeling,Environmental Science and Technology,Environmental Science and...,2012,NA,"bucci_vanni,majed_nehreen,hellweger_ferdi_l,gu_april_z",all,all
WOS:000276125500017,Dynamics and function of intracellular carbohydrate in activated sludge performing enhanced biological phosphorus removal,Biochemical Engineering Journal,Biochemical Engineering Journal,2010,"enhanced biological phosphorus removal,carbohydrate,intracellular,polyphosphate,starvation","wu_guangxue,rodgers_michael",all,all
WOS:000255663400004,A practical method for quantification of phosphorus- and glycogen-accumulating organism populations in activated sludge systems,Water Environment Research,Water Environment Research,2007,"enhanced biological phosphorus removal,phosphorus-accumulating organisms,glycogen-accumulating organisms,method,quantification","lopez-vazquez_carlos_m,hooijmans_christine_m,brdjanovic_damir,gijzen_huub_j,van_loosdrecht_mark_c_m",all,all
WOS:000279517400015,Denitrification capabilities of two biological phosphorus removal sludges dominated by different 'Candidatus Accumulibacter' clades,Environmental Microbiology Reports,Environmental Microbiology Reports,2009,NA,"flowers_jason_j,he_shaomei,yilmaz_safak,noguera_daniel_r,mcmahon_katherine_d",all,all
WOS:000457783900047,Temperature effect on extracellular polymeric substances (EPS) and phosphorus accumulating organisms (PAOs) for phosphorus release of anaerobic sludge,Rsc Advances,Rsc Advances,2019,NA,"zeng_fanzhe,jin_wenbiao,zhao_qingliang",all,all
WOS:000362147400002,Long-term study on the impact of temperature on enhanced biological phosphorus and nitrogen removal in membrane bioreactor,Water Research,Water Research,2015,"ebpr,gao,pad,simultaneous nitrification and denitrification,temperature","sayi-ucar_n,sarioglu_m,insel_g,cokgor_e_u,orhon_d,van_loosdrecht_m_c_m",all,all
WOS:000509611300069,"A novel SNPR process for advanced nitrogen and phosphorus removal from mainstream wastewater based on anammox, endogenous partial-denitrification and denitrifying dephosphatation",Water Research,Water Research,2020,"mainstream,anammox,endogenous partial-denitrification,nutrient removal,granular sludge,municipal wastewater","ji_jiantao,peng_yongzhen,wang_bo,li_xiyao,zhang_qiong",all,all
WOS:000406137200008,Sulfide effects on the anaerobic metabolism of polyphosphate-accumulating organisms,Chemical Engineering Journal,Chemical Engineering Journal,2017,"'candidatus accumulibacter phosphatis',sulfide inhibition,anaerobic,modelling,ebpr,pao","saad_sondos_a,welles_laurens,lopez-vazquez_carlos_m,van_loosdrecht_mark_c_m,brdjanovic_damir",all,all
WOS:000427619400047,Post-endogenous denitrification and phosphorus removal in an alternating anaerobic/oxic/anoxic (AOA) system treating low carbon/nitrogen (C/N) domestic wastewater,Chemical Engineering Journal,Chemical Engineering Journal,2018,"post-endogenous denitrification,pha,simultaneous nitrification and denitrification,denitrifying gaos,post-edpr,aoa process","zhao_weihua,huang_yu,wang_meixiang,pan_cong,li_xiyao,peng_yongzhen,li_baikun",all,all
WOS:000489188300018,Cosmetic wastewater treatment with combined light/Fe-0/H2O2 process coupled with activated sludge,Journal of Hazardous Materials,Journal of Hazardous...,2019,"industrial wastewater,zero valent iron,biological treatment,aop,sbr","muszynski_adam,marcinowski_piotr,maksymiec_justyna,beskowska_klaudia,kalwarczyk_ewa,bogacki_jan",all,all
WOS:000456705300004,Single-stage denitrifying phosphorus removal biofilter utilizing intracellular carbon source for advanced nutrient removal and phosphorus recovery,Bioresource Technology,Bioresource Technology,2019,"denitrifying phosphorus removal,advanced nutrient removal,biofilter,intracellular carbon source,endogenous denitrification","lin_ziyuan,wang_yingmu,huang_wei,wang_jiale,chen_li,zhou_jian,he_qiang",all,all
WOS:000294277100078,Metabolic influence of lead on polyhydroxyalkanoates (PHA) production and phosphate uptake in activated sludge fed with glucose or acetic acid as carbon source,Bioresource Technology,Bioresource Technology,2011,"polyhydroxyalkanoates (pha),acetic acid,glucose,heavy metal,phosphate removal","you_sheng-jie,tsai_yung-pin,cho_bo-chuan,chou_yi-hsiu",all,all
WOS:000357664200047,Advanced nitrogen removal via nitrite using stored polymers in a modified sequencing batch reactor treating landfill leachate,Bioresource Technology,Bioresource Technology,2015,"landfill leachate,nitrogen removal,sbr,gaos,fish","miao_lei,wang_shuying,li_baikun,cao_tianhao,xue_tonglai,peng_yongzhen",all,all
WOS:000309299300027,Nutrient removal and phosphorus recovery performances of a novel anaerobic-anoxic/nitrifying/induced crystallization process,Bioresource Technology,Bioresource Technology,2012,"anaerobic-anoxic/nitrifying/induced crystallization process (a(2)n-ic),chemical oxygen demand to phosphorus ratio (cod/p),crystallization,denitrifying polyphosphate-accumulating organisms (dnpaos),phosphorus recovery","shi_jing,lu_xiwu,yu_ran,zhu_wentao",all,all
WOS:000301155800004,A comparison of endogenous processes during anaerobic starvation in anaerobic end sludge and aerobic end sludge from an anaerobic/anoxic/oxic sequencing batch reactor performing denitrifying phosphorus removal,Bioresource Technology,Bioresource Technology,2012,"denitrifying phosphorus removal,endogenous process,maintenance,anaerobic end sludge,aerobic end sludge","wang_yayi,geng_junjun,peng_yongzhen,wang_chong,guo_gang,liu_shanhu",all,all
WOS:000353193200025,Organic carbon removal from wastewater by a PHA storing biofilm using direct atmospheric air contact as oxygen supply,Bioresource Technology,Bioresource Technology,2015,"aeration reduction,organic removal,biofilm,pha/phb,wastewater","flavigny_raphael_marie-guillaume,cord-ruwisch_ralf",all,all
WOS:000228838600005,"Challenges for simultaneous nitrification, denitrification, and phosphorus removal in microbial aggregates: mass transfer limitation and nitrous oxide production",Fems Microbiology Ecology,Fems Microbiology Ecology,2005,"simultaneous nitrification denitrification,microsensors,aggregates,nitrous oxide","meyer_rl,zeng_rjx,giugliano_v,blackall_ll",all,all
WOS:000230178900004,Anaerobic metabolism of propionate by polyphosphate-accumulating organisms in enhanced biological phosphorus removal systems,Biotechnology and Bioengineering,Biotechnology and Bioengineering,2005,NA,"oehmen_a,zeng_rj,yuan_zg,keller_j",all,all
WOS:000386243600039,Improving municipal wastewater nitrogen and phosphorous removal by feeding sludge fermentation products to sequencing batch reactor (SBR),Bioresource Technology,Bioresource Technology,2016,"municipal wastewater,nitrogen and phosphorous removal,sludge fermentation products,sludge reduction,bacterial community","yuan_yue,liu_jinjin,ma_bin,liu_ye,wang_bo,peng_yongzhen",all,all
WOS:000432526300026,"Community structures and population dynamics of ""Candidatus Accumulibacter"" in activated sludges of wastewater treatment plants using ppk1 as phylogenetic marker",Journal of Environmental Sciences,Journal of Environmental...,2018,"candidatus accumulibacter,polyphosphate kinase 1 gene (ppk1),activated sludge,enhanced biological phosphorus removal (ebpr),wastewater treatment plants (wwtps)","zeng_wei,zhang_limin,fan_pengchao,guo_jingjing,peng_yongzhen",all,all
WOS:000344120200037,Modeling and parameter estimation of two-phase endogenous respirograms and COD measurements during aerobic digestion of biological sludge,Bioresource Technology,Bioresource Technology,2014,"accumulating organisms,aerobic digestion,endogenous respirograms,parameter identifiability,storage","fall_c,rogel-dorantes_j_a,millan-lagunas_e_l,martinez-garcia_c_g,silva-hernandez_b_c,silva-trejo_f_s",all,all
WOS:000226128100018,Response of an EBPR population developed in an SBR with propionate to different carbon sources,Water Science and Technology,Water Science and...,2004,"carbon source,enhanced biological phosphorus removal,phosphorus accumulating organisms,polyhydroxyalkanoates,volatile fatty acids","pijuan_m,baeza_ja,casas_c,lafuente_j",all,all
WOS:000255681600002,On-line titrimetric monitoring of anaerobic-anoxic EBPR processes,Water Science and Technology,Water Science and...,2008,"dpao,ebpr,monitoring,nitrate,nitrite,titrimetry","vargas_m,guisasola_a,lafuente_j,casas_c,baeza_j_a",all,all
WOS:000375186700037,Improving phosphorus removal in aerobic granular sludge processes through selective microbial management,Bioresource Technology,Bioresource Technology,2016,"aerobic granular sludge,wastewater treatment,high-throughput sequencing,bacterial diversity,microbial management,phosphorus removal","henriet_olivier,meunier_christophe,henry_paul,mahillon_jacques",all,all
WOS:000384322700059,Improved biological phosphorus removal induced by an oxic/extended-idle process using glycerol and acetate at equal fractions,Rsc Advances,Rsc Advances,2016,NA,"zhao_jianwei,wang_dongbo,li_xiaoming,zeng_guangming,yang_qi",all,all
WOS:000289497600016,Calibration of denitrifying activity of polyphosphate accumulating organisms in an extended ASM2d model,Water Research,Water Research,2010,"anoxic yields,asm2d,biological phosphorus removal,off-line calibration,pilot plant study","garcia-usach_f,ribes_j,ferrer_j,seco_a",all,all
WOS:000286499600023,"Long-term operation of a reactor enriched in Accumulibacter clade I DPAOs: performance with nitrate, nitrite and oxygen",Water Science and Technology,Water Science and...,2011,"candidatus accumulibacter phosphatis,denitrifying polyphosphate accumulating organisms,ebpr,nitrate","lanham_a_b,moita_r,lemos_p_c,reis_m_a_m",all,all
WOS:000370547800014,Effect of the C:N:P ratio on the denitrifying dephosphatation in a sequencing batch biofilm reactor (SBBR),Journal of Environmental Sciences,Journal of Environmental...,2015,"wastewater treatment,sequencing batch biofilm reactor,nitrogen and phosphorus removal,enhanced intracellular polyphosphate accumulation,denitrifying dephosphatation,denitrification and dephosphatation rates","mielcarek_artur,rodziewicz_joanna,janczukowicz_wojciech,thornton_arthur_j,jozwiak_tomasz,szymczyk_paula",all,all
WOS:000305435500013,Improved biological phosphorus removal performance driven by the aerobic/extended-idle regime with propionate as the sole carbon source,Water Research,Water Research,2012,"enhanced biological phosphorus removal,aerobic/extended-idle process,propionate,polyphosphate","wang_dongbo,li_xiaoming,yang_qi,zheng_wei,wu_yan,zeng_tianjing,zeng_guangming",all,all
WOS:000086089700020,Enhanced biological phosphorus removal in a sequencing batch reactor supplied with glucose as a sole carbon source,Water Research,Water Research,2000,"enhanced biological phosphorus removal,sequencing batch reactor,metabolic pathway,glucose,poly 3-hydroxy alkanoic acids","jeon_co,park_jm",all,all
WOS:000278415300007,"Analysis of the Fine-Scale Population Structure of ""Candidatus Accumulibacter phosphatis"" in Enhanced Biological Phosphorus Removal Sludge, Using Fluorescence In Situ Hybridization and Flow Cytometric Sorting",Applied and Environmental Microbiology,Applied and Environmental...,2010,NA,"kim_jeong_myeong,lee_hyo_jung,kim_sun_young,song_jae_jun,park_woojun,jeon_che_ok",all,all
WOS:000082421400004,Polyphosphate kinase of Acinetobacter sp strain ADP1: Purification and characterization of the enzyme and its role during changes in extracellular phosphate levels,Applied and Environmental Microbiology,Applied and Environmental...,1999,NA,"trelstad_pl,purdhani_p,geissdorfer_w,hillen_w,keasling_jd",all,all
WOS:000332446100002,Candidatus Accumulibacter phosphatis: Elusive Bacterium Responsible for Enhanced Biological Phosphorus Removal,Journal of Environmental Engineering,Journal of Environmental...,2014,"phosphorus,activated sludge,nitrogen,abatement and removal,wastewater management,enhanced biological phosphorus removal (ebpr),candidatus accumulibacter phosphatis,activated sludge,microbial communities,nitrogen fixation","kang_dae-wook,noguera_daniel_r",all,all
WOS:000235272400016,Putative glycogen-accumulating organisms belonging to the Alphaproteobacteria identified through rRNA-based stable isotope probing,Microbiology-Sgm,Microbiology-Sgm,2006,NA,"meyer_rl,saunders_am,blackall_ll",all,all
WOS:000493220400025,Side-stream enhanced biological phosphorus removal (S2EBPR) process improves system performance - A full-scale comparative study,Water Research,Water Research,2019,"ebpr,side-stream,performance comparison,microbial ecology,activity","wang_dongqi,tooker_nicholas_b,srinivasan_varun,li_guangyu,fernandez_loretta_a,schauer_peter,menniti_adrienne,maher_chris,bott_charles_b,dombrowski_paul,barnard_james_l,onnis-hayden_annalisa,gu_april_z",all,all
WOS:A1994PP80000006,BIOLOGY OF POLYPHOSPHATE-ACCUMULATING BACTERIA INVOLVED IN ENHANCED BIOLOGICAL PHOSPHORUS REMOVAL,Fems Microbiology Reviews,Fems Microbiology Reviews,1994,"phosphorus removal,acinetobacter,polyphosphate,biosynthesis,degradation,phosphate transport,uptake,efflux","kortstee_gjj,appeldoorn_kj,bonting_cfc,vanniel_ewj,vanveen_hw",all,all
WOS:000415906900026,"Effects of different carbon sources on enhanced biological phosphorus removal and ""Candidatus Accumulibacter"" community composition under continuous aerobic condition",Applied Microbiology and Biotechnology,Applied Microbiology and...,2017,"""candidatus accumulibacter"",enhanced biological phosphorus removal (ebpr),polyhydroxyalkanoates (pha),polyphosphate kinase gene (ppk),real-time qpcr","nittami_tadashi,mukai_masayuki,uematsu_keisuke,yoon_li_wan,schroeder_sarah,chua_adeline_seak_may,fukuda_junji,fujita_masafumi,seviour_robert_j",all,all
WOS:000410545300071,Dynamics of microbial activities and community structures in activated sludge under aerobic starvation,Bioresource Technology,Bioresource Technology,2017,"aerobic starvation,nitrifiers,paos,cell decay,recovery,microbial community","liu_wenlong,peng_yongzhen,ma_bin,ma_linna,jia_fangxu,li_xiyao",all,all
WOS:000347263300005,Effects of Cd(II) on wastewater biological nitrogen and phosphorus removal,Chemosphere,Chemosphere,2014,"cd(ii),biological nutrient removal,denitrification,enzymes,polyhydroxyalkanoates","chen_hong-bo,wang_dong-bo,li_xiao-ming,yang_qi,luo_kun,zeng_guang-ming,tang_mao-lin",all,all
