uid,title,journal_fix,journal_short,year_fix,keywords_fix,authors_fix,environment,category
WOS:000287589700005,Biological removal of phosphate from synthetic wastewater using bacterial consortium,Iranian Journal of Biotechnology,Iranian Journal of...,2011,"phosphate removal,synthetic waste water,consortium-bacillus sp rs-1,pseudomonas sp ylw-7,enterobacter sp klw-2","krishnaswamy_usharani,muthuchamy_muthukumar,perumalsamy_lakshmanaperumalsamy",all,all
WOS:000499953500029,Long-term effects of silver nanoparticles on performance of phosphorus removal in a laboratory-scale vertical flow constructed wetland,Journal of Environmental Sciences,Journal of Environmental...,2020,"silver nanoparticles (agnps),phosphorus removal,constructed wetlands,enzymatic activity,microbial community","huang_juan,xiao_jun,guo_yang,guan_wenzu,cao_chong,yan_chunni,wang_mingyu",all,all
WOS:000255883600014,"Simultaneous nitrification, denitrification, and phosphorus removal from nutrient-rich industrial wastewater using granular sludge",Biotechnology and Bioengineering,Biotechnology and Bioengineering,2008,"abattoir wastewater,bnr,hrt,sbr,slaughterhouse,wastewater,sndpr","yilmaz_guisum,lemaire_romain,keller_jurg,yuan_zhiguo",all,all
WOS:000509611300046,Kinetics of biological and chemical processes in anoxic-aerobic digestion of phosphorus rich waste activated sludge,Water Research,Water Research,2020,"phosphorus removal,activated sludge,anoxic-aerobic digestion,plant-wide modelling","ikumi_d_s,harding_t_h",all,all
WOS:000450551600078,"The link between nitrous oxide emissions, microbial community profile and function from three full-scale WWTPs",Science of the Total Environment,Science of the...,2019,"nitrous oxide (n2o),greenhouse gas (ghg),wastewater treatment plants (wwtps),nitrous oxide reductase (nosz),nitrification,denitrification","vieira_a,galinha_c_f,oehmen_a,carvalho_g",all,all
WOS:000295386800037,Reducing the startup time of aerobic granular sludge reactors through seeding floccular sludge with crushed aerobic granules,Water Research,Water Research,2011,"aerobic granules,startup,seeding,crushed granules,nutrient removal,nutrient rich wastewater","pijuan_maite,werner_ursula,yuan_zhiguo",all,all
WOS:000357915400001,Transfer of energy pathway genes in microbial enhanced biological phosphorus removal communities,Bmc Genomics,Bmc Genomics,2015,"enhanced biological phosphorus removal,lateral gene transfer,metagenomics,phylogenetics,mobile genetic elements","wong_dennis_h_-j,beiko_robert_g",all,all
WOS:000430895300005,Evaluating death and activity decay of Anammox bacteria during anaerobic and aerobic starvation,Chemosphere,Chemosphere,2018,"anammox bacteria,decay,death,activity decay,starvation","wang_qilin,song_kang,hao_xiaodi,wei_jing,pijuan_maite,van_loosdrecht_mark_c_m,zhao_huijun",all,all
WOS:000279332300056,Expansion of the target of rapamycin (TOR) kinase family and function in Leishmania shows that TOR3 is required for acidocalcisome biogenesis and animal infectivity,Proceedings of the National Academy of Sciences of the United States of America,Proceedings of the...,2010,"chemotherapy,protozoan parasite,trypanosomatidae,virulence,kinetoplastida","da_silva_luciana_madeira,beverley_stephen_m",all,all
WOS:000414817900074,The roles of loosely-bound and tightly-bound extracellular polymer substances in enhanced biological phosphorus removal,Chemosphere,Chemosphere,2017,"enhanced biological phosphorus removal,tightly-bound extracellular polymeric substances (tb-eps),loosely-bound extracellular polymeric substances (lb-eps),polyphosphate,biological phosphorus accumulation","long_xiangyu,tang_ran,fang_zhendong,xie_chaoxin,li_yongqin,xian_guang",all,all
WOS:000292949700016,"Selection of bioindicators to detect lead pollution in Ebro delta microbial mats, using high-resolution microscopic techniques",Aquatic Toxicology,Aquatic Toxicology,2011,"cyanobacteria,lead,bioindicators,clsm,sem-edx,tem-edx","maldonado_j,sole_a,puyen_z_m,esteve_i",all,all
WOS:000464488500027,Genome-centric metagenomics resolves microbial diversity and prevalent truncated denitrification pathways in a denitrifying PAO-enriched bioprocess,Water Research,Water Research,2019,"denitrifying pao,denitrification,enhanced biological phosphorus removal (ebpr),nitrous oxide,metagenome-assembled genomes (mags)","gao_han,mao_yanping,zhao_xiaotian,liu_wen-tso,zhang_tong,wells_george",all,all
WOS:000365599500006,Aerobic granulation utilizing fermented municipal wastewater under low pH and alkalinity conditions in a sequencing batch reactor,Environmental Technology,Environmental Technology,2016,"aerobic granular sludge,fermented municipal wastewater,sequencing batch reactor,nutrient removal,ph","leong_jason,rezania_babak,mavinic_don_s",all,all
WOS:000287259400018,Performance and microbial population variation in a plug-flow A(2)O process treating domestic wastewater with low C/N ratio,Journal of Chemical Technology and Biotechnology,Journal of Chemical...,2011,"wastewater treatment,a(2)o process,denitrifying phosphorus removal,pcr-dgge","wu_chang-yong,peng_yong-zhen,wan_chun-li,wang_shu-ying",all,all
WOS:000347756900075,EBP2R-An innovative enhanced biological nutrient recovery activated sludge system to produce growth medium for green microalgae cultivation,Water Research,Water Research,2015,"wastewater resources management,water,phosphorus and nitrogen recovery,micro-algae cultivation,process modelling,uncertainty and global sensitivity analysis","valuerde-perez_borja,ramin_elham,smets_barth_f,plosz_benedek_gy",all,all
WOS:000350322700008,Evaluation of Simultaneous Nutrient and COD Removal with Polyhydroxybutyrate (PHB) Accumulation Using Mixed Microbial Consortia under Anoxic Condition and Their Bioinformatics Analysis,Plos One,Plos One,2015,NA,"jena_jyotsnarani,kumar_ravindra,dixit_anshuman,pandey_sony,das_trupti",all,all
WOS:000263785300008,A comparative study of methanol as a supplementary carbon source for enhancing denitrification in primary and secondary anoxic zones,Biodegradation,Biodegradation,2009,"denitrification,external carbon,methanol,methanol utilizing denitrifiers","ginige_maneesha_p,bowyer_jocelyn_c,foley_leah,keller_juerg,yuan_zhiguo",all,all
WOS:000424111300025,Comparing Bacterial Diversity in Two Full-Scale Enhanced Biological Phosphate Removal Reactors Using 16S Amplicon Pyrosequencing,Polish Journal of Environmental Studies,Polish Journal of...,2018,"ebpr,microbial diversity,aerobic zone,anaerobic zone,pyrosequencing","kamika_ilunga,azizi_shohreh,tekere_memory",all,all
WOS:000478725200001,Plantwide modelling - anaerobic digestion of waste sludge from parent nutrient (N and P) removal systems,Water Sa,Water Sa,2019,"phosphorus removal,activated sludge,anaerobic digestion,plant-wide modelling","ikumi_d_s,ekama_g_a",all,all
WOS:000257993800014,Fine-scale population structure of Accumulibacter phosphatis in enhanced biological phosphorus removal sludge,Journal of Microbiology and Biotechnology,Journal of Microbiology...,2008,"ebpr,diversity,rhodocyclus,""candidatus accumulibacter phosphatis"",phac","wang_qian,shao_yongqi,huong_vu_thi_thu,park_woo-jun,park_jong-moon,jeon_che-ok",all,all
WOS:000177989100026,Population dynamics in wastewater treatment plants with enhanced biological phosphorus removal operated with and without nitrogen removal,Water Science and Technology,Water Science and...,2002,"activated sludge,nutrient removal,polyphosphate-accumulating organisms (paos),rhodocyclus","lee_n,jansen_jl,aspegren_h,henze_m,nielsen_ph,wagner_m",all,all
WOS:000498918600001,Effect of Varying Nitrate Concentrations on Denitrifying Phosphorus Uptake by DPAOs With a Molecular Insight Into Pho Regulon Gene Expression,Frontiers in Microbiology,Frontiers in Microbiology,2019,"denitrifying phosphorus removal,dpao,single stage anoxic reactor,pho regulon,negative regulation,transcriptional repression,poly-phosphate accumulation","mukherjee_chandan,chowdhury_rajojit,begam_mst_momtaj,ganguli_sayak,basak_ritabrata,chaudhuri_basab,ray_krishna",all,all
WOS:000170999300005,Proton- and sodium-coupled phosphate transport systems and energy status of Yarrowia lipolytica cells grown in acidic and alkaline conditions,Journal of Membrane Biology,Journal of Membrane...,2001,"yarrowia lipolytica,yeast,plasma membrane,phosphate transport,phosphate regulation","zvyagilskaya_r,parchomenko_o,abramova_n,allard_p,panaretakis_t,pattison-granberg_j,persson_bl",all,all
WOS:000285631000012,Monitoring of microbial storage products and the efficiency of an activated sludge plant performing anoxic phosphorus removal under different operational conditions,Desalination and Water Treatment,Desalination and Water...,2010,"acetate,continuous flow plant,denitrifying phosphorus removal,dpaos,polyhydroxyalkanoates","zafiriadis_ilias,kapagiannidis_anastasios_g,aivasidis_alexander",all,all
WOS:000342491600024,Impacts of Multiwalled Carbon Nanotubes on Nutrient Removal from Wastewater and Bacterial Community Structure in Activated Sludge,Plos One,Plos One,2014,NA,"hai_reti,wang_yulin,wang_xiaohui,du_zhize,li_yuan",all,all
WOS:000248782300013,"Simultaneous nitrification, denitrification, and phosphorus removal in single-tank low-dissolved-oxygen systems under cyclic aeration",Water Environment Research,Water Environment Research,2007,"simultaneous nitrification and denitrification,low dissolved oxygen concentration,solids retention time,cyclic aeration,nitrite shunt,enhanced biological phosphorus removal","ju_lu-kwang,huang_lin,trivedi_hiren",all,all
WOS:000087035400011,Microbial community changes in biological phosphate-removal systems on altering sludge phosphorus content,Microbiology-Uk,Microbiology-Uk,2000,"activated sludge,biological phosphate removal,biomarker,dgge,16s rdna","liu_wt,linning_kd,nakamura_k,mino_t,matsuo_t,forney_lj",all,all
WOS:000458224000016,An integrated mechanistic modeling of a facultative pond: Parameter estimation and uncertainty analysis,Water Research,Water Research,2019,"waste stabilization pond,integrated mechanistic model,sensitivity analysis,identifiability analysis,parameter estimation,uncertainty analysis","ho_long_t,alvarado_andres,larriva_josue,pompeu_cassia,goethals_peter",all,all
WOS:000358805000032,Response of a sludge-minimizing lab-scale BNR reactor when the operation is changed to real primary effluent from synthetic wastewater,Water Research,Water Research,2015,"sludge minimization,biological nutrients removal,primary effluent wastewater,nitrifiers,pao","huang_pei,goel_ramesh",all,all
WOS:000306977800004,Modeling External Carbon Addition in Biological Nutrient Removal Processes with an Extension of the International Water Association Activated Sludge Model,Water Environment Research,Water Environment Research,2012,"activated sludge,asm2d,biological phosphorus removal,denitrification,external carbon,mathematical modeling,nutrient removal","swinarski_m,makinia_j,stensel_h_d,czerwionka_k,drewnowski_j",all,all
WOS:000491266200001,"Survey of full-scale sidestream enhanced biological phosphorus removal (S2EBPR) systems and comparison with conventional EBPRs in North America: Process stability, kinetics, and microbial populations",Water Environment Research,Water Environment Research,2019,"ebpr,gaos,microbial ecology,paos,sidestream ebpr","onnis-hayden_annalisa,srinivasan_varun,tooker_nicholas_b,li_guangyu,wang_dongqi,barnard_james_l,bott_charles,dombrowski_paul,schauer_peter,menniti_adrienne,shaw_andrew,stinson_beverly,stevens_gerry,dunlap_patrick,takacs_imre,mcquarrie_jim,phillips_heather,lambrecht_angela,analla_howard,russell_andy,gu_april_z",all,all
WOS:000188115300073,"Use of stable-isotope probing, full-cycle rRNA analysis, and fluorescence in situ hybridization-microautoradiography to study a methanol-fed denitrifying microbial community",Applied and Environmental Microbiology,Applied and Environmental...,2004,NA,"ginige_mp,hugenholtz_p,daims_h,wagner_m,keller_j,blackall_ll",all,all
WOS:000381500700037,(p)ppGpp-Dependent Persisters Increase the Fitness of Escherichia coli Bacteria Deficient in Isoaspartyl Protein Repair,Applied and Environmental Microbiology,Applied and Environmental...,2016,NA,"vandenberg_kelsey_e,ahn_sarah,visick_jonathan_e",all,all
WOS:000230375300036,Dietary phosphorus effects on characteristics of mechanically separated dairy manure,Transactions of the Asae,Transactions of the...,2005,"lactating cows,manure treatment,research-scale manure separation","knowlton_kf,love_ng,parsons_ca",all,all
WOS:000386072300006,Role of Phosphate Transport System Component PstB1 in Phosphate Internalization by Nostoc punctiforme,Applied and Environmental Microbiology,Applied and Environmental...,2016,NA,"hudek_l,premachandra_d,webster_w_a_j,brau_l",all,all
WOS:000239498100031,Applicability of experience from laboratory reactors with biological phosphorus removal in full-scale plants,Water Science and Technology,Water Science and...,2006,"acetate,enhanced biological phosphorus removal,glycogen-accumulating organisms,polyphosphate-accumulating organisms,propionate,wastewater","tykesson_e,blackall_l_l,kong_y,nielsen_p_h,jansen_j_la_cour",wwt,wwt
WOS:000342314700013,Effect of different carbon sources on the biological phosphorus removal by a sequencing batch reactor using pressurized pure oxygen,Biotechnology and Biotechnological Equipment,Biotechnology and Biotechnological...,2014,"pressurized pure oxygen sequencing batch reactor (posbr),polyphosphate-accumulating organisms (paos),carbon source,biological phosphorus removal","wei_jie,imai_tsuyoshi,higuchi_takaya,arfarita_novi,yamamoto_koichi,sekine_masahiko,kanno_ariyo",wwt,wwt
WOS:000300304100001,An Observation on Sludge Granulation in an Enhanced Biological Phosphorus Removal Process,Water Environment Research,Water Environment Research,2012,"enhanced biological phosphorus removal,sequencing batch reactor,polyphosphate accumulating organisms,sludge granules,candidatus accumulibacter phosphatis","ong_ying_hui,chua_adeline_seak_may,lee_boon_pin,ngoh_gek_cheng,hashim_mohd_ali",wwt,wwt
WOS:000262750000013,Robustness of sludge enriched with short SBR cycles for biological nutrient removal,Bioresource Technology,Bioresource Technology,2009,"enhanced biological phosphorus removal (ebpr),polyphosphate accumulating organisms (pao),glycogen accumulating organisms (gao),nitrogen removal,temperature","freitas_filomena,temudo_margarida_f,carvalho_gilda,oehmen_adrian,reis_maria_a_m",wwt,wwt
WOS:000220160000002,"Enhanced biological phosphorus removal from wastewater by biomass with different phosphorus contents, part I: Experimental results and comparison with metabolic models",Water Environment Research,Water Environment Research,2003,"enhanced biological phosphorus removal,activated sludge,bacterial storage products,polyphosphate,glycogen","schuler_aj,jenkins_d",wwt,wwt
WOS:000462588700035,Granulation of activated sludge using butyrate and valerate as additional carbon source and granular phosphorus removal capacity during wastewater treatment,Bioresource Technology,Bioresource Technology,2019,"enhanced biological phosphorus removal (ebpr),aerobic granular sludge (ags),butyrate,valerate,polyphosphate-accumulating organisms (paos)","cai_wei,huang_wenli,lei_zhongfang,zhang_zhenya,lee_duu-jong,adachi_yasuhisa",wwt,wwt
WOS:000327911700007,A novel post denitrification configuration for phosphorus recovery using polyphosphate accumulating organisms,Water Research,Water Research,2013,"phosphorus removal,phosphorus recovery,enhanced biological phosphorus removal,polyphosphate accumulating organisms,denitrifying polyphosphate accumulating organisms,wastewater treatment,post denitrification","wong_pan_yu,cheng_ka_yu,kaksonen_anna_h,sutton_david_c,ginige_maneesha_p",wwt,wwt
WOS:000222215200006,Effects of pH and substrate on the competition between glycogen and phosphorus accumulating organisms,Journal of Environmental Science and Health Part A-Toxic/Hazardous Substances and Environmental Engineering,Journal of Environmental...,2004,"biological phosphorus removal,phosphate accumulating organism,glycogen accumulating organism","cokgor_eu,yagci_no,randall_cw,artan_n,orhon_d",wwt,wwt
WOS:000177989100021,Presence of Rhodocyclus in a full-scale wastewater treatment plant and their participation in enhanced biological phosphorus removal,Water Science and Technology,Water Science and...,2002,"dapi,ebpr,fish,phosphorus removal,polyphosphate,rhodocyclus","zilles_jl,hung_ch,noguera_dr",wwt,wwt
WOS:000316032100019,Phosphorus removal and simultaneous sludge reduction in humus soil sequencing batch reactor treating domestic wastewater,Chemical Engineering Journal,Chemical Engineering Journal,2013,"humus soil,sludge reduction,enhanced biological phosphorus removal,polyphosphate accumulating organisms,glycogen accumulating organisms","wu_min,zhu_rui,zhu_heguang,dai_xiaohu,yang_jian",wwt,wwt
WOS:000294277100010,Assessment of a bioaugmentation strategy with polyphosphate accumulating organisms in a nitrification/denitrification sequencing batch reactor,Bioresource Technology,Bioresource Technology,2011,"activated sludge,bioaugmentation,enhanced biological phosphorus removal (ebpr),nitrogen removal,polyphosphate accumulating organisms (pao)","taya_carlota,guisasola_albert,baeza_juan_a",wwt,wwt
WOS:000170035100007,Enhanced biological phosphorus removal in an anaerobic-aerobic sequencing batch reactor: Effect of pH,Water Environment Research,Water Environment Research,2001,"enhanced biological phosphorus removal,sequencing batch reactors,microbial competition,glycogen-accumulating organisms,polyphosphate-accumulating organisms,ph,glycogen","jeon_co,lee_ds,lee_mw,park_jm",wwt,wwt
WOS:000362308200019,Long-term effect of Cu (II) on the phosphorous removal performance in enhanced biological phosphorous removal systems,Chemical Engineering Journal,Chemical Engineering Journal,2015,"enhanced biological phosphorus removal,cu (ii),phosphorus accumulating organisms,glycogen accumulating organisms","wu_min,jiang_xiaolin,lv_yaoling,zhou_jie,yuan_lu,jia_yulei,wang_yayi",wwt,wwt
WOS:000289837000009,Effect of Anaerobic HRT on Biological Phosphorus Removal and the Enrichment of Phosphorus Accumulating Organisms,Water Environment Research,Water Environment Research,2011,"enhanced biological phosphorus removal,volatile fatty acids,polyphosphate,qpcr,dgge,polyphosphate accumulating organisms","coats_erik_r,watkins_david_l,brinkman_cynthia_k,loge_frank_j",wwt,wwt
WOS:000168506200005,Effect of operating parameters on anoxic biological phosphorus removal in anaerobic anoxic sequencing batch reactor,Environmental Technology,Environmental Technology,2001,"activated sludge,biological phosphorus removal,polyphosphate,sequencing batch reactor,sludge retention time","merzouki_m,bernet_n,delgenes_jp,moletta_r,benlemlih_m",wwt,wwt
WOS:000177441400005,Characterization of an acetate-degrading sludge without intracellular accumulation of polyphosphate and glycogen,Water Research,Water Research,2002,"acetate,glycogen,polyphosphate,wastewater,16s rdna","fang_hhp,zhang_t,liu_y",wwt,wwt
WOS:000319652400016,Microbial community changes during the start-up of an anaerobic/aerobic/anoxic-type sequencing batch reactor,Environmental Technology,Environmental Technology,2013,"enhanced biological phosphorus removal,glycogen-accumulating organisms,polyphosphate-accumulating organisms,polymerase chain reaction-denaturing gradient gel electrophoresis,16s ribosomal rna","zhang_qian,he_jiajie,wang_hongyu,ma_fang,yang_kai,wang_jingbo",wwt,wwt
WOS:000414817900005,A novel A-B process for enhanced biological nutrient removal in municipal wastewater reclamation,Chemosphere,Chemosphere,2017,"a-b process,mainstream nitritation-denitritation,enhanced biological phosphorus removal,nitrous oxide","xu_guangjing,wang_han,gu_jun,shen_nan,qiu_zheng,zhou_yan,liu_yu",wwt,wwt
WOS:000177989100025,Polyphosphate kinase genes from activated sludge carrying out enhanced biological phosphorus removal,Water Science and Technology,Water Science and...,2002,"activated sludge,biological phosphorus removal,polyphosphate kinase,rhodocyclus","mcmahon_kd,jenkins_d,keasling_jd",wwt,wwt
WOS:000358805000001,Microbiological study of bacteriophage induction in the presence of chemical stress factors in enhanced biological phosphorus removal (EBPR),Water Research,Water Research,2015,"biological phosphorus removal,ebpr upset,bacteriophage induction,heavy metal,cyanide,antibiotic","motlagh_amir_mohaghegh,bhattacharjee_ananda_s,goel_ramesh",wwt,wwt
WOS:000286782700066,Effect of aspartate and glutamate on the fate of enhanced biological phosphorus removal process and microbial community structure,Bioresource Technology,Bioresource Technology,2011,"enhanced biological phosphorus removal,aspartate utilization,glutamate utilization,actinobacterial paos,rhodocyclus-related paos","zengin_gulsum_emel,artan_nazik,orhon_derin,satoh_hiroyasu,mino_takashi",wwt,wwt
WOS:000239498100014,Fine-scale differences between Accumulibacter-like bacteria in enhanced biological phosphorus removal activated sludge,Water Science and Technology,Water Science and...,2006,"accumulibacter,enhanced biological phosphorus removal,polyphosphate accumulating organisms","he_s,gu_a_z,mcmahon_k_d",wwt,wwt
WOS:000183355600002,Identification and comparison of aerobic and denitrifying polyphosphate-accumulating organisms,Biotechnology and Bioengineering,Biotechnology and Bioengineering,2003,"polyphosphate-accumulating organisms (paos),denitrifying polyphosphate-accumulating organisms (dpaos),fluorescence in situ hybridization (fish),accumulibacter,activated sludge,enhanced biological phosphorus removal (ebpr)","zeng_rj,saunders_am,yuan_zg,blackall_ll,keller_j",wwt,wwt
WOS:000317813400036,Low Acetate Concentrations Favor Polyphosphate-Accumulating Organisms over Glycogen-Accumulating Organisms in Enhanced Biological Phosphorus Removal from Wastewater,Environmental Science and Technology,Environmental Science and...,2013,NA,"tu_yunjie,schuler_andrew_j",wwt,wwt
WOS:000232417800031,The effect of pH on the competition between polyphosphate-accumulating organisms and glycogen-accumulating organisms,Water Research,Water Research,2005,"enhanced biological phosphorus removal (ebpr),polyphosphate-accumulating organisms (pao),glycogen-accumulating organisms (gao),volatile fatty acids (vfa),ph,fluorescence in situ hybridisation (fish)","oehmen_a,vives_mt,lu_hb,yuan_zg,keller_j",wwt,wwt
WOS:000359833900015,Effect of a Humus Soil Side-Stream Reactor (HSR) on the Bacterial Characteristics in Enhanced Biological Phosphorus Removal Process,Journal of Chemical Engineering of Japan,Journal of Chemical...,2015,"polyphosphate accumulating organisms,glycogen accumulating organisms,humus soil side-stream reactor,polyphosphate kinase","wu_min,zhu_rui,ma_huirong,zhu_heguang,dai_xiaohu,yang_jian",wwt,wwt
WOS:000445519000017,Performance of enhanced biological phosphorus removal and population dynamics of phosphorus accumulating organisms in sludge-shifting sequencing batch reactors,Water Science and Technology,Water Science and...,2018,"enhanced biological phosphorus removal (ebpr),fluorescence in situ hybridization (fish),glycogen accumulating organisms (gaos),phosphorus accumulating organisms (paos),sludge shifting","pan_yang,ruan_wenquan,huang_yong,chen_qianqian,miao_hengfeng,wang_tao",wwt,wwt
WOS:000237540100003,Competition between polyphosphate and glycogen accumulating organisms in enhanced biological phosphorus removal systems with acetate and propionate as carbon sources,Journal of Biotechnology,Journal of Biotechnology,2006,"enhanced biological phosphorus removal (ebpr),polyphosphate accumulating organisms (paos),glycogen accumulating organisms (gaos),acetate,propionate,microbial competition","oehmen_adrian,saunders_aaron_m,vives_m_teresa,yuan_zhiguo,keller_jurg",wwt,wwt
WOS:000251639800019,Characterizing the biochemical activity of full-scale enhanced biological phosphorus removal systems: A comparison with metabolic models,Biotechnology and Bioengineering,Biotechnology and Bioengineering,2008,"enhanced biological phosphorus removal,full-scale sludge,polyphosphate accumulating organisms,metabolic models,reducing power,volatile fatty acids","pijuan_m,oehmen_a,baeza_j_a,casas_c,yuan_z",wwt,wwt
WOS:000232585500015,Aerobic phosphorus release linked to acetate uptake: Influence of PAO intracellular storage compounds,Biochemical Engineering Journal,Biochemical Engineering Journal,2005,"enhanced biological phosphorus removal,polyphosphate accumulating organisms,oxygen uptake rate,wastewater treatment","pijuan_m,guisasola_a,baeza_ja,carrera_j,casas_c,lafuente_j",wwt,wwt
WOS:000394723200042,Nickel toxicity to the performance and microbial community of enhanced biological phosphorus removal system,Chemical Engineering Journal,Chemical Engineering Journal,2017,"nickel toxicity,phosphorus removal,polyphosphate accumulating organisms,glycogen accumulating organisms","sun_jian,yang_qi,wang_dongbo,wang_shana,chen_fei,zhong_yu,yi_kaixin,yao_fubing,jiang_chen,li_sibei,li_xiaoming,zeng_guangming",wwt,wwt
WOS:000367951400021,A novel scheme for denitrifying biological phosphorus removal via nitrite from nutrient-rich anaerobic effluents in a short-cut sequencing batch reactor,Journal of Chemical Technology and Biotechnology,Journal of Chemical...,2016,"biological phosphorus removal,reject water,best available carbon source,sequencing batch reactor","frison_nicola,katsou_evina,malamis_simos,fatone_francesco",wwt,wwt
WOS:000224952400033,Modelling and calibration of phosphate and glycogen accumulating organism competition for acetate uptake in a sequencing batch reactor,Water Science and Technology,Water Science and...,2004,"activated sludge,enhanced biological phosphate removal,glycogen accumulating organism,phosphate accumulating organism,polyhydroxyalkonates,sequencing batch reactor","yagci_n,insel_g,artan_n,orhon_d",wwt,wwt
