uid,title,journal_fix,journal_short,year_fix,keywords_fix,authors_fix,environment,category
WOS:000423304700062,The feasibility of enhanced biological phosphorus removal in the novel oxic/extended idle process using fermentation liquid from sludge fermentation,Rsc Advances,Rsc Advances,2018,NA,"liu_yang,li_xiaoming,zhao_jianwei,wang_dongbo,yang_qi,zeng_guangming",wwt,wwt
WOS:000306683500009,Effect of oligochaete worm body fluids on biological phosphorus removal in a bench-scale EBPR system,Environmental Technology,Environmental Technology,2012,"oligochaetes,enhanced biological phosphorus removal (ebpr),polyphosphate-accumulating organisms (paos),poly-beta-hydroxyalkanoate (pha),nitrite","jiang_tao,du_shaoting,sun_peide,zhu_mingshan",wwt,wwt
WOS:000238350700012,Sequencing batch membrane biofilm reactor for simultaneous nitrogen and phosphorus removal: Novel application of membrane-aerated biofilm,Biotechnology and Bioengineering,Biotechnology and Bioengineering,2006,"gas-permeable membrane,sequencing batch membrane biofilm reactor (sbmbfr),membrane aeration,simultaneous nitrogen and phosphorus removal,denitrifying polyphosphate-accumulating organisms (dnpaos)","terada_akihiko,yamamoto_tetsuya,tsuneda_satoshi,hirata_akira",wwt,wwt
WOS:000177989100031,Density separation and molecular methods to characterize enhanced biological phosphorus removal system populations,Water Science and Technology,Water Science and...,2002,"denaturing gradient gel electrophoresis,density,enhanced biological phosphorus removal","schuler_aj,onuki_m,satoh_h,mino_t",wwt,wwt
WOS:000384222200020,Impact of multiple wastewater feedings on the efficiency of nutrient removal in an IFAS-MBSBBR: number of feedings vs. efficiency of nutrient removal,Water Science and Technology,Water Science and...,2016,"biological nutrient removal,denitrifying phosphorus removal,glycogen-accumulating organisms,moving bed,polyphosphate-accumulating organisms,wastewater feeding","podedworna_j,zubrowska-sudol_m,sytek-szmeichel_k,gnida_a,surmacz-gorska_j,marciocha_d",wwt,wwt
WOS:000255663400004,A practical method for quantification of phosphorus- and glycogen-accumulating organism populations in activated sludge systems,Water Environment Research,Water Environment Research,2007,"enhanced biological phosphorus removal,phosphorus-accumulating organisms,glycogen-accumulating organisms,method,quantification","lopez-vazquez_carlos_m,hooijmans_christine_m,brdjanovic_damir,gijzen_huub_j,van_loosdrecht_mark_c_m",wwt,wwt
WOS:000464296400005,"Simultaneous nitrification, denitrification and phosphorus recovery (SNDPr) - An opportunity to facilitate full-scale recovery of phosphorus from municipal wastewater",Journal of Environmental Management,Journal of Environmental...,2019,"phosphorus recovery,polyphosphate accumulating organisms (paos),denitrifying polyphosphate accumulating organisms (dpaos),simultaneous nitrification denitrification and phosphorus removal (sndpr)","salehi_sara,cheng_ka_yu,heitz_anna,ginige_maneesha_p",wwt,wwt
WOS:A1992HY99000010,CONTRIBUTION OF PRECIPITATED PHOSPHATES AND ACID-SOLUBLE POLYPHOSPHATE TO ENHANCED BIOLOGICAL PHOSPHATE REMOVAL,Water Research,Water Research,1992,"acinetobacter-spp,biological phosphorus removal,polyphosphate,metal phosphate,phosphate,waste-water treatment","appeldoorn_kj,boom_aj,kortstee_gjj,zehnder_ajb",wwt,wwt
WOS:000281638900024,Filamentous members of cluster III Defluviicoccus have the in situ phenotype expected of a glycogen-accumulating organism in activated sludge,Fems Microbiology Ecology,Fems Microbiology Ecology,2010,"activated sludge,bulking,candidatus monilibacter batavus,defluviicoccus,fish-mar,nostocoida limicola","mcilroy_simon_j,nittami_tadashi,seviour_elizabeth_m,seviour_robert_j",wwt,wwt
WOS:000384711900014,Distinctive denitrifying capabilities lead to differences in N2O production by denitrifying polyphosphate accumulating organisms and denitrifying glycogen accumulating organisms,Bioresource Technology,Bioresource Technology,2016,"denitrification,dgao,dpao,multiple electron acceptors,nitrous oxide","ribera-guardia_anna,marques_ricardo,arangio_corrado,carvalheira_monica,oehmen_adrian,pijuan_maite",wwt,wwt
WOS:000247960300009,Distributed state simulation of endogenous processes in biological wastewater treatment,Biotechnology and Bioengineering,Biotechnology and Bioengineering,2007,"distributed states,endogenous,degradation,modeling,phosphorus removal,population dynamics,wastewater treatment","schuler_andrew_j,jassby_david",wwt,wwt
WOS:000083229200017,"Enrichment, phylogenetic analysis and detection of a bacterium that performs enhanced biological phosphate removal in activated sludge",Systematic and Applied Microbiology,Systematic and Applied...,1999,"activated sludge,in situ hybridization,probes,rrna,ebpr,rhodocyclus","hesselmann_rpx,werlen_c,hahn_d,van_der_meer_jr,zehnder_ajb",wwt,wwt
WOS:000225194700001,An extension of ASM2d including pH calculation,Water Research,Water Research,2004,"aquatic chemistry,asm2d,mathematical modeling,minteqa2,ph,sbr","serralta_j,ferrer_j,borras_l,seco_a",wwt,wwt
WOS:000278415300007,"Analysis of the Fine-Scale Population Structure of ""Candidatus Accumulibacter phosphatis"" in Enhanced Biological Phosphorus Removal Sludge, Using Fluorescence In Situ Hybridization and Flow Cytometric Sorting",Applied and Environmental Microbiology,Applied and Environmental...,2010,NA,"kim_jeong_myeong,lee_hyo_jung,kim_sun_young,song_jae_jun,park_woojun,jeon_che_ok",wwt,wwt
WOS:000369461800048,Phosphate release involving PAOs activity during anaerobic fermentation of ESPR sludge and the extension of ADM1,Chemical Engineering Journal,Chemical Engineering Journal,2016,"phosphate release,enhanced biological phosphorus removal,sludge fermentation,modification of adm1,polyhydroxyalkanoate","wang_ruyi,li_yongmei,chen_wenling,zou_jinte,chen_yinguang",wwt,wwt
WOS:000229691800004,Development of a phosphate ion-selective microelectrode and its use in studies of the enhanced biological phosphorus removal (EBPR) process,Environmental Technology,Environmental Technology,2005,"phosphate ion-selective microelectrode,flocs,ebpr process,phosphate,microelectrode","wang_jj,bishop_pl",wwt,wwt
WOS:000235272400016,Putative glycogen-accumulating organisms belonging to the Alphaproteobacteria identified through rRNA-based stable isotope probing,Microbiology-Sgm,Microbiology-Sgm,2006,NA,"meyer_rl,saunders_am,blackall_ll",wwt,wwt
WOS:A1994PP80000006,BIOLOGY OF POLYPHOSPHATE-ACCUMULATING BACTERIA INVOLVED IN ENHANCED BIOLOGICAL PHOSPHORUS REMOVAL,Fems Microbiology Reviews,Fems Microbiology Reviews,1994,"phosphorus removal,acinetobacter,polyphosphate,biosynthesis,degradation,phosphate transport,uptake,efflux","kortstee_gjj,appeldoorn_kj,bonting_cfc,vanniel_ewj,vanveen_hw",wwt,wwt
WOS:000184595400004,Quantitative estimation of the role of denitrifying phosphate accumulating organisms in nutrient removal,Water Science and Technology,Water Science and...,2003,"biological nutrient removal,denitrifiers,denitrifying polyphosphate-accumulating organisms,(dn-pao),hydrolysis,polyphosphate-accumulating organisms (pao)","shoji_t,satoh_h,mino_t",wwt,wwt
WOS:000287259400018,Performance and microbial population variation in a plug-flow A(2)O process treating domestic wastewater with low C/N ratio,Journal of Chemical Technology and Biotechnology,Journal of Chemical...,2011,"wastewater treatment,a(2)o process,denitrifying phosphorus removal,pcr-dgge","wu_chang-yong,peng_yong-zhen,wan_chun-li,wang_shu-ying",wwt,wwt
WOS:000220016300004,Aerobic phosphorus release linked to acetate uptake in bio-P sludge: Process modeling using oxygen uptake rate,Biotechnology and Bioengineering,Biotechnology and Bioengineering,2004,"enhanced biological phosphorus removal (ebpr),oxygen uptake rate (our),modeling,respirometry,polyphosphate accumulating organisms (pao)","guisasola_a,pijuan_m,baeza_ja,carrera_j,casas_c,lafuente_j",wwt,wwt
WOS:000498918600001,Effect of Varying Nitrate Concentrations on Denitrifying Phosphorus Uptake by DPAOs With a Molecular Insight Into Pho Regulon Gene Expression,Frontiers in Microbiology,Frontiers in Microbiology,2019,"denitrifying phosphorus removal,dpao,single stage anoxic reactor,pho regulon,negative regulation,transcriptional repression,poly-phosphate accumulation","mukherjee_chandan,chowdhury_rajojit,begam_mst_momtaj,ganguli_sayak,basak_ritabrata,chaudhuri_basab,ray_krishna",wwt,wwt
WOS:000460896800018,Performance and stability of a dynamically controlled EBPR anaerobic/aerobic granular sludge reactor,Bioresource Technology,Bioresource Technology,2019,"anaerobic dynamic control strategy,synthetic wastewater,phosphate accumulating organisms (pao)","de_vleeschauwer_flinn,caluwe_michel,dobbeleers_thomas,stes_hannah,dockx_lennert,kiekens_filip,d'aes_jolien,copot_cosmin,dries_jan",wwt,wwt
WOS:000250238500004,Biological nutrient removal in a sequencing batch reactor using ethanol as carbon source,Journal of Chemical Technology and Biotechnology,Journal of Chemical...,2007,"biological nutrient removal,ethanol,polyphosphate-accumulating organisms,sequencing batch reactor","puig_sebastia,coma_marta,van_loosdrecht_mark_c_m,colprim_jesus,balaguer_maria_d",wwt,wwt
WOS:000319020900013,Comparing the long-term effect of high P/COD influent on enhancement ofphosphate-accumulating organisms between acetate- and propionate-fed reactors,Journal of Chemical Technology and Biotechnology,Journal of Chemical...,2013,"phosphorus removal,high phosphate loading,phosphate-accumulating organisms (paos),population dynamics","hsu_chih-hsun,chang_wei-chin,chen_jian-jyun,wu_jhong-syun",wwt,wwt
WOS:000403987500033,Dynamics of microbial community structure and nutrient removal from an innovative side-stream enhanced biological phosphorus removal process,Journal of Environmental Management,Journal of Environmental...,2017,"side-stream ebpr,phosphate accumulating organisms,real time pcr,next generation sequencing","islam_md_shahinoor,zhang_yanyan,dong_shimiao,mcphedran_kerry_n,rashed_ehab_m,el-shafei_maha_m,noureldin_ahmed_m,el-din_mohamed_gamal",wwt,wwt
WOS:000306075100001,Molecular Characterization of Denitrifying Bacteria Isolated from the Anoxic Reactor of a Modified DEPHANOX Plant Performing Enhanced Biological Phosphorus Removal,Water Environment Research,Water Environment Research,2012,"denitrifying bacteria,dephanox,16s rrna gene","zafiriadis_ilias,ntougias_spyridon,mirelis_paraskevi,kapagiannidis_anastasios_g,aivasidis_alexander",wwt,wwt
WOS:000290406200008,Phosphate uptake performance of bacteria isolated from a full-scale Izmir municipal wastewater treatment plant,Environmental Technology,Environmental Technology,2011,"phosphate uptake,activated sludge,enhanced biological phosphorus removal,ebpr,acinetobacter","pasayeva_p,gezgin_y,pekin_g,eltem_r",wwt,wwt
WOS:A1991GT94200031,"ANALYSIS OF THE POLYPHOSPHATE-ACCUMULATING MICROFLORA IN PHOSPHORUS-ELIMINATING, ANAEROBIC-AEROBIC ACTIVATED-SLUDGE SYSTEMS BY USING DIAMINOPROPANE AS A BIOMARKER FOR RAPID ESTIMATION OF ACINETOBACTER SPP",Applied and Environmental Microbiology,Applied and Environmental...,1991,NA,"auling_g,pilz_f,busse_hj,karrasch_s,streichan_m,schon_g",wwt,wwt
WOS:000272452900005,Acetate uptake efficiency of polyphosphate-accumulating organisms under exposure to surfactants,Water Science and Technology,Water Science and...,2009,"acetate uptake,ae,las,phosphate release,polyphosphate-accumulating organisms","tsuji_k,fujita_m,furumai_h",wwt,wwt
WOS:000329274900008,Seasonal bacterial community dynamics in a full-scale enhanced biological phosphorus removal plant,Water Research,Water Research,2013,"enhanced biological phosphorus removal,""candidatus accumulibacter phosphatis"",activated sludge","flowers_jason_j,cadkin_tracey_a,mcmahon_katherine_d",wwt,wwt
WOS:000309299300053,Impact of Cr(VI) on P removal performance in enhanced biological phosphorus removal (EBPR) system based on the anaerobic and aerobic metabolism,Bioresource Technology,Bioresource Technology,2012,"cr(vi),enzymes,poly-beta-hydroxyalkanoates (pha),glycogen,recovery treatment","fang_jing,sun_pei-de,xu_shao-juan,luo_tao,lou_ju-qing,han_jing-yi,song_ying-qi",wwt,wwt
WOS:000384322700059,Improved biological phosphorus removal induced by an oxic/extended-idle process using glycerol and acetate at equal fractions,Rsc Advances,Rsc Advances,2016,NA,"zhao_jianwei,wang_dongbo,li_xiaoming,zeng_guangming,yang_qi",wwt,wwt
WOS:000385902000010,Denitrification of nitrate and nitrite by 'Candidatus Accumulibacter phosphatis' clade IC,Water Research,Water Research,2016,"'candidatus accumulibacter phosphatis' clade i,denitrification,nitrate,nitrite,acetate,propionate,ebpr","saad_sondos_a,welles_laurens,abbas_ben,lopez-vazquez_carlos_m,van_loosdrecht_mark_c_m,brdjanovic_damir",wwt,wwt
WOS:000321313800026,Biological nutrient removal in a continuous anaerobic-aerobic-anoxic process treating synthetic domestic wastewater,Chemical Engineering Journal,Chemical Engineering Journal,2013,"aoa process,domestic wastewater,biological nutrient removal,low dissolved oxygen,poly-beta-hydroxybutyrate","liu_gang,xu_xiangyang,zhu_liang,xing_shuo,chen_jianyu",wwt,wwt
WOS:000276125500017,Dynamics and function of intracellular carbohydrate in activated sludge performing enhanced biological phosphorus removal,Biochemical Engineering Journal,Biochemical Engineering Journal,2010,"enhanced biological phosphorus removal,carbohydrate,intracellular,polyphosphate,starvation","wu_guangxue,rodgers_michael",wwt,wwt
WOS:000319333600010,Metabolic model for the filamentous 'Candidatus Microthrix parvicella' based on genomic and metagenomic analyses,Isme Journal,Isme Journal,2013,"microthrix parvicella,filamentous bacteria,activated sludge bulking and foaming,lipid-accumulating bacteria,triacylglycerol,whole genome sequence","mcilroy_simon_jon,kristiansen_rikke,albertsen_mads,karst_soren_michael,rossetti_simona,nielsen_jeppe_lund,tandoi_valter,seviour_robert_james,nielsen_per_halkjaer",wwt,wwt
WOS:000404199100009,"Population dynamics of ""Candidatus Accumulibacter phosphatis"" under the modes of complete nitrification and partial nitrification (nitritation) in domestic wastewater treatment system",Biochemical Engineering Journal,Biochemical Engineering Journal,2017,"candidatus accumulibacter phosphatis,polyphosphate kinase gene(ppk1),nitrification,nitritation,population dynamics","zeng_wei,wang_anqi,li_chao,guo_yu,peng_yongzhen",wwt,wwt
WOS:000295386800010,The nature of the carbon source rules the competition between PAO and denitrifiers in systems for simultaneous biological nitrogen and phosphorus removal,Water Research,Water Research,2011,"carbon source,ebpr,nitrate,oho,pao,vfa","guerrero_javier,guisasola_albert,baeza_juan_a",wwt,wwt
WOS:000408275500040,Effect of ciprofloxacin on biological nitrogen and phosphorus removal from wastewater,Science of the Total Environment,Science of the...,2017,"ciprofloxacin,nitrogen and phosphorus removal,nitrification,denitrification,polyphosphate accumulating organisms","yi_kaixin,wang_dengbo,yang_qi,li_xiaoming,chen_hongbo,sun_jian,an_hongxue,wang_liqun,deng_yongchao,liu_jun,zeng_guangming",wwt,wwt
WOS:000475814500005,Resolving the individual contribution of key microbial populations to enhanced biological phosphorus removal with Raman-FISH,Isme Journal,Isme Journal,2019,NA,"fernando_eustace_y,mcllroy_simon_jon,nierychlo_marta,herbst_florian-alexander,petriglieri_francesca,schmid_markus_c,wagner_michael,nielsen_jeppe_lund,nielsen_per_halkjaer",wwt,wwt
WOS:000341579700010,"Metagenomic characterization of 'Candidatus Defluviicoccus tetraformis strain TFO71', a tetrad-forming organism, predominant in an anaerobic-aerobic membrane bioreactor with deteriorated biological phosphorus removal",Environmental Microbiology,Environmental Microbiology,2014,NA,"nobu_masaru_k,tamaki_hideyuki,kubota_kengo,liu_wen-tso",wwt,wwt
WOS:000334438200033,"The Impact of Microbial Ecology and Chemical Profile on the Enhanced Biological Phosphorus Removal (EBPR) Process: A Case Study of Northern Wastewater Treatment Works, Johannesburg",International Journal of Environmental Research and Public Health,International Journal of...,2014,"wastewater,ebpr,polyphosphate-accumulating organisms,glycogen-accumulating organisms,volatile fatty acids","kamika_ilunga,coetzee_martie,mamba_bhekie_brilliance,msagati_titus,momba_maggy_n_b",wwt,wwt
WOS:000326123600016,Phosphorus Removal in an Enhanced Biological Phosphorus Removal Process: Roles of Extracellular Polymeric Substances,Environmental Science and Technology,Environmental Science and...,2013,NA,"zhang_hai-ling,fang_wei,wan_yong-peng,sheng_guo-ping,zeng_raymond_j,li_wen-wei,yu_han-qing",wwt,wwt
WOS:000267312900009,Temperature effects on glycogen accumulating organisms,Water Research,Water Research,2009,"glycogen accumulating organisms (gao),polyphosphate-accumulating organisms (pao),temperature,minimum aerobic solids retention time,competition,metabolism,stoichiometry,kinetics","lopez-vazquez_carlos_m,hooijmans_christine_m,brdjanovic_damir,gijzen_huub_j,van_loosdrecht_mark_c_m",wwt,wwt
WOS:000234052600006,Microbial population response to changes of the operating conditions in a dynamic nutrient-removal sequencing batch reactor,Bioprocess and Biosystems Engineering,Bioprocess and Biosystems...,2005,"biological nutrient removal,sequencing batch reactor,phosphorus-accumulating organisms,denitrifying phosphorus-accumulating organisms,glycogen-accumulating organisms,kinetics","freitas_f,temudo_m,reis_mam",wwt,wwt
WOS:000175350500005,The effect of media on evaluating the phosphate uptake capacity of activated sludge bacterial isolates,Water Sa,Water Sa,2002,NA,"reddy_t,bux_f",wwt,wwt
WOS:000242677200010,Experimental and model-based evaluation of the role of denitrifying polyphosphate accumulating organisms at two large scale WWTPs in northern Poland,Water Science and Technology,Water Science and...,2006,"batch test,dynamic simulation,ebpr,full-scale wwtp,mathematical modelling,pao","makinia_j,rosenwinkel_k_-h,swinarski_m,dobiegala_e",wwt,wwt
WOS:000090006400006,Calibration of kinetic parameters in the IAWQ Activated Sludge Model: a pilot scale experience,Water Science and Technology,Water Science and...,2000,"activated sludge model no.2,anaerobic hydrolysis rate,fermentation rate,biological nutrient removal,mathematical simulation of activated sludge","satoh_h,okuda_e,mino_t,matsuo_t",wwt,wwt
WOS:000177989100023,Flow cytometric sorting and RFLP analysis of phosphate accumulating bacteria in an enhanced biological phosphorus removal system,Water Science and Technology,Water Science and...,2002,"community analysis,flow cytometory,ebpr,enhanced biological phosphorus removal,pao,phosphate-accumulating bacterium,rflp","kawaharasaki_m,manome_a,kanagawa_t,nakamura_k",wwt,wwt
WOS:000275706600027,Effects of integrated fixed film activated sludge media on activated sludge settling in biological nutrient removal systems,Water Research,Water Research,2010,"integrated fixed-film activated sludge (ifas),solids density,settleability,nitrification,enhanced biological phosphorus removal (ebpr)","kim_hyun-su,gellner_james_w,boltz_joshua_p,freudenberg_robert_g,gunsch_claudia_k,schuler_andrew_j",wwt,wwt
WOS:000386243600039,Improving municipal wastewater nitrogen and phosphorous removal by feeding sludge fermentation products to sequencing batch reactor (SBR),Bioresource Technology,Bioresource Technology,2016,"municipal wastewater,nitrogen and phosphorous removal,sludge fermentation products,sludge reduction,bacterial community","yuan_yue,liu_jinjin,ma_bin,liu_ye,wang_bo,peng_yongzhen",wwt,wwt
WOS:000432800400001,Genomic and in Situ Analyses Reveal the Micropruina spp. as Abundant Fermentative Glycogen Accumulating Organisms in Enhanced Biological Phosphorus Removal Systems,Frontiers in Microbiology,Frontiers in Microbiology,2018,"activated sludge,epbr,fermentation,micropruina,gao,pao","mcilroy_simon_j,onetto_cristobal_a,mcilroy_bianca,herbst_florian-alexander,dueholm_morten_s,kirkegaard_rasmus_h,fernando_eustace,karst_soren_m,nierychlo_marta,kristensen_jannie_m,eales_kathryn_l,grbin_paul_r,wimmer_reinhard,nielsen_per_halkjaer",wwt,wwt
WOS:000360418000036,Accumulibacter clades Type I and II performing kinetically different glycogen-accumulating organisms metabolisms for anaerobic substrate uptake,Water Research,Water Research,2015,"phosphate-accumulating organisms (pao),'candidatus accumulibacter phosphatis' cade i and ii,glycogen-accumulating organisms (gao),enhanced biological phosphorus removal (ebpr),metabolic shift,intracellular p-content","welles_l,tian_w_d,saad_s,abbas_b,lopez-vazquez_c_m,hooijmans_c_m,van_loosdrecht_m_c_m,brdjanovic_d",wwt,wwt
WOS:000281176200016,Modelling the population dynamics and metabolic diversity of organisms relevant in anaerobic/anoxic/aerobic enhanced biological phosphorus removal processes,Water Research,Water Research,2010,"polyphosphate accumulating organisms (pao),glycogen accumulating organisms (gao),kinetics,model calibration,candidatus accumulibacter,phosphatis clades,fluorescence in situ hybridisation (fish)","oehmen_a,lopez-vazquez_c_m,carvalho_g,reis_m_a_m,van_loosdrecht_m_c_m",wwt,wwt
WOS:000392768200010,New insights in the metabolic behaviour of PAO under negligible poly-P reserves,Chemical Engineering Journal,Chemical Engineering Journal,2017,"polyphosphate accumulating metabolism (pam),glycogen accumulating metabolism (gam),enhanced biological phosphorus removal (ebpr),pao type i,pao type ii","acevedo_brenda,murgui_monica,borras_luis,barat_ramon",wwt,wwt
WOS:000303348800046,Identification of Functionally Relevant Populations in Enhanced Biological Phosphorus Removal Processes Based On Intracellular Polymers Profiles and Insights into the Metabolic Diversity and Heterogeneity,Environmental Science and Technology,Environmental Science and...,2012,NA,"majed_nehreen,chernenko_tatyana,diem_max,gu_april_z",wwt,wwt
WOS:000253512200004,Selection between alcohols and volatile fatty acids as external carbon sources for EBPR,Water Research,Water Research,2008,"acetate,enhanced biological phosphorus,removal,ethanol,methanol,propionate","puig_s,coma_m,monclus_h,van_loosdrecht_m_c_m,colprim_j,balaguer_m_d",wwt,wwt
WOS:A1992HM29100007,BIOLOGICAL PHOSPHATE REMOVAL BY ACTIVATED-SLUDGE UNDER DEFINED CONDITIONS,Water Research,Water Research,1992,"activated sludge,biological phosphate removal,phosphate,polyphosphate,waste-water treatment","appeldoorn_kj,kortstee_gjj,zehnder_ajb",wwt,wwt
WOS:000239498100005,Microbial succession of glycogen accumulating organisms in an anaerobic-aerobic membrane bioreactor with no phosphorus removal,Water Science and Technology,Water Science and...,2006,"enhanced biological phosphorous removal systems,fluorescence in situ hybridization,glycogen accumulating organisms,membrane bioreactor,terminal restriction fragment length polymorphism,tetrad-forming organisms","wong_m_-t,liu_w_-t",wwt,wwt
WOS:000277746500001,In Situ Microscale Analyses of Activated Sludge Flocs in the Enhanced Biological Phosphate Removal Process by the Use of Microelectrodes and Fluorescent In Situ Hybridization,Journal of Environmental Engineering,Journal of Environmental...,2010,"diffusion coefficient,enhanced biological phosphate removal (ebpr) process,in situ monitoring,microelectrode,phosphate,clone library analysis,fluorescent in situ hybridization (fish)","lee_woo_hyoung,bishop_paul_l",wwt,wwt
WOS:000230178900006,Diversity matters: Dynamic simulation of distributed bacterial states in suspended growth biological wastewater treatment systems,Biotechnology and Bioengineering,Biotechnology and Bioengineering,2005,"wastewater treatment,pao,ebpr,distributed states,modeling",schuler_aj,wwt,wwt
WOS:000277882000022,The effect of free nitrous acid on the anabolic and catabolic processes of glycogen accumulating organisms,Water Research,Water Research,2010,"enhanced biological phosphorus removal,nitrite,free nitrous acid,inhibition,glycogen accumulating organisms,aerobic metabolism","ye_liu,pijuan_maite,yuan_zhiguo",wwt,wwt
WOS:000305467100009,Process Performance and Polyphosphate-Accumulating Organism-Glycogen-Accumulating Organism Communities in an Anaerobic/Anoxic/Oxic System Operated with Different Carbon Sources,Water Environment Research,Water Environment Research,2012,"phosphorous,nitrogen,carbon source,a(2)/o,pao,gao","girard_luiza,encina_pedro_a_g,rodriguez_elisa_r",wwt,wwt
WOS:000236102300007,"Identifying causes for N2O accumulation in a lab-scale sequencing batch reactor performing simultaneous nitrification, denitrification and phosphorus removal",Journal of Biotechnology,Journal of Biotechnology,2006,"n2o,pao,gao,sbr,denitrification,simultaneous nitrification,denitrification and phosphorus removal (sndpr)","lemaire_r,meyer_r,taske_a,crocetti_gr,keller_j,yuan_zg",wwt,wwt
WOS:000512221100048,Diclofenac inhibited the biological phosphorus removal: Performance and mechanism,Chemosphere,Chemosphere,2020,"diclofenac,enhanced biological phosphorus removal,polyhydroxyalkanoates,oxic phosphorus uptake","zhao_jianwei,xin_mingxue,zhang_jing,sun_yingjie,luo_siyi,wang_huawei,wang_yanan,bi_xuejun",wwt,wwt
WOS:000334684700028,Temperature influence on biological phosphorus removal induced by aerobic/extended-idle regime,Environmental Science and Pollution Research,Environmental Science and...,2014,"temperature influence,biological phosphorus removal,aerobic/extended-idle regime,sequencing batch reactor,wastewater treatment","chen_hong-bo,wang_dong-bo,li_xiao-ming,yang_qi,luo_kun,zeng_guang-ming",wwt,wwt
WOS:000271664600031,Production of polyhydroxybutyrate by activated sludge performing enhanced biological phosphorus removal,Bioresource Technology,Bioresource Technology,2010,"activated sludge,biodegradable plastics,enhanced biological phosphorus removal,polyhydroxybutyrate","rodgers_michael,wu_guangxue",wwt,wwt
