uid,title,journal,issue,volume,pages,date,year,authors,keywords,doi,article_no,isi_id,issn,isbn,environment,category
WOS:000332018500002,Emergency hospital admissions attributable to infective complications of prostate biopsy despite appropriate prophylaxis: need for additional infection prevention strategies?,INTERNATIONAL UROLOGY AND NEPHROLOGY,2,46,309-315,FEB,2014,"Rao, G. Gopal | Batura, Deepak",Prostate cancer | Prostate biopsy | Complications | Hospital readmissions | Length of stay | Healthcare-associated infections,10.1007/s11255-013-0529-5,NA,AB8CU,0301-1623,NA,stream,freshwater
WOS:000441882800016,Is biofilm production a prognostic marker in adults with candidaemia?,CLINICAL MICROBIOLOGY AND INFECTION,9,24,1010-1015,SEP,2018,"Munoz, P. | Agnelli, C. | Guinea, J. | Vena, A. | Alvarez-Uria, A. | Marcos-Zambrano, L. J. | Escribano, P. | Valerio, M. | Bouza, E.",Biofilm formation | Candidaemia | Mortality | Prognosis,10.1016/j.cmi.2018.01.022,NA,GQ6ZX,1198-743X,NA,stream,freshwater
WOS:000388119100018,Daptomycin versus linezolid for the treatment of vancomycin-resistant enterococcal bacteraemia: implications of daptomycin dose,CLINICAL MICROBIOLOGY AND INFECTION,10,22,,OCT,2016,"Chuang, Y-C. | Lin, H-Y. | Chen, P-Y. | Lin, C-Y. | Wang, J-T. | Chang, S-C.",Bacteraemia | Daptomycin | Linezolid | Outcome | Vancomycin-resistant enterococci,10.1016/j.cmi.2016.07.018,NA,EC4QS,1198-743X,NA,stream,freshwater
WOS:000325347000003,Prevalence of Multidrug-Resistant Pseudomonas aeruginosa and Carbapenem-Resistant Enterobacteriaceae Among Specimens From Hospitalized Patients With Pneumonia and Bloodstream Infections in the United States From 2000 to 2009,JOURNAL OF HOSPITAL MEDICINE,10,8,559-563,OCT,2013,"Zilberberg, Marya D. | Shorr, Andrew F.",,10.1002/jhm.2080,NA,230NF,1553-5592,NA,stream,freshwater
WOS:000253453800012,Outcomes of bacteremia due to Pseudomonas aeruginosa with reduced susceptibility to piperacillin-tazobactam: Implications on the appropriateness of the resistance breakpoint,CLINICAL INFECTIOUS DISEASES,6,46,862-867,MAR 15,2008,"Tam, Vincent H. | Gamez, Eric A. | Weston, Jaye S. | Gerard, Laura N. | LaRocco, Mark T. | Caeiro, Juan Pablo | Gentry, Layne O. | Garey, Kevin W.",,10.1086/528712,NA,266RD,1058-4838,NA,stream,freshwater
WOS:000436640800019,Microbiologic and clinical characteristics of biofilm-forming Candida parapsilosis isolates associated with fungaemia and their impact on mortality,CLINICAL MICROBIOLOGY AND INFECTION,7,24,771-777,JUL,2018,"Soldini, S. | Posteraro, B. | Vella, A. | De Carolis, E. | Borghi, E. | Falleni, M. | Losito, A. R. | Maiuro, G. | Trecarichi, E. M. | Sanguinetti, M. | Tumbarello, M.",Candida parapsilosis | Drug resistance | Mortality | Targeted therapy,10.1016/j.cmi.2017.11.005,NA,GL0FM,1198-743X,NA,stream,freshwater
WOS:000398373100014,UK Renal Registry 18th Annual Report: Chapter 12 Epidemiology of Reported Infections amongst Patients Receiving Dialysis for Established Renal Failure in England 2013 to 2014: a Joint Report from Public Health England and the UK Renal Registry,NEPHRON,NA,132,279-287,NA,2016,"Evans, Rebecca | Caskey, Fergus | Fluck, Richard | Crowley, Lisa | Davies, John | Nsonwu, Olisaeloka | Farrington, Ken",Clostridium Difficile | Dialysis | Epidemiology | Escherichia Coli | Established renal failure | Infection | MRSA | MSSA | Staphylococcus,10.1159/000444826,NA,EQ8ZD,1660-8151,NA,stream,freshwater
WOS:000269701800004,Etiology and Clinical Course of Febrile Neutropenia in Children With Cancer,JOURNAL OF PEDIATRIC HEMATOLOGY ONCOLOGY,9,31,623-629,SEP,2009,"Hakim, Hana | Flynn, Patricia M. | Knapp, Katherine M. | Srivastava, Deo Kumar | Gaur, Aditya H.",fever | neutropenia | children | microbiology | etiology,NA,NA,492ZK,1077-4114,NA,stream,freshwater
WOS:000392078200003,"Empirical and targeted therapy of candidemia with fluconazole versus echinocandins: a propensity score-derived analysis of a population-based, multicentre prospective cohort",CLINICAL MICROBIOLOGY AND INFECTION,8,22,,AUG,2016,"Lopez-Cortes, L. E. | Almirante, B. | Cuenca-Estrella, M. | Garnacho-Montero, J. | Padilla, B. | Puig-Asensio, M. | Ruiz-Camps, I. | Rodriguez-Bano, J. | CANDIPOP Project GEIH-GEMICOMED",Bloodstream infection | Candidemia | Echinocandins | Empirical therapy | Targeted therapy,10.1016/j.cmi.2016.05.008,NA,EH9FX,1198-743X,NA,stream,freshwater
WOS:000299083500004,Moving CLABSI Prevention beyond the Intensive Care Unit: Risk Factors in Pediatric Oncology Patients,INFECTION CONTROL AND HOSPITAL EPIDEMIOLOGY,11,32,1079-1085,NOV,2011,"Kelly, Matthew | Conway, Margaret | Wirth, Kathleen | Potter-Bynoe, Gail | Billett, Amy L. | Sandora, Thomas J.",,10.1086/662376,NA,876CB,0899-823X,NA,stream,freshwater
WOS:000426304500016,Characteristics comparisons of bacteremia in allogeneic and autologous hematopoietic stem cell-transplant recipients with levofloxacin prophylaxis and influence on resistant bacteria emergence,JOURNAL OF MICROBIOLOGY IMMUNOLOGY AND INFECTION,1,51,123-131,FEB,2018,"Wang, Ching-Hsun | Chang, Feng-Yee | Chao, Tsu-Yi | Kao, Woei-Yau | Ho, Ching-Liang | Chen, Yeu-Chin | Dai, Ming-Shen | Chang, Ping-Ying | Wu, Yi-Ying | Lin, Jung-Chung",bacteremia | levofloxacin | prophylaxis | transplantation,10.1016/j.jmii.2016.02.003,NA,FX7XI,1684-1182,NA,stream,freshwater
WOS:000396514200005,Gender differences in the outcome of community-acquired Staphylococcus aureus bacteraemia: a historical population-based cohort study,CLINICAL MICROBIOLOGY AND INFECTION,1,23,27-32,JAN,2017,"Smit, J. | Lopez-Cortes, L. E. | Kaasch, A. J. | Sogaard, M. | Thomsen, R. W. | Schonheyder, H. C. | Rodriguez-Bano, J. | Nielsen, H.",Cohort study | Epidemiological study | Gender | Outcome | Prognosis | S. aureus bacteraemia | Sex,10.1016/j.cmi.2016.06.002,NA,EO2GI,1198-743X,NA,stream,freshwater
WOS:000396932000015,"Epidemiology, antifungal susceptibilities, and risk factors for invasive candidiasis from 2011 to 2013 in a teaching hospital in southwest China",JOURNAL OF MICROBIOLOGY IMMUNOLOGY AND INFECTION,1,50,97-103,FEB,2017,"Pu, Shuli | Niu, Siqiang | Zhang, Chuanming | Xu, Xiuyu | Qin, Mei | Huang, Shifeng | Zhang, Liping",Antifungal susceptibility | Epidemiology | Invasive candidiasis | Risk factor,10.1016/j.jmii.2015.01.005,NA,EO8IG,1684-1182,NA,stream,freshwater
WOS:000364430700098,"The Performance of the Four Anaerobic Blood Culture Bottles BacT/ALERT-FN, -FN Plus, BACTEC-Plus and -Lytic in Detection of Anaerobic Bacteria and Identification by Direct MALDI-TOF MS",PLoS One,11,10,,NOV 10,2015,"Almuhayawi, Mohammed | Altun, Osman | Abdulmajeed, Adam Dilshad | Ullberg, Mans | Ozenci, Volkan",,10.1371/journal.pone.0142398,NA,CV7CT,1932-6203,NA,stream,freshwater
WOS:000242876300020,"Blood culture contamination in Tanzania, Malawi, and the United States: a microbiological tale of three cities",JOURNAL OF CLINICAL MICROBIOLOGY,12,44,4425-4429,DEC,2006,"Archibald, Lennox K. | Pallangyo, Kisali | Kazembe, Peter | Reller, L. Barth",,10.1128/JCM.01215-06,NA,117MC,0095-1137,NA,stream,freshwater
WOS:000232020400019,Seminational surveillance of fungemia in Denmark: Notably high rates of fungemia and numbers of isolates with reduced azole susceptibility,JOURNAL OF CLINICAL MICROBIOLOGY,9,43,4434-4440,SEP,2005,"Arendrup, MC | Fuursted, K | Gahrn-Hansen, B | Jensen, IM | Knudsen, JD | Lundgren, B | Schonheyder, HC | Tvede, M",,10.1128/JCM.43.9.4434-4440.2005,NA,966LD,0095-1137,NA,stream,freshwater
WOS:000383824200014,Predictors of choice of initial antifungal treatment in intraabdominal candidiasis,CLINICAL MICROBIOLOGY AND INFECTION,8,22,719-724,AUG,2016,"Lagunes, L. | Borgatta, B. | Martin-Gomez, M. T. | Rey-Perez, A. | Antonelli, M. | Righi, E. | Merelli, M. | Brugnaro, P. | Dimopoulos, G. | Garnacho-Montero, J. | Colombo, A. L. | Luzzati, R. | Menichetti, F. | Munoz, P. | Nucci, M. | Scotton, G. | Viscoli, C. | Tumbarello, M. | Bassetti, M. | Rello, J. | IAC Study Investigators",Adequate treatment | Antifungal therapy | Candida | Guidelines | Intraabdominal candidiasis | Invasive fungal disease | Septic shock,10.1016/j.cmi.2016.06.005,NA,DW7IK,1198-743X,NA,stream,freshwater
WOS:000341516600002,Comparison of peptide nucleic acid fluorescence in situ hybridization assays with culture-based matrix-assisted laser desorption/ionization-time of flight mass spectrometry for the identification of bacteria and yeasts from blood cultures and cerebrospinal fluid cultures,CLINICAL MICROBIOLOGY AND INFECTION,8,20,O468-O475,AUG,2014,"Calderaro, A. | Martinelli, M. | Motta, F. | Larini, S. | Arcangeletti, M. C. | Medici, M. C. | Chezzi, C. | De Conto, F.",Bacteraemia | blood culture | cerebrospinal fluid | fungaemia | matrix-assisted laser desorption/ionization-time of flight | peptide nucleic acid fluorescence in situ hybridization,10.1111/1469-0691.12490,NA,AO7FC,1198-743X,NA,stream,freshwater
WOS:000281005900028,Impact of Multidrug-Resistant Pseudomonas aeruginosa Bacteremia on Patient Outcomes,ANTIMICROBIAL AGENTS AND CHEMOTHERAPY,9,54,3717-3722,SEP,2010,"Tam, Vincent H. | Rogers, Cary A. | Chang, Kai-Tai | Weston, Jaye S. | Caeiro, Juan-Pablo | Garey, Kevin W.",,10.1128/AAC.00207-10,NA,639WC,0066-4804,NA,stream,freshwater
WOS:000319109800075,Clinical and Microbiological Characteristics of Perianal Infections in Adult Patients with Acute Leukemia,PLOS ONE,4,8,,APR 5,2013,"Chen, Chien-Yuan | Cheng, Aristine | Huang, Shang-Yi | Sheng, Wang-Huei | Liu, Jia-Hau | Ko, Bo-Sheng | Yao, Ming | Chou, Wen-Chien | Lin, Hui-Chi | Chen, Yee-Chun | Tsay, Woei | Tang, Jih-Luh | Chang, Shan-Chwen | Tien, Hwei-Fang",,10.1371/journal.pone.0060624,NA,146RZ,1932-6203,NA,stream,freshwater
WOS:000461641100010,The prevalence of antiseptic tolerance genes among staphylococci and enterococci in a pediatric population,INFECTION CONTROL AND HOSPITAL EPIDEMIOLOGY,3,40,333-340,MAR,2019,"Sommer, Lauren M. | Krauss, Jennifer L. | Hulten, Kristina G. | Dunn, James J. | Kaplan, Sheldon L. | McNeil, J. Chase",,10.1017/ice.2019.3,NA,HP4JA,0899-823X,NA,stream,freshwater
WOS:000370186100015,Clinical findings of bacteremic septic arthritis according to the site of acquisition: The overlap between health care-related and community-and nosocomial-acquired cases,EUROPEAN JOURNAL OF INTERNAL MEDICINE,NA,28,38-42,MAR,2016,"Murillo, Oscar | Gomez-Junyent, Joan | Grau, Imma | Ribera, Alba | Cabrera, Celina | Pedrero, Salvador | Tubau, Fe | Nolla, Joan M. | Ariza, Javier | Pallares, Roman",Septic arthritis | Bacteremia | Healthcare-related | Nosocomial | Community,10.1016/j.ejim.2015.11.013,NA,DD8OJ,0953-6205,NA,stream,freshwater
WOS:000319211700008,Enterobacteriaceae Infections of Very Low Birth Weight Infants in Polish Neonatal Intensive Care Units: Resistance and Cross-transmission,PEDIATRIC INFECTIOUS DISEASE JOURNAL,6,32,594-598,JUN,2013,"Wojkowska-Mach, Jadwiga | Chmielarczyk, Agnieszka | Borszewska-Kornacka, Maria | Domanska, Joanna | Gadzinowski, Janusz | Gulczynska, Ewa | Nowiczewski, Marek | Helwich, Ewa | Kordek, Agnieszka | Pawlik, Dorota | Jursa-Kulesza, Joanna | Giedrys-Kalemba, Stefania | Szczapa, Jerzy | Heczko, Piotr B.",nosocomial infections | Enterobacteriaceae | very low birth weight | surveillance,10.1097/INF.0b013e318287fe2a,NA,147ZR,0891-3668,NA,stream,freshwater
WOS:000315602100011,A Population-Based Study of Bacterial Spectrum in Febrile Neutropenic Patients,JUNDISHAPUR JOURNAL OF MICROBIOLOGY,2,6,150-156,NA,2013,"Meidani, Mohsen | Bagheri, Ahmad | Khorvash, Farzin",Neutropenia | Epidemiology | Iran,10.5812/jjm.4941,NA,099EE,2008-3645,NA,stream,freshwater
WOS:000371152200014,Optimized Use of the MALDI BioTyper System and the FilmArray BCID Panel for Direct Identification of Microbial Pathogens from Positive Blood Cultures,JOURNAL OF CLINICAL MICROBIOLOGY,3,54,576-584,MAR,2016,"Fiori, B. | D'Inzeo, T. | Giaquinto, A. | Menchinelli, G. | Liotti, F. M. | de Maio, F. | De Angelis, G. | Quaranta, G. | Nagel, D. | Tumbarello, M. | Posteraro, B. | Sanguinetti, M. | Spanu, T.",,10.1128/JCM.02590-15,NA,DF2EC,0095-1137,NA,stream,freshwater
WOS:000361138600011,Clinical significance of time to positivity for yeast in candidemia,JOURNAL OF MICROBIOLOGY IMMUNOLOGY AND INFECTION,4,48,425-430,AUG,2015,"Chen, Liang-Yu | Yang, Su-Pen | Chen, Te-Li | Liao, Shu-Yuan | Chen, Yin-Yin | Chan, Yu-Jiun | Chen, Liang-Kung | Wang, Fu-Der",Antifungal treatment | Candidemia | Time to positivity,10.1016/j.jmii.2013.11.002,NA,CR2EO,1684-1182,NA,stream,freshwater
WOS:000355954200005,Risk factors of community-onset urinary tract infections caused by plasmid-mediated AmpC beta-lactamase-producing Enterobacteriaceae,JOURNAL OF MICROBIOLOGY IMMUNOLOGY AND INFECTION,3,48,269-275,JUN,2015,"Lee, Chi-Hung | Lee, Yi-Tzu | Kung, Che-Hsuan | Ku, Wen-Wei | Kuo, Shu-Chen | Chen, Te-Li | Fung, Chang-Phone",AmpC beta-lactamase | Community-onset | Plasmid-mediated | Risk factors | Urinary tract infections,10.1016/j.jmii.2013.08.010,NA,CK1GB,1684-1182,NA,stream,freshwater
WOS:000248779700012,Analysis of 30-day mortality for Clostridium difficile - Associated disease in the ICU setting,CHEST,2,132,418-424,AUG,2007,"Kenneally, Claire | Rosini, Jamie M. | Skrupky, Lee P. | Doherty, Joshua A. | Hollands, James M. | Martinez, Emily | McKenzie, Wendi | Murphy, Theresa | Smith, Jennifer R. | Micek, Scott T. | Kollef, Marin H.",antibiotics | Clostridium difficile | intensive care | outcome,10.1378/chest.07-0202,NA,200RE,0012-3692,NA,stream,freshwater
WOS:000359780300024,Gram-negative bacteraemia in haemodialysis,NEPHROLOGY DIALYSIS TRANSPLANTATION,7,30,1202-1208,JUL,2015,"Murray, Eleanor C. | Marek, Aleksandra | Thomson, Peter C. | Coia, John E.",bacteraemia | Gram-negative | haemodialysis | sensitivity | vascular access,10.1093/ndt/gfv205,NA,CP3LL,0931-0509,NA,stream,freshwater
WOS:000315360100018,Anaerobic ammonia oxidation (ANAMMOX) for side-stream treatment of anaerobic digester filtrate process performance and microbiology,BIOTECHNOLOGY AND BIOENGINEERING,4,110,1180-1192,APR,2013,"Kotay, Shireen M. | Mansell, Bryan L. | Hogsett, Mitch | Pei, Huang | Goel, Ramesh",ANAMMOX process | anaerobic ammonium oxidation | nitritation | Kuenenia stuttgartiensis | ammonia oxidizing bacteria,10.1002/bit.24767,NA,095UL,0006-3592,NA,stream,freshwater
WOS:000208250700004,"High mortality among patients with positive blood cultures at a Children's Hospital in Tbilisi, Georgia",JOURNAL OF INFECTION IN DEVELOPING COUNTRIES,4,3,267-272,MAY,2009,"Schaffner, Jami | Chochua, Sopio | Kourbatova, Ekaterina V. | Barragan, Maribel | Wang, Yun F. | Blumberg, Henry M. | del Rio, Carlos | Walker, H. Kenneth | Leonard, Michael K.",blood infections | mortality | children | Georgia,NA,NA,V22BM,1972-2680,NA,stream,freshwater
WOS:000505280200012,Critical care burden of skin and soft tissue infection in Central Australia: More than skin deep,AUSTRALIAN JOURNAL OF RURAL HEALTH,6,27,550-556,DEC,2019,"Secombe, Paul | Planche, Yannick | Athan, Eugene | Ollapallil, Jacob",adult | critical care | human T-lymphotropic virus 1 | social conditions | soft tissue infections,10.1111/ajr.12539,NA,JZ7HV,1038-5282,NA,stream,freshwater
WOS:000440655600026,A large retrospective cohort study of cefazolin compared with flucloxacillin for methicillin-susceptible Staphylococcus aureus bacteraemia,INTERNATIONAL JOURNAL OF ANTIMICROBIAL AGENTS,2,52,297-300,AUG,2018,"Davis, J. S. | Turnidge, J. | Tong, S. Y. C.",Cefazolin | Flucloxacillin | Antistaphylococcal penicillins | Staphylococcus aureus | Bacteraemia,10.1016/j.ijantimicag.2018.02.013,NA,GP2JE,0924-8579,NA,stream,freshwater
WOS:000361138600003,Fine typing of methicillin-resistant Staphylococcus aureus isolates using direct repeat unit and staphylococcal interspersed repeat unit typing methods,JOURNAL OF MICROBIOLOGY IMMUNOLOGY AND INFECTION,4,48,370-375,AUG,2015,"Ho, Cheng-Mao | Ho, Mao-Wang | Li, Chi-Yuan | Lu, Jang-Jih",DRU | MRSA | SIRU | Typing,10.1016/j.jmii.2013.08.021,NA,CR2EO,1684-1182,NA,stream,freshwater
WOS:000383671200003,"Descriptive epidemiology of Escherichia coli bacteraemia in England, April 2012 to March 2014",EUROSURVEILLANCE,35,21,9-17,SEP,2016,"Bou-Antoun, S. | Davies, J. | Guy, R. | Johnson, A. P. | Sheridan, E. A. | Hope, R. J.",,10.2807/1560-7917.ES.2016.21.35.30329,NA,DW5GL,1560-7917,NA,stream,freshwater
WOS:000258957100013,Incidence of Pseudomonas aeruginosa bacteremia: A population-based study,AMERICAN JOURNAL OF MEDICINE,8,121,702-708,AUG,2008,"Al-Hasan, Majdi N. | Wilson, John W. | Lahr, Brian D. | Eckel-Passow, Jeanette E. | Baddour, Larry M.",antibiotic susceptibility | bacteremia | epidemiology | mortality | Pseudomonas aeruginosa,10.1016/j.amjmed.2008.03.029,NA,344WD,0002-9343,NA,stream,freshwater
WOS:000223376200006,Microbial activities in the burrow environment of the potamal mayfly Ephoron virgo,FRESHWATER BIOLOGY,9,49,1152-1163,SEP,2004,"Stief, P | Altmann, D | Beer, D | Bieg, R | Kureck, A",animal-microbe interactions | bioirrigation | bioturbation | Ephemeroptera | microbial activity | microsensor | Rhine | stream sediment,10.1111/j.1365-2427.2004.01258.x,NA,847ET,0046-5070,NA,stream,freshwater
WOS:000432484400017,Differential time to positivity of central and peripheral blood cultures is inaccurate for the diagnosis of Staphylococcus aureus long-term catheter-related sepsis,JOURNAL OF HOSPITAL INFECTION,2,99,192-199,JUN,2018,"Bouzidi, H. | Emirian, A. | Marty, A. | Chachaty, E. | Laplanche, A. | Gachot, B. | Blot, F.",Catheter-related bloodstream infection (CRBSI) | Staphylococcus aureus | Differential time to positivity | Blood cultures,10.1016/j.jhin.2018.01.010,NA,GG1YF,0195-6701,NA,stream,freshwater
WOS:000275789100004,Bacteremia complicating gram-negative urinary tract infections: A population-based study,JOURNAL OF INFECTION,4,60,278-285,APR,2010,"Al-Hasan, Majdi N. | Eckel-Passow, Jeanette E. | Baddour, Larry M.",Gram-negative | Bloodstream infection | Urinary tract infection | Epidemiology | Mortality | Antimicrobial resistance | Fluoroquinolones | Incidence,10.1016/j.jinf.2010.01.007,NA,571XJ,0163-4453,NA,stream,freshwater
WOS:000388267800008,Community-onset bacteremia in kidney transplant recipients: The recipients fare well in terms of mortality and kidney injury,JOURNAL OF MICROBIOLOGY IMMUNOLOGY AND INFECTION,5,49,685-691,OCT,2016,"Cia, Cong-Tat | Li, Ming-Ji | Li, Chia-Wen | Lee, Nan-Yao | Chang, Shen-Shin | Lee, Ching-Chi | Ko, Wen-Chien",bacteremia | kidney injury | kidney transplant recipients,10.1016/j.jmii.2014.08.027,NA,EC6SU,1684-1182,NA,stream,freshwater
WOS:000356567400156,Risk and Prognostic Factors for Multidrug-Resistant Acinetobacter Baumannii Complex Bacteremia: A Retrospective Study in a Tertiary Hospital of West China,PLOS ONE,6,10,,JUN 17,2015,"Liu, Qianqian | Li, Wenzhang | Du, Xinmiao | Li, Weijing | Zhong, Taiqing | Tang, Yin | Feng, Yulin | Tao, Chuanmin | Xie, Yi",,10.1371/journal.pone.0130701,NA,CK9NS,1932-6203,NA,stream,freshwater
WOS:000265528900016,"Not Just Little Adults: Candidemia Epidemiology, Molecular Characterization, and Antifungal Susceptibility in Neonatal and Pediatric Patients",PEDIATRICS,5,123,1360-1368,MAY,2009,"Blyth, Christopher C. | Chen, Sharon C. A. | Slavin, Monica A. | Serena, Carol | Nguyen, Quoc | Marriott, Deborah | Ellis, David | Meyer, Wieland | Sorrell, Tania C. | Australian Candidemia Study",candida | fungemia | candidiasis | infant | newborn | child | adult | antifungal agents,10.1542/peds.2008-2055,NA,438AS,0031-4005,NA,stream,freshwater
WOS:000209772000001,Development of trigger-based semi-automated surveillance of ventilator-associated pneumonia and central line-associated bloodstream infections in a Dutch intensive care,ANNALS OF INTENSIVE CARE,NA,4,,DEC 21,2014,"Kaiser, Anna Maria | de Jong, Evelien | Evelein-Brugman, Sabine F. M. | Peppink, Jan M. | Vandenbroucke-Grauls, Christina M. J. E. | Girbes, Armand R. J.",Hospital-acquired infection (HAI) | Quality improvement | Electronic surveillance system | Decision support capabilities | Infection prevention (IP) | Patient data management system,10.1186/s13613-014-0040-x,NA,V44TT,2110-5820,NA,stream,freshwater
WOS:000387962900015,Bacterial susceptibility patterns in patients with spinal cord injury and disorder (SCI/D): an opportunity for customized stewardship tools,SPINAL CORD,11,54,1001-1009,NOV,2016,"Suda, K. J. | Patel, U. C. | Sabzwari, R. | Cao, L. | Ramanathan, S. | Hill, J. N. | Evans, C. T.",,10.1038/sc.2016.38,NA,EC2OO,1362-4393,NA,stream,freshwater
WOS:000230207500032,Frequency of fungemia in hospitalized pediatric inpatients over 11 years at a tertiary care institution,PEDIATRICS,1,116,61-67,JUL,2005,"Abelson, JA | Moore, T | Bruckner, D | Deville, J | Nielsen, K",fungal infections children | fungemia pediatrics | nosocomial infections | immunocompromised patients,10.1542/peds.2004-1605,NA,941IC,0031-4005,NA,stream,freshwater
WOS:000436441700008,Microbiology and clinical outcomes of puerperal sepsis: a prospective cohort study,JOURNAL OF OBSTETRICS AND GYNAECOLOGY,5,38,635-641,NA,2018,"Majangara, Rumbidzai | Gidiri, Muchabayiwa Francis | Chirenje, Zvavahera Mike",Puerperal sepsis | antibacterial susceptibility | multidrug-resistant organisms | clinical outcomes | Escherichia coli | Klebsiella,10.1080/01443615.2017.1399112,NA,GK8BQ,0144-3615,NA,stream,freshwater
WOS:000448188200025,Accuracy of Sensititre YeastOne echinocandins epidemiological cut-off values for identification of FKS mutant Candida albicans and Candida glabrata: a ten year national survey of the Fungal Infection Network of Switzerland (FUNGINOS),CLINICAL MICROBIOLOGY AND INFECTION,11,24,,NOV,2018,"Kritikos, A. | Neofytos, D. | Khanna, N. | Schreiber, P. W. | Boggian, K. | Bille, J. | Schrenzel, J. | Muhlethaler, K. | Zbinden, R. | Bruderer, T. | Goldenberger, D. | Pfyffer, G. | Conen, A. | Van Delden, C. | Zimmerli, S. | Sanglard, D. | Bachmann, D. | Marchetti, O. | Lamoth, E. | Fungal Infect Network Switzerland",Anidulafungin | Antifungal susceptibility testing | Candidaemia | Caspofungin | FKS hotspot | Micafungin | Minimal inhibitory concentration,10.1016/j.cmi.2018.05.012,NA,GY0FE,1198-743X,NA,stream,freshwater
WOS:000289466100020,A 4-year prospective study of septicemia in pediatric surgical patients at a tertiary care teaching hospital in Kuwait,JOURNAL OF PEDIATRIC SURGERY,4,46,679-684,APR,2011,"Mokaddas, Eiman M. | Shetty, Shama A. | Abdullah, Aneesa A. | Rotimi, V. O.",Microbiology | Septicemia | Pediatric surgery | Tertiary care hospital | Kuwait,10.1016/j.jpedsurg.2010.12.001,NA,749KW,0022-3468,NA,stream,freshwater
WOS:000265903800002,Health Care-Associated Native Valve Endocarditis: Importance of Non-nosocomial Acquisition,ANNALS OF INTERNAL MEDICINE,9,150,586-U5,MAY 5,2009,"Benito, Natividad | Miro, Jose M. | de Lazzari, Elisa | Cabell, Christopher H. | del Rio, Ana | Altclas, Javier | Commerford, Patrick | Delahaye, Francois | Dragulescu, Stefan | Giamarellou, Helen | Habib, Gilbert | Kamarulzaman, Adeeba | Kumar, A. Sampath | Nacinovich, Francisco M. | Suter, Fredy | Tribouilloy, Christophe | Venugopal, Krishnan | Moreno, Asuncion | Fowler, Vance G., Jr. | ICE-PCS Investigators",,10.7326/0003-4819-150-9-200905050-00004,NA,443IQ,0003-4819,NA,stream,freshwater
WOS:000432288200001,An Automated Sample Preparation Instrument to Accelerate Positive Blood Cultures Microbial Identification by MALDI-TOF Mass Spectrometry (Vitek (R) MS),FRONTIERS IN MICROBIOLOGY,NA,9,,MAY 15,2018,"Broyer, Patrick | Perrot, Nadine | Rostaing, Herve | Blaze, Jerome | Pinston, Frederic | Gervasi, Gaspard | Charles, Marie-Helene | Dachaud, Fabien | Dachaud, Jacques | Moulin, Frederic | Cordier, Sylvain | Dauwalder, Olivier | Meugnier, Helene | Vandenesch, Francois",blood cultures | MALDI-TOF MS | automation | microorganism identification | filtration,10.3389/fmicb.2018.00911,NA,GF9IB,1664-302X,NA,stream,freshwater
WOS:000367064800002,Risk factors for infection following prostate biopsy - a case control study,BMC INFECTIOUS DISEASES,NA,15,,DEC 23,2015,"Anderson, Elliot | Leahy, Olivia | Cheng, Allen C. | Grummet, Jeremy",Prostate | Needle biopsy | Transrectal biopsy | Infection | Sepsis | Case control,10.1186/s12879-015-1328-7,NA,CZ4HT,1471-2334,NA,stream,freshwater
WOS:000245992300006,Infections associated with ventricular assist devices: epidemiology and effect on prognosis after transplantation,TRANSPLANT INFECTIOUS DISEASE,2,9,114-120,JUN,2007,"Monkowski, D. H. | Axelrod, P. | Fekete, T. | Hollander, T. | Furukawa, S. | Samuel, R.",ventricular assist devices | heart transplantation | infection,10.1111/j.1399-3062.2006.00185.x,NA,161CQ,1398-2273,NA,stream,freshwater
WOS:000403158500004,Prognostic factors associated with 30-day in-hospital mortality in coagulase-negative Staphylococcus bacteraemia: no impact of vancomycin minimum inhibitory concentration,INFECTIOUS DISEASES,9,49,664-673,NA,2017,"Hentzien, Maxime | Strady, Christophe | Vernet-Garnier, Veronique | Servettaz, Amelie | De Champs, Christophe | Delmer, Alain | Bani-sadr, Firouze | N'Guyen, Yohan",Coagulase-negative Staphylococcus | bacteraemia | mortality | prognosis | vancomycin,10.1080/23744235.2017.1323346,NA,EX3UH,2374-4235,NA,stream,freshwater
WOS:000329995500007,Invasive candidiasis in non-neutropenic adults. Guideline-based management in the intensive care unit,ANAESTHESIST,12,62,1003-1009,DEC,2013,"Gloeckner, A. | Cornely, O. A.",Intensive care | Candidemia | Antifungal agents | Echinocandins | Central venous catheters,10.1007/s00101-013-2208-4,NA,293TB,0003-2417,NA,stream,freshwater
WOS:000399714300001,Production of high-concentration n-caproic acid from lactate through fermentation using a newly isolated Ruminococcaceae bacterium CPB6,BIOTECHNOLOGY FOR BIOFUELS,NA,10,,APR 21,2017,"Zhu, Xiaoyu | Zhou, Yan | Wang, Yi | Wu, Tingting | Li, Xiangzhen | Li, Daping | Tao, Yong",Caproic acid | Hexanoate | Lactate | Ruminococcaceae bacterium | Organic waste | Chain elongation,10.1186/s13068-017-0788-y,NA,ES7FE,1754-6834,NA,stream,freshwater
