uid,title,journal,issue,volume,pages,date,year,authors,keywords,doi,article_no,isi_id,issn,isbn,environment,category
WOS:000176605800019,Minimizing the workup of blood culture contaminants: Implementation and evaluation of a laboratory-based algorithm,JOURNAL OF CLINICAL MICROBIOLOGY,7,40,2437-2444,JUL,2002,"Richter, SS | Beekmann, SE | Croco, JL | Diekema, DJ | Koontz, FP | Pfaller, MA | Doern, GV",,10.1128/JCM.40.7.2437-2444.2002,NA,569MH,0095-1137,NA,stream,freshwater
WOS:000371653900007,Bactericidal and synergistic activity of double-carbapenem regimen for infections caused by carbapenemase-producing Klebsiella pneumoniae,CLINICAL MICROBIOLOGY AND INFECTION,2,22,147-153,FEB,2016,"Oliva, A. | Gizzi, F. | Mascellino, M. T. | Cipolla, A. | D'Abramo, A. | D'Agostino, C. | Trinchieri, V. | Russo, G. | Tierno, F. | Iannetta, M. | Mastroianni, C. M. | Vullo, V.",Bactericidal activity | carbapenem-resistant Klebsiella pneumoniae | double-carbapenem regimen | sepsis | synergy | time-kill studies,10.1016/j.cmi.2015.09.014,NA,DF9AZ,1198-743X,NA,stream,freshwater
WOS:000313872800071,"Epidemiology, Microbiology and Mortality Associated with Community-Acquired Bacteremia in Northeast Thailand: A Multicenter Surveillance Study",PLOS ONE,1,8,,JAN 18,2013,"Kanoksil, Manas | Jatapai, Anchalee | Peacock, Sharon J. | Limmathurotsakul, Direk",,10.1371/journal.pone.0054714,NA,075GQ,1932-6203,NA,stream,freshwater
WOS:000462849900014,Sampling of urine for diagnosing urinary tract infection in general practice - First-void or mid-stream urine?,SCANDINAVIAN JOURNAL OF PRIMARY HEALTH CARE,1,37,113-119,JAN 2,2019,"Pernille, Hoelmkjaer | Lars, Bjerrum | Marjukka, Makela | Volkert, Siersma | Anne, Holm","""Urinary tract infections"" [Mesh] ""Urine"" [Mesh] | ""Specimen handling"" [Mesh] ""Urine specimen collection"" [Mesh] ""Primary health care"" [Mesh] ""General practice"" [Mesh]",10.1080/02813432.2019.1568708,NA,HR0WP,0281-3432,NA,stream,freshwater
WOS:000330552400012,NON-SUSCEPTIBILITY TRENDS AMONG METHICILLIN-RESISTANT COAGULASE-NEGATIVE STAPHYLOCOCCI ISOLATED FROM BLOOD CULTURES,ARCHIVES OF BIOLOGICAL SCIENCES,1,66,79-86,NA,2014,"Povazan, Anika | Vukelic, Anka | Kurucin, Tatjana | Hadnadev, Mirjana | Milosevic, Vesna | Gusman, Vera",Coagulase-negative staphylococci | methicillin-resistant | susceptibility | blood culture,10.2298/ABS1401079P,NA,301SM,0354-4664,NA,stream,freshwater
WOS:000338287200004,The Potential for PCR Based Testing to Improve Diagnosis and Treatment of Sepsis,CURRENT INFECTIOUS DISEASE REPORTS,5,15,372-379,OCT,2013,"Lyle, Ngan | Boyd, John",Sepsis | Septic shock | Antibiotics | Polymerase chain reaction | PCR,10.1007/s11908-013-0350-4,NA,AK2YT,1523-3847,NA,stream,freshwater
WOS:000295434000007,Wound Healing Assays in Well Plate-Coupled Microfluidic Devices with Controlled Parallel Flow,JALA,1,15,52-57,FEB,2010,"Conant, Carolyn G. | Nevill, J. Tanner | Schwartz, Michael | Ionescu-Zanetti, Cristian",,10.1016/j.jala.2009.08.002,NA,827NA,1535-5535,NA,stream,freshwater
WOS:000225795200002,"An analysis of wilderness water in Kings Canyon, Sequoia, and Yosemite National Parks for coliform and pathologic bacteria",WILDERNESS & ENVIRONMENTAL MEDICINE,4,15,238-244,WIN,2004,"Derlet, RW | Carlson, JR",Yosemite | Sequoia National Park | Kings Canyon National Park | coliforms | wilderness water,NA,NA,880MZ,1080-6032,NA,stream,freshwater
WOS:000077575200001,"Prevalence of nosocomial infections in a teaching hospital: distribution, predisposing factors and diagnostic pointers",SCHWEIZERISCHE MEDIZINISCHE WOCHENSCHRIFT,50,128,1973-1983,DEC 12,1998,"Frankart, L | Copin, P | Alexiou, A | Henry, N | Sauvan, V | Pittet, D",,NA,NA,147PG,0036-7672,NA,stream,freshwater
WOS:000082675100009,Antiseptic-bonded central venous catheters and bacterial colonisation,ANAESTHESIA,9,54,868-872,SEP,1999,"Hannan, M | Juste, RN | Umasanker, S | Glendenning, A | Nightingale, C | Azadian, B | Soni, N","monitoring, central venous pressure | complications, bacteraemia | equipment, antiseptic-bonded catheters",NA,NA,237UU,0003-2409,NA,stream,freshwater
WOS:000320827800005,Integrating a kinetic microbial model with a heat transfer model to predict Byssochlamys fulva growth in refrigerated papaya pulp,JOURNAL OF FOOD ENGINEERING,3,118,279-288,OCT,2013,"Santos da Silva, Paulo Ricardo | Tessaro, Isabel Cristina | Ferreira Marczak, Ligia Damasceno",Heat transfer | Predictive microbiology | Refrigeration | Fungus | Fruit pulp,10.1016/j.jfoodeng.2013.04.014,NA,170CR,0260-8774,NA,stream,freshwater
WOS:000406671400003,From Expert Protocols to Standardized Management of Infectious Diseases,CLINICAL INFECTIOUS DISEASES,NA,65,S12-S19,AUG 15,2017,"Lagier, Jean-Christophe | Aubry, Camille | Delord, Marion | Michelet, Pierre | Tissot-Dupont, Herve | Million, Matthieu | Brouqui, Philippe | Raoult, Didier | Parola, Philippe",antibiotic stewardship | standardization | fecal microbiota transplantation,10.1093/cid/cix403,NA,FC2MH,1058-4838,NA,stream,freshwater
WOS:000341286100013,A Pilot Study of Solar Water Disinfection in the Wilderness Setting,WILDERNESS & ENVIRONMENTAL MEDICINE,3,25,340-345,FAL,2014,"Tedeschi, Christopher M. | Barsi, Christopher | Peterson, Shane E. | Carey, Kevin M.",water microbiology | disinfection | survival,NA,NA,AO4DJ,1080-6032,NA,stream,freshwater
WOS:000489114100013,"Collection, transport and storage procedures for blood culture specimens in adult patients: recommendations from a board of Italian experts",CLINICAL CHEMISTRY AND LABORATORY MEDICINE,11,57,1680-1689,NOV,2019,"De Plato, Francesca | Fontana, Carla | Gherardi, Giovanni | Privitera, Gaetano Pierpaolo | Puro, Vincenzo | Rigoli, Roberto | Viaggi, Bruno | Viale, Pierluigi",blood culture collection | blood cultures | bloodstream infections | storage | transport,10.1515/cclm-2018-1146,NA,JC2NQ,1434-6621,NA,stream,freshwater
WOS:000168900300012,Management of epididymo-orchitis in Genitourinary Medicine clinics in the United Kingdom's North Thames region 2000,INTERNATIONAL JOURNAL OF STD & AIDS,5,12,342-345,MAY,2001,"Dale, AWS | Wilson, JD | Forster, GE | Daniels, D | Brook, MG",epididymo-orchitis | GUM | survey | audit,NA,NA,435UR,0956-4624,NA,stream,freshwater
WOS:000252767400001,Population-based laboratory surveillance for Serratia species isolates in a large Canadian health region,EUROPEAN JOURNAL OF CLINICAL MICROBIOLOGY & INFECTIOUS DISEASES,2,27,89-95,FEB,2008,"Laupland, K. B. | Parkins, M. D. | Gregson, D. B. | Church, D. L. | Ross, T. | Pitout, J. D. D.",,10.1007/s10096-007-0400-7,NA,256ZC,0934-9723,NA,stream,freshwater
WOS:000242189100038,"Causes of community-acquired bacteremia and patterns of antimicrobial resistance in Vientiane, Laos",AMERICAN JOURNAL OF TROPICAL MEDICINE AND HYGIENE,5,75,978-985,NOV,2006,"Phetsouvanh, Rattanaphone | Phongmany, Simmaly | Soukaloun, Douangdao | Rasachak, Bouachanh | Soukhaseum, Vimone | Soukhaseum, Seun | Frichthavong, Kamthavi | Khounnorath, Sengmanivong | Pengdee, Bounthom | Phiasakha, Khamphong | Chu, Vang | Luangxay, Khonesavanh | Rattanavong, Sayadeth | Sisouk, Konkam | Keolouangkot, Valy | Mayxay, Mayfong | Ramsay, Andrew | Blacksell, Stuart D. | Campbell, Jim | Martinez-Aussel, Bertrand | Heuanvongsy, Mayboun | Bounxouel, Bounthapaany | Thammavong, Chanpheng | Syhavong, Bounkong | Strobel, Michel | Peacock, Sharon J. | White, Nicholas J. | Newton, Paul N.",,NA,NA,107RQ,0002-9637,NA,stream,freshwater
WOS:000418398500004,Development of Multiple Regression Models to Predict Sources of Fecal Pollution,WATER ENVIRONMENT RESEARCH,11,89,1961-1969,NOV 1,2017,"Hall, Kimberlee K. | Scheuerman, Phillip R.",water quality | surface water quality | microbiology | total maximum daily load | pollution: urban and regional | multivariate statistical models,10.2175/106143017X14839994523901,NA,FQ5KK,1061-4303,NA,stream,freshwater
WOS:000280112100016,Developing information technology for infection prevention surveillance,CRITICAL CARE MEDICINE,8,38,S399-S404,AUG,2010,"Woeltje, Keith F. | McMullen, Kathleen M.",information technology | infection prevention surveillance | healthcare-associated infections | computer surveillance | central catheter-associated bloodstream infections | ventilator-associated pneumonia | microbiology cultures | electronic medical records | chest radiographs,10.1097/CCM.0b013e3181e6d11d,NA,628IP,0090-3493,NA,stream,freshwater
WOS:000385185700012,MALDI-TOF MS Versus VITEK((R))2: Comparison of Systems for the Identification of Microorganisms Responsible for Bacteremia,CURRENT MICROBIOLOGY,6,73,843-850,DEC,2016,"Febbraro, Filomena | Rodio, Donatella Maria | Puggioni, Gianluca | Antonelli, Guido | Pietropaolo, Valeria | Trancassini, Maria",,10.1007/s00284-016-1121-x,NA,DY5ZW,0343-8651,NA,stream,freshwater
WOS:000315319100008,Bacteraemias in tropical Australia: changing trends over a 10-year period,DIAGNOSTIC MICROBIOLOGY AND INFECTIOUS DISEASE,3,75,266-270,MAR,2013,"Porter, Selina | Ketheesan, Natkunam | Norton, Robert",Bacteraemia | Tropical | Australia,10.1016/j.diagmicrobio.2012.11.017,NA,095FC,0732-8893,NA,stream,freshwater
WOS:000261714000008,"Diel changes in metal concentrations in a geogenically acidic river: Rio Agrio, Argentina",JOURNAL OF VOLCANOLOGY AND GEOTHERMAL RESEARCH,2,178,213-223,DEC 10,2008,"Parker, Stephen R. | Gammons, Christopher H. | Pedrozo, Fernando L. | Wood, Scott A.",diel | iron | photoreduction | arsenic | rare earth elements | geothermal,10.1016/j.jvolgeores.2008.06.029,NA,383ZV,0377-0273,NA,stream,freshwater
WOS:000377656500001,"Flow Cytometric Assessment of Bacterial Abundance in Soils, Sediments and Sludge",FRONTIERS IN MICROBIOLOGY,NA,7,,JUN 14,2016,"Frossard, Aline | Hammes, Frederik | Gessner, Mark O.",flow cytometry | epifluorescence microscopy | ATP | bacterial abundance | sediment | soil | drinking water treatment plant sand-filters,10.3389/fmicb.2016.00903,NA,DO3CA,1664-302X,NA,stream,freshwater
WOS:000367288000001,Driving forces of vancomycin-resistant E. faecium and E. faecalis blood-stream infections in children,ANTIMICROBIAL RESISTANCE AND INFECTION CONTROL,NA,3,,SEP 1,2014,"Di Pentima, Maria Cecilia | Chan, Shannon | Briody, Carol | Power, Michelle | Hossain, Jobayer",Enterococcus faecium | Enterococcus faecalis | Enterococcus spp | Vancomycin | Bacteremia,10.1186/2047-2994-3-29,NA,CZ7OF,2047-2994,NA,stream,freshwater
WOS:000085343000009,Staphylococcus aureus bacteremia,SAUDI MEDICAL JOURNAL,2,21,171-174,FEB,2000,"Akbar, DH | Mushtaq, MA | El-Tahawi, AT | Bahnasy, AA",Staph.aureus | bacteremia | sources | risk factors,NA,NA,284QG,0379-5284,NA,stream,freshwater
WOS:000267749000002,Characterization of coagulase-negative staphylococcal isolates from blood with reduced susceptibility to glycopeptides and therapeutic options,BMC INFECTIOUS DISEASES,NA,9,,JUN 4,2009,"Natoli, Silvia | Fontana, Carla | Favaro, Marco | Bergamini, Alberto | Testore, Gian Piero | Minelli, Silvia | Bossa, Maria Cristina | Casapulla, Mauro | Broglio, Giorgia | Beltrame, Angela | Cudillo, Laura | Cerretti, Raffaella | Leonardis, Francesca",,10.1186/1471-2334-9-83,NA,467OT,1471-2334,NA,stream,freshwater
WOS:000372843600009,Prevention of Late Onset Sepsis and Central-line Associated Blood Stream Infection in Preterm Infants,PEDIATRIC INFECTIOUS DISEASE JOURNAL,4,35,401-406,APR,2016,"Sinha, Ajay K. | Murthy, Vadivelam | Nath, Puneet | Morris, Joan K. | Millar, Mike",premature infant | infection | nosocomial infection | sepsis | Catheter-associated infection | prevention | patient care bundles,10.1097/INF.0000000000001019,NA,DH5PL,0891-3668,NA,stream,freshwater
WOS:000349908800008,Low Mortality of Staphylococcus aureus Bacteremia in Icelandic Children Nationwide Study on Incidence and Outcome,PEDIATRIC INFECTIOUS DISEASE JOURNAL,2,34,140-144,FEB,2015,"Asgeirsson, Hilmir | Gudlaugsson, Olafur | Kristinsson, Karl G. | Vilbergsson, Gauti R. | Heiddal, Sigurdur | Haraldsson, Asgeir | Weiland, Ola | Kristjansson, Mar",Staphylococcus aureus | bacteremia | pediatric | incidence | mortality,10.1097/INF.0000000000000485,NA,CB8VE,0891-3668,NA,stream,freshwater
WOS:000339226600008,Can MALDI-TOF mass spectrometry be used with intravascular catheters?,ENFERMEDADES INFECCIOSAS Y MICROBIOLOGIA CLINICA,6,32,372-374,JUN-JUL,2014,"Guembe, Maria | Rodriguez-Sanchez, Belem | Ruiz, Adrian | Martin-Rabadan, Pablo | Rodriguez-Creixems, Marta | Bouza, Emilio",MALDI-TOF mass spectrometry | Intravascular catheters | Colonization | Catheter-related bloodstream infection | Conventional culture,10.1016/j.eimc.2014.01.011,NA,AL6EY,0213-005X,NA,stream,freshwater
WOS:000424764800003,Automatic hemolysis identification on aligned dual-lighting images of cultured blood agar plates,COMPUTER METHODS AND PROGRAMS IN BIOMEDICINE,NA,156,13-24,MAR,2018,"Savardi, Mattia | Ferrari, Alessandro | Signoroni, Alberto",Digital Microbiology Imaging | Full Laboratory Automation | Hemolysis identification | Machine learning | Image alignment | Image classification,10.1016/j.cmpb.2017.12.017,NA,FV7LC,0169-2607,NA,stream,freshwater
WOS:000397070500006,Procalcitonin to guide taking blood cultures in the intensive care unit; a cluster-randomized controlled trial,CLINICAL MICROBIOLOGY AND INFECTION,2,23,86-91,FEB,2017,"van der Geest, P. J. | Mohseni, M. | Nieboer, D. | Duran, S. | Groeneveld, A. B. J.",Bacteraemia | Blood cultures | Critically ill | Efficacy | Procalcitonin | Safety,10.1016/j.cmi.2016.10.004,NA,EP0IL,1198-743X,NA,stream,freshwater
WOS:000496344800075,Fused Deposition Modeling as an Effective Tool for Anti-Infective Dialysis Catheter Fabrication,ACS BIOMATERIALS SCIENCE & ENGINEERING,11,5,6300-6310,NOV,2019,"Mathew, Essyrose | Dominguez-Robles, Juan | Stewart, Sarah A. | Mancuso, Elena | O'Donnell, Kieran | Larraneta, Eneko | Lamprou, Dimitrios A.",3D printing | additive manufacturing | fused deposition modeling | extrusion | catheters | dialysis | drug release,10.1021/acsbiomaterials.9b01185,NA,JM6TP,2373-9878,NA,stream,freshwater
WOS:000357350900013,The diagnostic accuracy of procalcitonin for bacteraemia: a systematic review and meta-analysis,CLINICAL MICROBIOLOGY AND INFECTION,5,21,474-481,MAY,2015,"Hoeboer, S. H. | van der Geest, P. J. | Nieboer, D. | Groeneveld, A. B. J.",Bacteraemia | diagnostic accuracy | infection | meta-analysis | procalcitonin | sensitivity and specificity,10.1016/j.cmi.2014.12.026,NA,CM0EJ,1198-743X,NA,stream,freshwater
WOS:000307378400016,Assessment of Accuracy of Identification of Pathogenic Yeasts in Microbiology Laboratories in the United Kingdom,JOURNAL OF CLINICAL MICROBIOLOGY,8,50,2639-2644,AUG,2012,"Borman, Andrew M. | Szekely, Adrien | Palmer, Michael D. | Johnson, Elizabeth M.",,10.1128/JCM.00913-12,NA,986WY,0095-1137,NA,stream,freshwater
WOS:000372083500008,Gram-negative bacteraemia; a multi-centre prospective evaluation of empiric antibiotic therapy and outcome in English acute hospitals,CLINICAL MICROBIOLOGY AND INFECTION,3,22,244-251,MAR,2016,"Fitzpatrick, J. M. | Biswas, J. S. | Edgeworth, J. D. | Islam, J. | Jenkins, N. | Judge, R. | Lavery, A. J. | Melzer, M. | Morris-Jones, S. | Nsutebu, E. F. | Peters, J. | Pillay, D. G. | Pink, F. | Price, J. R. | Scarborough, M. | Thwaites, G. E. | Tilley, R. | Walker, A. S. | Llewelyn, M. J. | United Kingdom Clinical Infect Res",Adult | antibiotic therapy | bloodstream infection | Gram-negative bacteria | mortality,10.1016/j.cmi.2015.10.034,NA,DG5AD,1198-743X,NA,stream,freshwater
WOS:000270734500003,"Microbiology, time course and clinical characteristics of infection in critically ill patients receiving packed red blood cell transfusion",VOX SANGUINIS,4,97,294-302,NA,2009,"Rachoin, J. -S. | Daher, R. | Schorr, C. | Milcarek, B. | Parrillo, J. E. | Gerber, D. R.",infection | transfusion | outcome | Acinetobacter,10.1111/j.1423-0410.2009.01134.x,NA,505XJ,0042-9007,NA,stream,freshwater
WOS:000288506100006,"Prospective, randomised study of selective versus routine culture of vascular catheter tips: patient outcome, antibiotic use and laboratory workload",JOURNAL OF HOSPITAL INFECTION,4,77,309-315,APR,2011,"Perez-Parra, A. | Guembe, M. | Martin-Rabadan, P. | Munoz, P. | Fernandez-Cruz, A. | Bouza, E.",Bacteraemia | Catheter colonisation | Catheter-related bloodstream infection | Catheter tip culture | Central vascular catheters,10.1016/j.jhin.2010.11.021,NA,736PH,0195-6701,NA,stream,freshwater
WOS:000464488500042,COD/sulfate ratio does not affect the methane yield and microbial diversity in anaerobic digesters,WATER RESEARCH,NA,155,444-454,MAY 15,2019,"Cetecioglu, Zeynep | Dolfing, Jan | Taylor, Jessica | Purdy, Kevin J. | Eyice, Ozge",Anaerobic digestion | Methanogens | Sulfate reducers | COD/Sulfate ratio,10.1016/j.watres.2019.02.038,NA,HT3UK,0043-1354,NA,stream,freshwater
WOS:000321026800006,Transport time for blood culture bottles: underlying factors and its consequences,DIAGNOSTIC MICROBIOLOGY AND INFECTIOUS DISEASE,3,76,286-290,JUL,2013,"Ronnberg, Caroline | Mildh, Masako | Ullberg, Mans | Ozenci, Volkan",Sepsis | Blood culture | Transport time | Time to detection | Total detection time,10.1016/j.diagmicrobio.2013.03.031,NA,172TC,0732-8893,NA,stream,freshwater
WOS:000405197100003,Colonization and infection with extended-spectrum beta-lactamase producing Enterobacteriaceae in patients with malignancy,EXPERT REVIEW OF ANTI-INFECTIVE THERAPY,7,15,653-661,NA,2017,"Alevizakos, Michail | Mylonakis, Eleftherios",ESBL | colonization | infection | malignancy,10.1080/14787210.2017.1348895,NA,FA1KB,1478-7210,NA,stream,freshwater
WOS:000468943400008,Central venous catheter related infections. Inter-Societies update and recommendations,MEDICINA-BUENOS AIRES,1,79,53-60,NA,2019,"Farina, Javier | Cornistein, Wanda | Balasinv, Carina | Chuluyan, Juan | Blanco, Miriam",catheter | bloodstream infection | diagnosis | treatment | prevention,NA,NA,HZ6DX,0025-7680,NA,stream,freshwater
WOS:000285297600003,Canadian clinical practice guidelines for invasive candidiasis in adults,CANADIAN JOURNAL OF INFECTIOUS DISEASES & MEDICAL MICROBIOLOGY,4,21,E122-E150,WIN,2010,"Bow, Eric J. | Evans, Gerald | Fuller, Jeff | Laverdiere, Michel | Rotstein, Coleman | Rennie, Robert | Shafran, Stephen D. | Sheppard, Don | Carle, Sylvie | Phillips, Peter | Vinh, Donald C.",Adults | Candidiasis | Epidemiology | Guidelines | Prophylaxis | Therapy,NA,NA,694KV,1712-9532,NA,stream,freshwater
WOS:000347098800014,Antimicrobial susceptibility patterns among Escherichia coli urinary isolates from community-onset health care-associated urinary tract infection,JOURNAL OF THE FORMOSAN MEDICAL ASSOCIATION,12,113,970-973,DEC,2014,"Huang, Ling-Fu | Lo, Yi-Chu | Su, Lin-Hui | Chang, Chin-Lu",antimicrobial susceptibility | community-acquired | empirical therapy | health care-associated | hospital-acquired | urinary tract infection,10.1016/j.jfma.2014.01.009,NA,AX7MA,0929-6646,NA,stream,freshwater
WOS:000304506500004,Comparison of three preparatory methods for detection of bacteremia by MALDI-TOF mass spectrometry,DIAGNOSTIC MICROBIOLOGY AND INFECTIOUS DISEASE,1,73,21-26,MAY,2012,"Saffert, Ryan T. | Cunningham, Scott A. | Mandrekar, Jayawant | Patel, Robin",MALDI-TOF | Bloodstream infection | Mass spectrometry,10.1016/j.diagmicrobio.2012.01.010,NA,948ME,0732-8893,NA,stream,freshwater
WOS:000267277300013,Factors associated with mortality in bacteremic patients with hematologic malignancies,DIAGNOSTIC MICROBIOLOGY AND INFECTIOUS DISEASE,3,64,320-326,JUL,2009,"Tumbarello, Mario | Spanu, Teresa | Caira, Morena | Trecarichi, Enrico M. | Laurenti, Luca | Montuori, Eva | Fianchi, Luana | Leone, Fiammetta | Fadda, Giovanni | Cauda, Roberto | Pagano, Livio",Bacteremia | Hematologic malignancies | Mortality | Antimicrobial resistance,10.1016/j.diagmicrobio.2009.02.008,NA,461OL,0732-8893,NA,stream,freshwater
WOS:000441505800003,Elective distribution of resistance to beta-lactams among Enterobacter cloacae genetic clusters,JOURNAL OF INFECTION,3,77,178-182,SEP,2018,"Garinet, Simon | Fihman, Vincent | Jacquier, Herve | Corvec, Stephane | Le Monnier, Alban | Guillard, Thomas | Cattoir, Vincent | Zahar, Jean-Ralph | Woerther, Paul-Louis | Carbonnelle, Etienne | Wargnier, Alain | Kerneis, Solen | Morand, Philippe C. | GMC",,10.1016/j.jinf.2018.05.005,NA,GQ2SC,0163-4453,NA,stream,freshwater
WOS:000348905400080,Rapid Identification of Gram Negative Bacteria from Blood Culture Broth Using MALDI-TOF Mass Spectrometry,JOVE-JOURNAL OF VISUALIZED EXPERIMENTS,87,NA,,MAY,2014,"Gray, Timothy J. | Thomas, Lee | Olma, Tom | Mitchell, David H. | Iredell, Jon R. | Chen, Sharon C. A.",Immunology | Issue 87 | Gram negative bacilli | blood culture | blood stream infection | bacteraemia | MALDI-TOF | mass spectrometry,10.3791/51663,NA,CA4VV,1940-087X,NA,stream,freshwater
WOS:000427546800012,Microbiology in the sugar industries,SUGAR INDUSTRY-ZUCKERINDUSTRIE,2,143,83-87,FEB,2018,"Wright, Maureen",sugar industry | microbes | detection method | mannitol | bagasse,NA,NA,FZ4FF,0344-8657,NA,stream,freshwater
WOS:A1995QG66600003,ANAEROBIC TREATMENT OF SULFATE-CONTAINING WASTE STREAMS,ANTONIE VAN LEEUWENHOEK INTERNATIONAL JOURNAL OF GENERAL AND MOLECULAR MICROBIOLOGY,1,67,29-46,NA,1995,"COLLERAN, E | FINNEGAN, S | LENS, P",ANAEROBIC COMPETITION | ANAEROBIC DIGESTION | METHANOGENESIS | SULPHIDOGENESIS | SULFATE REDUCTION | SULFIDE TOXICITY,NA,NA,QG666,0003-6072,NA,stream,freshwater
WOS:000445114700013,Sludge reduction and nutrient removal from an anaerobic/anoxic/oxic(A2/O) process coupled with a modified oxic-settling-anaerobic process,DESALINATION AND WATER TREATMENT,NA,105,144-151,FEB,2018,"Sun, Lianpeng | Wang, Yushan | Xu, Wenli | Lin, Yuji | Lin, Meishan | Luo, Wangxing | Shi, Chenyi",Anaerobic | A2/O-MOSA process | Sludge reduction | Sludge | Municipal sewage,10.5004/dwt.2018.22026,NA,GU2QK,1944-3994,NA,stream,freshwater
WOS:000208655000004,Comparison of the VersaTREK blood culture system against the Bactec9240 system in patients with suspected bloodstream infections,ANNALS OF CLINICAL MICROBIOLOGY AND ANTIMICROBIALS,NA,10,,NA,2011,"Dreyer, Andries W. | Ismail, Nazir A. | Nkosi, Deliwe | Lindeque, Kathy | Matthews, Marliza | van Zyl, Danie G. | Hoosen, Anwar A.",,10.1186/1476-0711-10-4,NA,V28AZ,1476-0711,NA,stream,freshwater
WOS:000256324600004,A multiplex real-time PCR assay for rapid detection and differentiation of 25 bacterial and fungal pathogens from whole blood samples,MEDICAL MICROBIOLOGY AND IMMUNOLOGY,3,197,313-324,SEP,2008,"Lehmann, Lutz Eric | Hunfeld, Klaus-Peter | Emrich, Thomas | Haberhausen, Gerd | Wissing, Heimo | Hoeft, Andreas | Stueber, Frank",bacterial and fungal pathogens | blood culture | ICU | multiplex PCR assay | sepsis | simultaneous detection,10.1007/s00430-007-0063-0,NA,307NC,0300-8584,NA,stream,freshwater
WOS:000254122800015,"Bacteremias at a teaching hospital: Etiology, antimicrobial susceptibiliy pattern and risk factors for mortality",REVISTA DA ASSOCIACAO MEDICA BRASILEIRA,1,53,34-38,JAN-FEB,2007,"Guilarde, Adriana Oliveira | Turchi, Marilia Dalva | Turchi Martelli, Celina Maria | Borges Primo, Mariusa Gomes | de Abrel Batista, Lindon Johnson",bacteremia | staphylococcus aureus | nosocomial infection | survival,NA,NA,276DZ,0104-4230,NA,stream,freshwater
WOS:000500887600001,Clinical experience in management of bloodstream infection in emergency medical ward: A preliminary report,HONG KONG JOURNAL OF EMERGENCY MEDICINE,NA,NA,,DEC 3,2019,"Cheung, Ying | Ko, Shing | Wong, Oi Fung | Lam, Hoi Shiu Bosco | Ma, Hing Man | Lit, Chau Hung Albert",Bacteremia | sepsis | critical care | emergency medicine ward,10.1177/1024907919890495,NA,JT3IR,1024-9079,NA,stream,freshwater
WOS:000427179600026,Molecular Identification of Bacteria in Intra-abdominal Abscesses Using Deep Sequencing,OPEN FORUM INFECTIOUS DISEASES,2,5,,FEB,2018,"Kozlov, Andrew | Bean, Lorenzo | Hill, Emilie V. | Zhao, Lisa | Li, Eric | Wang, Gary P.",Intra-abdominal abscesses | 16S RNA sequencing | Illumina sequencing | Microbial diversity | Bioinformatics,10.1093/ofid/ofy025,NA,FY9IR,2328-8957,NA,stream,freshwater
WOS:000356249800005,MALDI-TOF typing highlights geographical and fluconazole resistance clusters in Candida glabrata,MEDICAL MYCOLOGY,5,53,462-469,JUN,2015,"Dhieb, C. | Normand, A. C. | Al-Yasiri, M. | Chaker, E. | El Euch, D. | Vranckx, K. | Hendrickx, M. | Sadfi, N. | Piarroux, R. | Ranque, S.",Candida glabrata | MALDI-TOF | microsatellites | typing | fluconazole susceptibility | clinical microbiology,10.1093/mmy/myv013,NA,CK5GA,1369-3786,NA,stream,freshwater
WOS:000367383300014,The changing epidemiology of bacteraemic osteoarticular infections in the early 21st century,CLINICAL MICROBIOLOGY AND INFECTION,3,21,,MAR,2015,"Murillo, O. | Grau, I. | Lora-Tamayo, J. | Gomez-Junyent, J. | Ribera, A. | Tubau, F. | Ariza, J. | Pallares, R.",Bacteraemia | epidemiology | osteoarticular infections | osteomyelitis | septic arthritis | spondylodiscitis,10.1016/j.cmi.2014.09.007,NA,CZ8XV,1198-743X,NA,stream,freshwater
WOS:000383524500014,Surveillance of antibiotic susceptibility in a Swedish Burn Center 1994-2012,BURNS,6,42,1295-1303,SEP,2016,"Fransen, Jian | Huss, Fredrik R. M. | Nilsson, Lennart E. | Rydell, Ulf | Sjoberg, Folke | Hanberger, Hakan",Burn wound infection | Burn wound colonization | Antibacterial therapy | Antibiotic susceptibility | Burn mortality,10.1016/j.burns.2016.01.025,NA,DW3EI,0305-4179,NA,stream,freshwater
WOS:000260637000008,A prospective cohort study evaluating the prognostic impact of clinical characteristics and comorbid conditions of hospitalized adult and pediatric cancer patients with candidemia,EUROPEAN JOURNAL OF CLINICAL MICROBIOLOGY & INFECTIOUS DISEASES,11,27,1071-1078,NOV,2008,"Velasco, E. | Bigni, R.",,10.1007/s10096-008-0546-y,NA,368QG,0934-9723,NA,stream,freshwater
