uid,title,journal,issue,volume,pages,date,year,authors,keywords,doi,article_no,isi_id,issn,isbn,environment,category
WOS:000229410100006,A comparative study of risk factors and outcome among outpatient-acquired and nosocomial candidaemia,JOURNAL OF HOSPITAL INFECTION,2,60,129-134,JUN,2005,"Pasqualotto, AC | Nedel, WL | Machado, TS | Severo, LC",nosocomial infection | candidosis | candidaemia | community-acquired infection,10.1016/j.jhin.2004.12.012,NA,930IU,0195-6701,NA,stream,freshwater
WOS:000234357200007,PCR evaluation of false-positive signals from two automated blood-culture systems,JOURNAL OF MEDICAL MICROBIOLOGY,1,55,53-57,JAN,2006,"Karahan, ZC | Mumcuglu, L | Guriz, H | Tamer, D | Balaban, N | Aysev, D | Akar, N",,10.1099/jmm.0.46196-0,NA,998ZA,0022-2615,NA,stream,freshwater
WOS:000179376600040,Blood cultures in the critical care unit - Improving utilization and yield,CHEST,5,122,1727-1736,NOV,2002,"Shafazand, S | Weinacker, AB",bacteremia | blood cultures | critically ill | ICU | sepsis,NA,NA,617TH,0012-3692,NA,stream,freshwater
WOS:000247987500004,Analysis of anaerobic blood cultures in burned patients,BURNS,5,33,561-564,AUG,2007,"Regules, Jason A. | Carlson, Misty D. | Wolf, Steven E. | Murray, Clinton K.",burn patients | bacteremia | anaerobe | blood cultures,10.1016/j.burns.2006.10.390,NA,189KJ,0305-4179,NA,stream,freshwater
WOS:000392078200010,"Skin microbiota is the main reservoir of Roseomonas mucosa, an emerging opportunistic pathogen so far assumed to be environmental",CLINICAL MICROBIOLOGY AND INFECTION,8,22,,AUG,2016,"Romano-Bertrand, S. | Bourdier, A. | Aujoulat, F. | Michon, A. -L. | Masnou, A. | Parer, S. | Marchandin, H. | Jumas-Bilak, E.",Habitat | Infection source | Opportunistic pathogens | Population structure | Roseomonas | Skin microbiota,10.1016/j.cmi.2016.05.024,NA,EH9FX,1198-743X,NA,stream,freshwater
WOS:000383317300001,Time-to-Detection Comparison for a Novel Blood Culture System Using Simulated Blood Cultures: DL (TM) versus BacT/ALERT (TM) and BACTEC (TM),CLINICAL LABORATORY,9,62,1595-1600,NA,2016,"Demiray, Tayfur | Koroglu, Mehmet | Altindis, Mustafa",blood stream infection | blood | bacteriological techniques | culture media | diagnostic,10.7754/Clin.Lab.2016.160110,NA,DW0FW,1433-6510,NA,stream,freshwater
WOS:000478648300011,"Microbial communities across a hillslope-riparian transect shaped by proximity to the stream, groundwater table, and weathered bedrock",ECOLOGY AND EVOLUTION,12,9,6869-6900,JUN,2019,"Lavy, Adi | McGrath, David Geller | Carnevali, Paula B. Matheus | Wan, Jiamin | Dong, Wenming | Tokunaga, Tetsu K. | Thomas, Brian C. | Williams, Kenneth H. | Hubbard, Susan S. | Banfield, Jillian F.",metabolism | metagenomics | microbiology | riparian | soil | watershed,10.1002/ece3.5254,NA,IN4MD,2045-7758,NA,stream,freshwater
WOS:000477319300001,Multidrug-resistant Gram-negative bacterial infections in solid organ transplant recipients-Guidelines from the American Society of Transplantation Infectious Diseases Community of Practice,CLINICAL TRANSPLANTATION,9,33,,SEP,2019,"Pouch, Stephanie M. | Patel, Gopi | AST Infect Dis Community Practice",Gram-negative bacterial infection | multidrug resistance | post-transplant infection | solid organ transplantation,10.1111/ctr.13594,NA,JD1UW,0902-0063,NA,stream,freshwater
WOS:000317996900003,Prognostic Factors of Mortality in Very Low-Birth-Weight Infants with Neonatal Sepsis of Nosocomial Origin,AMERICAN JOURNAL OF PERINATOLOGY,5,30,353-358,MAY,2013,"Lobete Prieto, Carlos | Fernandez Colomer, Belen | Lopez Sastre, Jose Blas",blood | infection | microbiology | mortality | infant | low birth weight,10.1055/s-0032-1324701,NA,131MD,0735-1631,NA,stream,freshwater
WOS:000419149100014,Automated direct screening for resistance of Gram-negative blood cultures using the BD Kiestra WorkCell,EUROPEAN JOURNAL OF CLINICAL MICROBIOLOGY & INFECTIOUS DISEASES,1,37,117-125,JAN,2018,"Heather, C. S. | Maley, M.",,10.1007/s10096-017-3109-2,NA,FR6AZ,0934-9723,NA,stream,freshwater
WOS:000262383600002,Analysis of the Patients with Sepsis Caused by Gram Positive and Gram Negative Bacteria,TURKIYE KLINIKLERI TIP BILIMLERI DERGISI,6,28,791-797,DEC,2008,"Turan, Pinar | Tansel, Oezlem | Ekuklu, Galip | Celik, Ayguel Dogan",Sepsis | risk factors,NA,NA,393OW,1300-0292,NA,stream,freshwater
WOS:000367727800006,Growth condition-dependent cell surface proteome analysis of Enterococcus faecium,PROTEOMICS,22,15,3806-3814,NOV,2015,"Sinnige, Jan C. | de Been, Mark | Zhou, Miaomiao | Bonten, Marc J. M. | Willems, Rob J. L. | Top, Janetta",Enterococcus faecium | Growth | Microbiology | MS | Shaving | Surfacome,10.1002/pmic.201500138,NA,DA3VM,1615-9853,NA,stream,freshwater
WOS:000224475200008,Continuous cell washing and mixing driven by an ultrasound standing wave within a microfluidic channel,LAB ON A CHIP,5,4,446-452,NA,2004,"Hawkes, JJ | Barber, RW | Emerson, DR | Coakley, WT",,10.1039/b408045a,NA,862FG,1473-0189,NA,stream,freshwater
WOS:000085456400002,Longitudinal 10-year prospective survey of fungaemia in Slovak Republic: trends in etiology in 310 episodes,DIAGNOSTIC MICROBIOLOGY AND INFECTIOUS DISEASE,1,36,7-11,JAN,2000,"Krcmery, V | Kovacicova, G | Slovak Fungaemia Study Grp",,NA,NA,286QJ,0732-8893,NA,stream,freshwater
WOS:000232211600011,Voriconazole activity against clinical yeast isolates: a multicentre Italian study,INTERNATIONAL JOURNAL OF ANTIMICROBIAL AGENTS,3,26,247-253,SEP,2005,"Morace, G | Polonelli, L | GISIA Grp",voriconazole | yeast susceptibility testing | comparative methods,10.1016/j.ijantimicag.2005.06.005,NA,969CS,0924-8579,NA,stream,freshwater
WOS:000379786700003,Raman spectroscopy detects phenotypic differences among Escherichia coli enriched for 1-butanol tolerance using a metagenomic DNA library,BIOTECHNOLOGY JOURNAL,7,11,877-889,JUL,2016,"Freedman, Benjamin G. | Zu, Theresah N. K. | Wallace, Robert S. | Senger, Ryan S.",Chemometric Fingerprinting | DOP-PCR | Genomic DNA Libraries | Raman Spectroscopy | Solvent Tolerance,10.1002/biot.201500144,NA,DR3EZ,1860-6768,NA,stream,freshwater
WOS:000298369100010,Antibiotic Susceptibility Testing of Grown Blood Cultures by Combining Culture and Real-Time Polymerase Chain Reaction Is Rapid and Effective,PLOS ONE,12,6,,DEC 14,2011,"Beuving, Judith | Verbon, Annelies | Gronthoud, Firza A. | Stobberingh, Ellen E. | Wolffs, Petra F. G.",,10.1371/journal.pone.0027689,NA,866GS,1932-6203,NA,stream,freshwater
WOS:000282315100001,Value-Added Production of Nisin from Soy Whey,APPLIED BIOCHEMISTRY AND BIOTECHNOLOGY,7,162,1819-1833,NOV,2010,"Mitra, Debjani | Pometto, Anthony L., III | Khanal, Samir K. | Karki, Bishnu | Brehm-Stecher, Byron F. | van Leeuwen, J. (Hans)",Soy whey | Nisin | Value-added production | Lactococcus lactis | Bioscreen | Fermentation,10.1007/s12010-010-8951-y,NA,656GD,0273-2289,NA,stream,freshwater
WOS:000230217500009,Antimicrobial susceptibility pattern of blood isolates from a teaching hospital in north India,JAPANESE JOURNAL OF INFECTIOUS DISEASES,3,58,174-176,JUN,2005,"Mehta, M | Dutta, P | Gupta, V",,NA,NA,941LY,1344-6304,NA,stream,freshwater
WOS:000269120200021,CANDIDA ISOLATES IN TERTIARY HOSPITALS IN NORTHEASTERN BRAZIL,BRAZILIAN JOURNAL OF MICROBIOLOGY,2,40,325-328,APR-JUN,2009,"Hinrichsen, Sylvia Lemos | Falcao, Erica | Santos Vilella, Tatiana Aguiar | Rego, Leandro | Lira, Conceicao | Almeida, Luciano | Martins, Mizia | Araujo, Carmem | Duarte, Marcelo | Lopes, Geraldo",Candida | candidemia | candida isolates,NA,NA,485KO,1517-8382,NA,stream,freshwater
WOS:000241433100013,Apparent bias in river water inoculum following centrifugation,JOURNAL OF MICROBIOLOGICAL METHODS,2,67,304-309,NOV,2006,"Bracken, Caragwen L. | Hendricks, Charles W. | Harding, Anna K.",microbiology | water quality | public health indicators | Biolog | inoculum concentration | centrifugation,10.1016/j.mimet.2006.04.003,NA,097FT,0167-7012,NA,stream,freshwater
WOS:000359182400006,Microbiological diagnosis of urinary tract infections,ENFERMEDADES INFECCIOSAS Y MICROBIOLOGIA CLINICA,NA,33,34-39,JUL,2015,"de Toro-Peinado, Inmaculada | Concepcion Mediavilla-Gradolph, M. | Tormo-Palop, Nuria | Palop-Borras, Begona",Urinary infections | Uropathogens | Microbiological diagnosis | UTI,NA,NA,CO5EM,0213-005X,NA,stream,freshwater
WOS:000449646700016,The updated Charlson comorbidity index is a useful predictor of mortality in patients with Staphylococcus aureus bacteraemia,EPIDEMIOLOGY AND INFECTION,16,146,2122-2130,DEC,2018,"Ternavasio-de la Vega, H. G. | Castano-Romero, F. | Ragozzino, S. | Sanchez Gonzalez, R. | Vaquero-Herrero, M. P. | Siller-Ruiz, M. | Spalter-Glicberg, G. | Ramirez-Baum, C. | Rodriguez-Rodriguez, S. | Garcia-Sanchez, J. E. | Garcia-Garcia, I. | Marcos, M.",Bacteraemia | comorbidity | mortality | staphylococcus aureus,10.1017/S0950268818002480,NA,GZ7GR,0950-2688,NA,stream,freshwater
WOS:000322590800004,Multiplex Identification of Gram-Positive Bacteria and Resistance Determinants Directly from Positive Blood Culture Broths: Evaluation of an Automated Microarray-Based Nucleic Acid Test,PLOS MEDICINE,7,10,,JUL,2013,"Buchan, Blake W. | Ginocchio, Christine C. | Manii, Ryhana | Cavagnolo, Robert | Pancholi, Preeti | Swyers, Lettie | Thomson, Richard B., Jr. | Anderson, Christopher | Kaul, Karen | Ledeboer, Nathan A.",,10.1371/journal.pmed.1001478,NA,193VY,1549-1277,NA,stream,freshwater
WOS:000341865800009,Candidaemia Observed at a University Hospital in Milan (Northern Italy) and Review of Published Studies from 2010 to 2014,MYCOPATHOLOGIA,3-4,178,227-241,OCT,2014,"Milazzo, Laura | Peri, Anna Maria | Mazzali, Cristina | Grande, Romualdo | Cazzani, Chiara | Ricaboni, Davide | Castelli, Antonio | Raimondi, Ferdinando | Magni, Carlo | Galli, Massimo | Antinori, Spinello",Candidaemia | Fungal infections | C. albicans | C. glabrata | C. parapsilosis | Intensive care unit,10.1007/s11046-014-9786-9,NA,AP1XO,0301-486X,NA,stream,freshwater
WOS:000419149100021,Extensive colonization with carbapenemase-producing microorganisms in Romanian burn patients: infectious consequences from the Colectiv fire disaster,EUROPEAN JOURNAL OF CLINICAL MICROBIOLOGY & INFECTIOUS DISEASES,1,37,175-183,JAN,2018,"Pirii, L. E. | Friedrich, A. W. | Rossen, J. W. A. | Vogels, W. | Beerthuizen, G. I. J. M. | Nieuwenhuis, M. K. | Kooistra-Smid, A. M. D. | Bathoorn, E.",Carbapenemase | CPE | Burn patients | Infection control | Review | Molecular epidemiology,10.1007/s10096-017-3118-1,NA,FR6AZ,0934-9723,NA,stream,freshwater
WOS:000256067700002,Nosocomial bloodstream infection in a pediatric intensive care unit,INDIAN JOURNAL OF PEDIATRICS,1,75,25-30,JAN,2008,"Singhi, Sunit | Ray, Pallab | Mathew, Joseph L. | Jayashree, M. | Dhanalakshmi",nosocomial infections | PICU | pathogens | antibiotic therapy,NA,NA,303UZ,0019-5456,NA,stream,freshwater
WOS:000333348500052,Detection of OXA-1 beta-Lactamase Gene of Klebsiella pneumoniae from Blood Stream Infections (BSI) by Conventional PCR and In-Silico Analysis to Understand the Mechanism of OXA Mediated Resistance,PLOS ONE,3,9,,MAR 19,2014,"Sugumar, Madhan | Kumar, K. M. | Manoharan, Anand | Anbarasu, Anand | Ramaiah, Sudha",,10.1371/journal.pone.0091800,NA,AD6ER,1932-6203,NA,stream,freshwater
WOS:000499232200003,Antimicrobial de-escalation in critically ill patients: a position statement from a task force of the European Society of Intensive Care Medicine (ESICM) and European Society of Clinical Microbiology and Infectious Diseases (ESCMID) Critically Ill Patients Study Group (ESGCIP),INTENSIVE CARE MEDICINE,NA,NA,,NOV 28,2019,"Tabah, Alexis | Bassetti, Matteo | Kollef, Marin H. | Zahar, Jean-Ralph | Paiva, Jose-Artur | Timsit, Jean-Francois | Roberts, Jason A. | Schouten, Jeroen | Giamarellou, Helen | Rello, Jordi | De Waele, Jan | Shorr, Andrew F. | Leone, Marc | Poulakou, Garyphallia | Depuydt, Pieter | Garnacho-Montero, Jose",Antimicrobial de-escalation | De-escalation | Antimicrobial resistance | Stewardship,10.1007/s00134-019-05866-w,NA,JQ9BJ,0342-4642,NA,stream,freshwater
WOS:000364303800020,Evaluation of Antimicrobial Therapy of Blood Culture Positive Healthcare-Associated Infections in Children,PLoS One,11,10,,NOV 5,2015,"Laine, Niina | Vaara, Martti | Anttila, Veli-Jukka | Hoppu, Kalle | Laaksonen, Raisa | Airaksinen, Marja | Saxen, Harri",,10.1371/journal.pone.0141555,NA,CV5IS,1932-6203,NA,stream,freshwater
WOS:000262901100007,Microbial profile and drug resistance of Candida strains isolated from the blood of children: an 11-year study,MYCOSES,2,52,149-153,MAR,2009,"Malafiej, Eugeniusz | Adamiec, Anna Ciebiada | Tworzyanska, Urszula",Candidaemia | Candida spp | epidemiology | antifungal susceptibility,10.1111/j.1439-0507.2008.01560.x,NA,400WW,0933-7407,NA,stream,freshwater
WOS:000366615800011,Application of PCR and High-Resolution Melting for Rapid Identification of Yeasts Routinely Isolated in a Clinical Microbiology Laboratory,ANNALS OF CLINICAL AND LABORATORY SCIENCE,6,45,680-685,FAL,2015,Guo Ninghui | Wang Bing | Ren Wei | Liu Mengmeng | Chu Meiling | Meng Dongya | Yao Liqiong | Xue Wencheng,Polymerase-chain reaction high-resolution melting analysis (PCR-HRM) | Candida | Rapid identification,NA,NA,CY7UW,0091-7370,NA,stream,freshwater
WOS:000221498400013,A cost-benefit analysis of gown use in controlling vancomycin-resistant Enterococcus transmission: Is it worth the price?,INFECTION CONTROL AND HOSPITAL EPIDEMIOLOGY,5,25,418-424,MAY,2004,"Puzniak, LA | Gillespie, KN | Leet, T | Kollef, M | Mundy, LM",,NA,NA,821YD,0899-823X,NA,stream,freshwater
WOS:000250898200016,Evaluation of Bacteremias in a Turkish university hospital: 3-year outcomes,ADVANCES IN THERAPY,4,24,841-851,JUL-AUG,2007,"Dernirdall, Tuna | Dernirturk, Nese | Cetinkaya, Zafer | Tufan, GuInihal",hospital-acquired bacteremia | community-acquired bacteremia | blood culture,NA,NA,230TG,0741-238X,NA,stream,freshwater
WOS:000463350400019,Implementation of a national quality improvement program to enhance hand hygiene in nursing homes in Taiwan,JOURNAL OF MICROBIOLOGY IMMUNOLOGY AND INFECTION,2,52,345-351,APR,2019,"Lai, Chih-Cheng | Lu, Min-Chi | Tang, Hung-Jen | Chen, Yen-Hsu | Wu, Yi-Hui | Chiang, Hsiu-Tzy | Wu, Li-Hung | Ko, Wen-Chien | Hsueh, Po-Ren | Chen, Yu-Hui | Infection Control Soc Taiwan",Quality improvement program | Hand hygiene | Nursing homes | Taiwan,10.1016/j.jmii.2018.09.007,NA,HR7QT,1684-1182,NA,stream,freshwater
WOS:000232823300009,Update on the Burkholderia cepacia complex,CURRENT OPINION IN PULMONARY MEDICINE,6,11,528-533,NOV,2005,"LiPuma, JJ",Burkholderia cepacia complex | cystic fibrosis | pulmonary infection,NA,NA,977SK,1070-5287,NA,stream,freshwater
WOS:000341062200012,An emerging issue of mixed yeast cultures,JOURNAL OF MICROBIOLOGY IMMUNOLOGY AND INFECTION,4,47,339-344,AUG,2014,"Yang, Yun-Liang | Chu, Wen-Li | Lin, Chih-Chao | Tsai, Sheng-Hua | Chang, Te-Pin | Lo, Hsiu-Jung",Candida species | CHROMagar Candida medium | Germ tube test | Identification,10.1016/j.jmii.2013.01.001,NA,AO1HC,1684-1182,NA,stream,freshwater
WOS:000308342000004,Antifungal Susceptibility Patterns Among Candida Species Isolated from Blood at Universiti Kebangsaan Malaysia Medical Centre,SAINS MALAYSIANA,8,41,961-967,AUG,2012,"Hamid, Siti Umairah Binti | Tan, Sharon | Ridzuan, Siti Nurwani Binti Ahmad | Seman, Mohd Syazwan Bin Che | Ramli, Ramliza Binti | Bin Khaithir, Tzar Mohd Nizam",Antifungal resistance | antifungal susceptibility | Candida | candidaemia,NA,NA,999VB,0126-6039,NA,stream,freshwater
WOS:000425296100009,Impact of interventions by an antimicrobial stewardship program team on appropriate antimicrobial therapy in patients with bacteremic urinary tract infection,JOURNAL OF INFECTION AND CHEMOTHERAPY,3,24,206-211,MAR,2018,"Yanai, Mitsuru | Ogasawara, Maiko | Hayashi, Yuta | Suzuki, Kiyozumi | Takahashi, Hiromichi | Satomura, Atsushi",Urinary tract infection | Bacteremia | Antimicrobial stewardship program | De-escalation,10.1016/j.jiac.2017.10.017,NA,FW4PN,1341-321X,NA,stream,freshwater
WOS:000384129200008,Prevalence and risk factors of Gram-negative bacilli causing blood stream infection in patients with malignancy,SAUDI MEDICAL JOURNAL,9,37,979-984,SEP,2016,"Al-Otaibi, Fawzia E. | Bukhari, Elham E. | Badr, Mona | Alrabiaa, Abdulkarim A.",,10.15537/smj.2016.9.14211,NA,DX1LP,0379-5284,NA,stream,freshwater
WOS:000240447000001,Risk factors for nosocomial urinary tract-related bacteremia: A case-control study,AMERICAN JOURNAL OF INFECTION CONTROL,7,34,401-407,SEP,2006,"Saint, Sanjay | Kaufman, Samuel R. | Rogers, Mary A. M. | Baker, Paul D. | Boyko, Edward J. | Lipsky, Benjamin A.",,10.1016/j.ajic.2006.03.001,NA,083HM,0196-6553,NA,stream,freshwater
WOS:000442111300036,Impact of Yeast Pigmentation on Heat Capture and Latitudinal Distribution,CURRENT BIOLOGY,16,28,2657-+,AUG 20,2018,"Cordero, Radames J. B. | Robert, Vincent | Cardinali, Gianluigi | Arinze, Ebuka S. | Thon, Susanna M. | Casadevall, Arturo",,10.1016/j.cub.2018.06.034,NA,GQ9PA,0960-9822,NA,stream,freshwater
WOS:000246765500008,Microbiologic workload and clinical significance of Streptococcus pneumoniae isolated during one week in Spain,MICROBIAL DRUG RESISTANCE-MECHANISMS EPIDEMIOLOGY AND DISEASE,1,13,52-61,SPR,2007,"Bouza, Emilio | Arenas, Cristina | Cercenado, Emilia | Cuevas, Oscar | Vicioso, Dolores | Fenoll, Asuncion | Spanish Pneumococcal Infection",,10.1089/mdr.2006.9997,NA,171WG,1076-6294,NA,stream,freshwater
WOS:000247286500039,Multiplexed identification of blood-borne bacterial pathogens by use of a novel 16S rRNA gene PCR-ligase detection reaction-capillary electrophoresis assay,JOURNAL OF CLINICAL MICROBIOLOGY,6,45,1927-1935,JUN,2007,"Pingle, Maneesh R. | Granger, Kathleen | Feinberg, Philip | Shatsky, Rebecca | Sterling, Bram | Rundell, Mark | Spitzer, Eric | Larone, Davise | Golightly, Linnie | Barany, Francis",,10.1128/JCM.00226-07,NA,179JT,0095-1137,NA,stream,freshwater
WOS:000394512400001,Potential Impact of Rapid Blood Culture Testing for Gram-Positive Bacteremia in Japan with the Verigene Gram-Positive Blood Culture Test,CANADIAN JOURNAL OF INFECTIOUS DISEASES & MEDICAL MICROBIOLOGY,NA,NA,,NA,2017,"Kikuchi, Ken | Matsuda, Mari | Iguchi, Shigekazu | Mizutani, Tomonori | Hiramatsu, Keiichi | Tega-Ishii, Michiru | Sansaka, Kaori | Negishi, Kenta | Shimada, Kimie | Umemura, Jun | Notake, Shigeyuki | Yanagisawa, Hideji | Takahashi, Hiroshi | Yabusaki, Reiko | Araoka, Hideki | Yoneyama, Akiko",,10.1155/2017/4896791,NA,EL3II,1712-9532,NA,stream,freshwater
WOS:000363407300023,Stenotrophomonas maltophilia Infections in Adults: Primary Bacteremia and Pneumonia,JUNDISHAPUR JOURNAL OF MICROBIOLOGY,8,8,,AUG,2015,"Gozel, Mustafa Gokhan | Celik, Cem | Elaldi, Nazif",Infection | Pneumonia | Mortality | Stenotrophomonas maltophilia | Nosocomial Infections | Primary Bacteremia,10.5812/jjm.23569,NA,CU3EQ,2008-3645,NA,stream,freshwater
WOS:000324835100007,In vitro synergistic activity of diketopiperazines alone and in combination with amphotericin B or clotrimazole against Candida albicans,FOLIA MICROBIOLOGICA,6,58,475-482,NOV,2013,"Kumar, S. Nishanth | Nambisan, Bala | Mohandas, C. | Sundaresan, A.",,10.1007/s12223-013-0234-x,NA,223TY,0015-5632,NA,stream,freshwater
WOS:000296152600010,Data linkage between existing healthcare databases to support hospital epidemiology,JOURNAL OF HOSPITAL INFECTION,3,79,231-235,NOV,2011,"Alvarez, L. Garcia | Aylin, P. | Tian, J. | King, C. | Catchpole, M. | Hassall, S. | Whittaker-Axon, K. | Holmes, A.",Alert systems | Healthcare-associated infections | Influenza | Record linkage | Risk predictive models | Syndromic surveillance,10.1016/j.jhin.2011.06.016,NA,836XQ,0195-6701,NA,stream,freshwater
WOS:000074133400003,Biofouling problems in membrane processes for water desalination and reuse in Saudi Arabia,INTERNATIONAL BIODETERIORATION & BIODEGRADATION,1,41,19-23,NA,1998,"Abd El Aleem, FA | Al-Sugair, KA | Alahmad, MI",biofouling | membrane processes | desalination | water reuse | water treatment,NA,NA,ZT843,0964-8305,NA,stream,freshwater
WOS:000387364700007,Current trends in candidemia and species distribution among adults: Candida glabrata surpasses C-albicans in diabetic patients and abdominal sources,MYCOSES,12,59,781-786,DEC,2016,"Khatib, Riad | Johnson, Leonard B. | Fakih, Mohamad G. | Riederer, Kathleen | Briski, Laurence",Candidemia | Candida albicans | Candida glabrata | trend,10.1111/myc.12531,NA,EB4SU,0933-7407,NA,stream,freshwater
WOS:000393930600013,Significant publications on infectious diseases pharmacotherapy in 2015,AMERICAN JOURNAL OF HEALTH-SYSTEM PHARMACY,4,74,238-252,FEB 15,2017,"Babic, Jessica T. | Sofjan, Amelia | Babin, Margaret | Echevarria, Kelly | Ikwuagwu, Judy O. | Lam, Wai-Ying M. | Aitken, Samuel L. | Perez, Katherine K.",antiinfective agents | communicable diseases | drug therapy | microbiology | publications | therapeutic use,10.2146/ajhp160090,NA,EK4XG,1079-2082,NA,stream,freshwater
WOS:000281836600001,Efficacy of bacterial ribosomal RNA-targeted reverse transcription-quantitative PCR for detecting neonatal sepsis: a case control study,BMC PEDIATRICS,NA,10,,JUL 29,2010,"Fujimori, Makoto | Hisata, Ken | Nagata, Satoru | Matsunaga, Nobuaki | Komatsu, Mitsutaka | Shoji, Hiromichi | Sato, Hiroaki | Yamashiro, Yuichiro | Asahara, Takashi | Nomoto, Koji | Shimizu, Toshiaki",,10.1186/1471-2431-10-53,NA,650GG,1471-2431,NA,stream,freshwater
WOS:000464199200002,Defining System Requirements for Simplified Blood Culture to Enable Widespread Use in Resource-Limited Settings,DIAGNOSTICS,1,9,,JAN 11,2019,"Dailey, Peter J. | Osborn, Jennifer | Ashley, Elizabeth A. | Baron, Ellen Jo | Dance, David A. B. | Fusco, Daniela | Fanello, Caterina | Manabe, Yukari C. | Mokomane, Margaret | Newton, Paul N. | Tessema, Belay | Isaacs, Chris | Dittrich, Sabine",blood culture | hemoculture | target product profile | low | and middle-income countries | LMICs | resource limited | microbiology | AMR | sepsis,10.3390/diagnostics9010010,NA,HS9PM,NA,NA,stream,freshwater
WOS:000285137800006,The effect of age on the bacteria isolated and the antibiotic-sensitivity pattern in infections among cancer patients,INDIAN JOURNAL OF CANCER,4,47,391-396,OCT-DEC,2010,"Kumar, P. | Medhekar, A. | Ghadyalpatil, N. S. | Noronha, V | Biswas, S. | Kurkure, P. | Nair, R. | Kelkar, R. | Banavali, S. D.",Cancer | opportunistic infections | age | antibiotic sensitivity,10.4103/0019-509X.73574,NA,692FG,0019-509X,NA,stream,freshwater
WOS:000209028600004,Arctic microbial ecosystems and impacts of extreme warming during the International Polar Year,POLAR SCIENCE,3,3,171-180,NOV,2009,"Vincent, Warwick F. | Whyte, Lyle G. | Lovejoy, Connie | Greer, Charles W. | Laurion, Isabelle | Suttle, Curtis A. | Corbeil, Jacques | Mueller, Derek R.",Arctic | Biodiversity | Climate change | Ecosystems | Ice | Microbiology | Permafrost,10.1016/j.polar.2009.05.004,NA,V33OR,1873-9652,NA,stream,freshwater
WOS:000351923700014,Improving Positive Blood Culture Removal Time Significantly Decreases Total Processing Time,ARCHIVES OF PATHOLOGY & LABORATORY MEDICINE,2,139,199-203,FEB,2015,"Salazar, Eric | Divatia, Mukul | Cernoch, Patricia L. | Olsen, Randall J. | Long, S. Wesley | Land, Geoffrey A. | Davis, James R. | Musser, James M.",,10.5858/arpa.2013-0681-OA,NA,CE6CN,0003-9985,NA,stream,freshwater
WOS:000238023100017,Sacral osteomyelitis after ileal pouch-anal anastomosis: Report of four cases,DISEASES OF THE COLON & RECTUM,6,49,913-918,JUN,2006,"Taylor, William E. | Wolff, Bruce G. | Pemberton, John H. | Yaszemski, Michael J.",inflammatory bowel disease | ileal pouch-anal anastomosis | sacral osteomyelitis,10.1007/s10350-006-0524-3,NA,049NK,0012-3706,NA,stream,freshwater
WOS:000488509100002,"Retrospective Analysis of Microbial Colonization Patterns in Central Venous Catheters, 2013-2017",JOURNAL OF HEALTHCARE ENGINEERING,NA,2019,,SEP 17,2019,"He, Yu | Zhao, Huihan | Wei, Yan | Gan, Xiao | Ling, Ying | Ying, Yanping",,10.1155/2019/8632701,NA,JB4ER,2040-2295,NA,stream,freshwater
WOS:000451823300019,"Clinical features, outcomes, and molecular characteristics of an outbreak of Staphylococcus haemolyticus infection, among a mass-burn casualty patient group, in a tertiary center in northern Taiwan",JOURNAL OF MICROBIOLOGY IMMUNOLOGY AND INFECTION,6,51,847-855,DEC,2018,"Chang, Peng-Hao | Liu, Tsui-Ping | Huang, Po-Yen | Lin, Shu-Yu | Lin, Jung-Fu | Yeh, Chun-Fu | Chang, Shih-Cheng | Wu, Ting-Shu | Lu, Jang-Jih",Burn | Outbreak | Outcome | Pulsed-field gel electrophoresis (PFGE) | Staphylococcus haemolyticus (SH),10.1016/j.jmii.2018.07.004,NA,HC5DI,1684-1182,NA,stream,freshwater
WOS:000304894700003,Diagnosis of Neonatal Sepsis by Broad-Range 165 Real-Time Polymerase Chain Reaction,NEONATOLOGY,4,101,241-246,NA,2012,"Ohlin, Andreas | Backman, Anders | Ewald, Uwe | Schollin, Jens | Bjorkqvist, Maria",Sepsis | Diagnosis | Polymerase chain reaction | Sensitivity and specificity,10.1159/000334655,NA,953SY,1661-7800,NA,stream,freshwater
WOS:000288251200003,Surviving the first hours in sepsis: getting the basics right (an intensivist's perspective),JOURNAL OF ANTIMICROBIAL CHEMOTHERAPY,NA,66,II11-II23,APR,2011,"Daniels, Ron",antibiotics | bundles | critical | cultures | lactate,10.1093/jac/dkq515,NA,733GM,0305-7453,NA,stream,freshwater
WOS:000179507400005,Probabilistic models of food microbial safety and nutritional quality,JOURNAL OF FOOD ENGINEERING,2-3,56,135-142,FEB,2003,"Gonzalez-Martinez, C | Corradini, MG | Peleg, M",quality assurance | quality control | risk assessment | predictive microbiology,NA,NA,619ZG,0260-8774,NA,stream,freshwater
WOS:000182507300001,"Prospective evaluation of the epidemiology, microbiology, and outcome of bloodstream infections in hematologic patients in a single cancer center",EUROPEAN JOURNAL OF CLINICAL MICROBIOLOGY & INFECTIOUS DISEASES,3,22,137-143,MAR,2003,"Velasco, E | Byington, R | Martins, CAS | Schirmer, M | Dias, LMC | Goncalves, VMSC",,10.1007/s10096-003-0894-6,NA,672EC,0934-9723,NA,stream,freshwater
