uid,title,journal,issue,volume,pages,date,year,authors,keywords,doi,article_no,isi_id,issn,isbn,environment,category
WOS:000256245900226,"Annual bloom-time phosphorus fertigation affects soil phosphorus, apple tree phosphorus nutrition, yield, and fruit quality",HORTSCIENCE,3,43,885-890,JUN,2008,"Neilsen, Gerry H. | Neilsen, Denise | Toivonen, Peter | Herbert, Linda",antioxidant content | browning | leaf and fruit P | water core,NA,NA,306KC,0018-5345,NA,soil,terrestrial
WOS:000268138000038,Identification of Dissolved Nonreactive Phosphorus in Freshwater by Precipitation with Aluminum and Subsequent P-31 NMR Analysis,ENVIRONMENTAL SCIENCE & TECHNOLOGY,14,43,5391-5397,JUL 15,2009,"Reitzel, Kasper | Jensen, Henning S. | Flindt, Mogens | Andersen, Frede O.",,10.1021/es900994m,NA,472NE,0013-936X,NA,soil,terrestrial
WOS:000279209000002,MONOPOTASSIUM PHOSPHATE AS AN IN-SEASON FERTIGATION OPTION FOR POTATO,JOURNAL OF PLANT NUTRITION,10,33,1422-1434,NA,2010,"Hopkins, Bryan G. | Ellsworth, Jason W. | Shiffler, Amanda K. | Cook, Aaron G. | Bowen, Thomas R.",monopotassium phosphate | MKP | nitrogen | phosphorus | potassium | general plant nutrition | potato | Solanum tuberosum | fertigation | fertilizers,10.1080/01904167.2010.489981,NA,616KT,0190-4167,NA,soil,terrestrial
WOS:000267586200039,"Organic phosphorus species in surface sediments of a large, shallow, eutrophic lake, Lake Taihu, China",ENVIRONMENTAL POLLUTION,8-9,157,2507-2513,AUG-SEP,2009,"Bai, Xiuling | Ding, Shiming | Fan, Chengxin | Liu, Tao | Shi, Dan | Zhang, Lu",Organic phosphorus | Sediment | Water column | P-31 NMR,10.1016/j.envpol.2009.03.018,NA,465LM,0269-7491,NA,soil,terrestrial
WOS:000374211500040,Fate of granular versus liquid fertilisers applied to soil leaching columns,INTERNATIONAL SUGAR JOURNAL,1408,118,296-300,APR,2016,"Pittaway, P. | Melland, A. | Celotto, G. | Dowie, J. | Shannon, G. | Di Bella, L.",polyphosphate | osmotic suction | nitrogen immobilisation | plant cane,NA,NA,DJ4XN,0020-8841,NA,soil,terrestrial
WOS:A1995TG89100004,ULTRASTRUCTURAL LOCATION OF PROTEINS IN RHIZOMORPHS AND MANTLES OF NATURAL SPRUCE ECTOMYCORRHIZAE,NOVA HEDWIGIA,3-4,61,367-376,NA,1995,"FRANZ, F | ACKER, G",SPRUCE ECTOMYCORRHIZAE | ULTRASTRUCTURE | RHIZOMORPHS | PROTEIN DISTRIBUTION | FUNGAL CELL WALLS | INTERHYPHAL MATRIX | DOLIPORE SEPTA,NA,NA,TG891,0029-5035,NA,soil,terrestrial
WOS:000433170100008,"Roseisolibacter agri gen. nov., sp nov., a novel slow-growing member of the under-represented phylum Gemmatimonadetes",INTERNATIONAL JOURNAL OF SYSTEMATIC AND EVOLUTIONARY MICROBIOLOGY,4,68,1028-1036,APR,2018,"Pascual, Javier | Foesel, Baerbel U. | Geppert, Alicia | Huber, Katharina J. | Boedeker, Christian | Luckner, Manja | Wanner, Gerhard | Overmann, Joerg",Gemmatimonadetes | Gemmatimonadaceae | savannah soil,10.1099/ijsem.0.002619,NA,GH1NR,1466-5026,NA,soil,terrestrial
WOS:000250553500006,Banksia species (Proteaceae) from severely phosphorus-impoverished soils exhibit extreme efficiency in the use and re-mobilization of phosphorus,PLANT CELL AND ENVIRONMENT,12,30,1557-1565,DEC,2007,"Denton, Matthew D. | Veneklaas, Erik J. | Freimoser, Florian M. | Lambers, Hans",banksia | nutrient | phosphorus | photosynthesis | P-use efficiency | re-mobilization | translocation,NA,NA,225YF,0140-7791,NA,soil,terrestrial
WOS:000504330500014,Structure-Specific Regulation of Nutrient Transport and Metabolism in Arbuscular Mycorrhizal Fungi,PLANT AND CELL PHYSIOLOGY,10,60,2272-2281,OCT,2019,"Kameoka, Hiromu | Maeda, Taro | Okuma, Nao | Kawaguchi, Masayoshi",Arbuscular mycorrhizal fungi | Metabolism | Transcriptome | Transporter,10.1093/pcp/pcz122,NA,JY3PI,0032-0781,NA,soil,terrestrial
WOS:000239818700004,Temperature affects stoichiometry and biochemical composition of Escherichia coli,MICROBIAL ECOLOGY,1,52,26-33,JUL,2006,"Cotner, James B. | Makino, Wataru | Biddanda, Bopaiah A.",,10.1007/s00248-006-9040-1,NA,074NI,0095-3628,NA,soil,terrestrial
WOS:000275563200012,Effects of ions and phosphates on alkaline phosphatase activity in aerobic activated sludge system,BIORESOURCE TECHNOLOGY,10,101,3394-3399,MAY,2010,"Xie, Chunsheng | Lu, Rongjie | Huang, Yan | Wang, Qian | Xu, Xinhua",Wastewater treatment | Activated sludge | Alkaline phosphatase | Enzyme kinetics | Metal ions,10.1016/j.biortech.2009.12.047,NA,568YS,0960-8524,NA,soil,terrestrial
WOS:000358130500008,Comparison of Phosphorus Forms in Three Extracts of Dairy Feces by Solution P-31 NMR Analysis,COMMUNICATIONS IN SOIL SCIENCE AND PLANT ANALYSIS,13,46,1698-1712,JUL 20,2015,"Cade-Menun, Barbara J. | He, Zhongqi | Dou, Zhengxia",excreta | phosphorus | extraction | dithionite | Animal manure,10.1080/00103624.2015.1047512,NA,CN0UX,0010-3624,NA,soil,terrestrial
WOS:000357355500008,Characterization of biogenic phosphorus in outflow water from constructed wetlands,GEODERMA,NA,257,58-66,NOV,2015,"Jorgensen, C. | Inglett, K. S. | Jensen, Henning S. | Reitzel, Kasper | Reddy, K. R.",Organic phosphorus | Phosphonate | Polyphosphate | Stormwater treatment areas,10.1016/j.geoderma.2015.01.019,NA,CM0GD,0016-7061,NA,soil,terrestrial
WOS:000262483500039,"Phosphorus Composition in Sediments from Seven Different Trophic Lakes, China: A Phosphorus-31 NMR Study",JOURNAL OF ENVIRONMENTAL QUALITY,1,38,353-359,JAN-FEB,2009,"Zhang, Runyu | Wu, Fengchang | He, Zhongqi | Zheng, Jian | Song, Baoan | Jin, Linhong",,10.2134/jeq2007.0616,NA,394WJ,0047-2425,NA,soil,terrestrial
WOS:000464942500028,Immobilizing unicellular microalga on pellet-forming filamentous fungus: Can this provide new insights into the remediation of arsenic from contaminated water?,BIORESOURCE TECHNOLOGY,NA,284,231-239,JUL,2019,"Li, Bin | Zhang, Ting | Yang, Zhaoguang",Arsenic species | Aspergillus oryzae | Chlorella vulgaris | Fungal-algal pellet | Species transformation,10.1016/j.biortech.2019.03.128,NA,HU0DV,0960-8524,NA,soil,terrestrial
WOS:000468253500034,Extraction and quantification of polyphosphates in activated sludge from waste water treatment plants by P-31 NMR spectroscopy,WATER RESEARCH,NA,157,346-355,JUN 15,2019,"Staal, Line Boisen | Petersen, Anne Boisen | Jorgensen, Charlotte A. | Nielsen, Ulla Gro | Nielsen, Per Halkaejr | Reitzel, Kasper",Polyphosphate | Identification | Quantification | P-31 | Solid state NMR | EBPR | Biological waste water treatment,10.1016/j.watres.2019.03.065,NA,HY6PZ,0043-1354,NA,soil,terrestrial
WOS:000242988600005,Biogenic phosphorus in oligotrophic mountain lake sediments: Differences in composition measured with NMR spectroscopy,WATER RESEARCH,20,40,3705-3712,DEC,2006,"Ahlgren, Joakim | Reitzel, Kasper | Danielsson, Rolf | Gogoll, Adolf | Rydin, Emil",phosphorus species | P-31-NMR spectroscopy | reservoirs | oligotrophication | method validation | P-31-NMR accuracy,10.1016/j.watres.2006.09.006,NA,119CA,0043-1354,NA,soil,terrestrial
WOS:000315473000005,Impact of long-term nitrogen fertilization and rotation with soybean on the diversity and phosphorus metabolism of indigenous arbuscular mycorrhizal fungi within the roots of maize (Zea mays L.),AGRICULTURE ECOSYSTEMS & ENVIRONMENT,NA,164,53-61,JAN 1,2013,"Tian, H. | Drijber, R. A. | Zhang, J. L. | Li, X. L.",Arbuscular mycorrhizal fungi | Agriculture | Maize | Crop rotation | Arbuscular mycorrhizal diversity | N fertilizer,10.1016/j.agee.2012.09.007,NA,097KM,0167-8809,NA,soil,terrestrial
WOS:000170086500016,Nutrient transfer in arbuscular mycorrhizas: how are fungal and plant processes integrated?,AUSTRALIAN JOURNAL OF PLANT PHYSIOLOGY,7,28,683-694,NA,2001,"Smith, SE | Dickson, S | Smith, FA",membrane transporters | phosphorus | sugars,NA,NA,456MP,0310-7841,NA,soil,terrestrial
WOS:000410019500004,"Phosphorus fertilization, soil stratification, and potential water quality impacts",JOURNAL OF SOIL AND WATER CONSERVATION,5,72,417-424,SEP-OCT,2017,"Smith, D. R. | Huang, C. | Haney, R. L.",cover crops | fertilizer management | phosphorus stratification | runoff,10.2489/jswc.72.5.417,NA,FG3EL,0022-4561,NA,soil,terrestrial
WOS:000256460400028,"Complete genome sequence of Nitrosospira multiformis, an ammonia-oxidizing bacterium from the soil environment",APPLIED AND ENVIRONMENTAL MICROBIOLOGY,11,74,3559-3572,JUN,2008,"Norton, Jeanette M. | Klotz, Martin G. | Stein, Lisa Y. | Arp, Daniel J. | Bottomley, Peter J. | Chain, Patrick S. G. | Hauser, Loren J. | Land, Miriam L. | Larimer, Frank W. | Shin, Maria W. | Starkenburg, Shawn R.",,10.1128/AEM.02722-07,NA,309KX,0099-2240,NA,soil,terrestrial
WOS:000439517000006,Phosphorus- and nitrogen-acquisition strategies in two Bossiaea species (Fabaceae) along retrogressive soil chronosequences in south-western Australia,PHYSIOLOGIA PLANTARUM,3,163,323-343,JUL,2018,"Abrahao, Anna | Ryan, Megan H. | Laliberte, Etienne | Oliveira, Rafael S. | Lambers, Hans",,10.1111/ppl.12704,NA,GN9KK,0031-9317,NA,soil,terrestrial
WOS:000223987000026,Effects of aeration on water quality from septic system leachfields,JOURNAL OF ENVIRONMENTAL QUALITY,5,33,1828-1838,SEP-OCT,2004,"Potts, DA | Gorres, JH | Nicosia, EL | Amador, JA",,NA,NA,855PU,0047-2425,NA,soil,terrestrial
WOS:000245168000035,"Deefgea rivuli gen. nov., sp nov., a member of the class Betaproteobacteria",INTERNATIONAL JOURNAL OF SYSTEMATIC AND EVOLUTIONARY MICROBIOLOGY,NA,57,639-645,MAR,2007,"Stackebrandt, Erko | Lang, Elke | Cousin, Sylvie | Paeuker, Orsola | Brambilla, Evelyne | Kroppenstedt, Reiner | Luensdorf, Heinrich",,10.1099/ijs.0.64771-0,NA,149SX,1466-5026,NA,soil,terrestrial
WOS:000429303700007,Biochemistry and Physiology of Heavy Metal Resistance and Accumulation in Euglena,"EUGLENA: BIOCHEMISTRY, CELL AND MOLECULAR BIOLOGY",NA,979,91-121,NA,2017,"Moreno-Sanchez, Rafael | Rodriguez-Enriquez, Sara | Jasso-Chavez, Ricardo | Saavedra, Emma | Garcia-Garcia, Jorge D.",Heavy metals accumulation | Bioremediation | Phytochelatins | Polyphosphates,10.1007/978-3-319-54910-1_6,NA,BJ9IZ,0065-2598,978-3-319-54908-8,soil,terrestrial
WOS:000449521400029,The Hebeloma cylindrosporum HcPT2 Pi transporter plays a key role in ectomycorrhizal symbiosis,NEW PHYTOLOGIST,4,220,1185-1199,DEC,2018,"Becquer, Adeline | Garcia, Kevin | Amenc, Laurie | Rivard, Camille | Dore, Jeanne | Trives-Segura, Carlos | Szponarski, Wojciech | Russet, Sylvie | Baeza, Yoan | Lassalle-Kaiser, Benedikt | Gay, Gilles | Zimmermann, Sabine Dagmar | Plassard, Claude",ectomycorrhizal (ECM) fungus | overexpression | P-32 labeling | phosphate transporter | Pinus pinaster | RNA interference | X-ray fluorescence mapping,10.1111/nph.15281,NA,GZ6DB,0028-646X,NA,soil,terrestrial
WOS:A1994NQ76400002,SIDEROPHORE ACTIVITY OF MYOINOSITOL HEXAKISPHOSPHATE IN PSEUDOMONAS-AERUGINOSA,JOURNAL OF BACTERIOLOGY,12,176,3455-3459,JUN,1994,"SMITH, AW | POYNER, DR | HUGHES, HK | LAMBERT, PA",,NA,NA,NQ764,0021-9193,NA,soil,terrestrial
WOS:000339695900034,Elemental stoichiometry of Fungi and Bacteria strains from grassland leaf litter,SOIL BIOLOGY & BIOCHEMISTRY,NA,76,278-285,SEP,2014,"Mouginot, Celine | Kawamura, Rika | Matulich, Kristin L. | Berlemont, Renaud | Allison, Steven D. | Amend, Anthony S. | Martiny, Adam C.",Nutrient stoichiometry | Growth rate hypothesis | Redfield | C:N:P ratios | Resource allocation,10.1016/j.soilbio.2014.05.011,NA,AM2QM,0038-0717,NA,soil,terrestrial
WOS:000509438100088,The bacterial community structures in response to the gut passage of earthworm (Eisenia fetida) feeding on cow dung and domestic sludge: Illumina high-throughput sequencing-based data analysis,ECOTOXICOLOGY AND ENVIRONMENTAL SAFETY,NA,190,,MAR 1,2020,"Hu, Jian | Zhao, Haitao | Wang, Yue | Yin, Zhifeng | Kang, Yijun",Bacterial community | Earthworm | Gut passage | Illumina sequencing,10.1016/j.ecoenv.2019.110149,NA,KF7SE,0147-6513,NA,soil,terrestrial
WOS:000386603800028,Insights into functional genes and taxonomical/phylogenetic diversity of microbial communities in biological heap leaching system and their correlation with functions,APPLIED MICROBIOLOGY AND BIOTECHNOLOGY,22,100,9745-9756,NOV,2016,"Xiao, Yunhua | Liu, Xueduan | Liang, Yili | Niu, Jiaojiao | Zhang, Xian | Ma, Liyuan | Hao, Xiaodong | Gu, Yabin | Yin, Huaqun",Biological heap leaching systems | Microbial community function | Taxonomical/phylogenetic and functional diversity | GeoChip 5.0 | 16S rRNA gene sequencing,10.1007/s00253-016-7819-7,NA,EA4SE,0175-7598,NA,soil,terrestrial
WOS:000309431200027,Biogenic Phosphorus Compounds in Sediment and Suspended Particles in a Shallow Eutrophic Lake: A P-31-Nuclear Magnetic Resonance (P-31 NMR) Study,ENVIRONMENTAL SCIENCE & TECHNOLOGY,19,46,10572-10578,OCT 2,2012,"Shinohara, Ryuichiro | Imai, Akio | Kawasaki, Nobuyuki | Komatsu, Kazuhiro | Kohzu, Ayato | Miura, Shingo | Sano, Tomoharu | Satou, Takayuki | Tomioka, Noriko",,10.1021/es301887z,NA,015FG,0013-936X,NA,soil,terrestrial
WOS:000401674400004,Responses of Bacterial Communities to CuO Nanoparticles in Activated Sludge System,ENVIRONMENTAL SCIENCE & TECHNOLOGY,10,51,5368-5376,MAY 16,2017,"Wang, Xiaohui | Li, Jing | Liu, Rui | Hai, Reti | Zou, Dexun | Zhu, Xiaobiao | Luo, Nan",,10.1021/acs.est.6b06137,NA,EV3QO,0013-936X,NA,soil,terrestrial
WOS:000289297100005,Tit for tat? A mycorrhizal fungus accumulates phosphorus under low plant carbon availability,FEMS MICROBIOLOGY ECOLOGY,2,76,236-244,MAY,2011,"Hammer, Edith C. | Pallon, Jan | Wallander, Hakan | Olsson, Pal Axel",arbuscular mycorrhiza (AM) | symbiotic C-P exchange | nutrient accumulation | phosphorus | carbon limitation,10.1111/j.1574-6941.2011.01043.x,NA,747CE,0168-6496,NA,soil,terrestrial
WOS:000326214900014,Aeromonas salmonicida Ati2 is an effector protein of the type three secretion system,MICROBIOLOGY-SGM,NA,159,1937-1945,SEP,2013,"Dallaire-Dufresne, Stephanie | Barbeau, Xavier | Sarty, Darren | Tanaka, Katherine H. | Denoncourt, Alix M. | Laguee, Patrick | Reith, Michael E. | Charette, Steve J.",,10.1099/mic.0.067959-0,NA,242CL,1350-0872,NA,soil,terrestrial
WOS:A1991GA70900006,ACQUISITION OF PHOSPHORUS AND COPPER BY VA-MYCORRHIZAL HYPHAE AND ROOT-TO-SHOOT TRANSPORT IN WHITE CLOVER,PLANT AND SOIL,1,136,49-57,SEP,1991,"LI, XL | MARSCHNER, H | GEORGE, E",COPPER | GLOMUS-MOSSEAE | HYPHAL UPTAKE | PHOSPHATE | TRIFOLIUM-REPENS | VA-MYCORRHIZA | WHITE CLOVER,NA,NA,GA709,0032-079X,NA,soil,terrestrial
WOS:000222854300002,Possible involvement of hyphal phosphatase in phosphate efflux from intraradical hyphae isolated from mycorrhizal roots colonized by Gigaspora margarita,MYCOLOGICAL RESEARCH,NA,108,610-615,JUN,2004,"Kojima, T | Saito, M",,10.1017/S0953756204009980,NA,840JJ,0953-7562,NA,soil,terrestrial
WOS:000242007100004,Saprotrophic fungi transform organic phosphorus from spruce needle litter,SOIL BIOLOGY & BIOCHEMISTRY,12,38,3372-3379,DEC,2006,"Koukol, Ondrej | Novak, Frantisek | Hrabal, Richard | Vosatka, Miroslav",P-31 NMR | decomposition | organic phosphorus | polyphosphates | phosphonates | Picea abies | Setulipes androsaceus,10.1016/j.soilbio.2006.05.007,NA,105CO,0038-0717,NA,soil,terrestrial
WOS:000271272900013,Controlled Precipitation of Sparingly Soluble Phosphate Salts Using Enzymes. II. Precipitation of Struvite,CRYSTAL GROWTH & DESIGN,11,9,4642-4652,NOV,2009,"Kofina, Aikaterini N. | Lioliou, Maria G. | Paraskeva, Christakis A. | Klepetsanis, Pavlos G. | Ostvold, Terje | Koutsoukos, Petros G.",,10.1021/cg900090e,NA,512TG,1528-7483,NA,soil,terrestrial
WOS:000233235100008,Expression profiles of a phosphate transporter gene (GmosPT) from the endomycorrhizal fungus Glomus mosseae,MYCORRHIZA,8,15,620-627,DEC,2005,"Benedetto, A | Magurno, F | Bonfante, P | Lanfranco, L",AM fungi | phosphate transporters | Glomus mosseae | symbiosis,10.1007/s00572-005-0006-9,NA,983MC,0940-6360,NA,soil,terrestrial
WOS:000346907600086,Subcellular Nutrient Element Localization and Enrichment in Ecto- and Arbuscular Mycorrhizas of Field-Grown Beech and Ash Trees Indicate Functional Differences,PLOS ONE,12,9,,DEC 8,2014,"Seven, Jasmin | Polle, Andrea",,10.1371/journal.pone.0114672,NA,AX4MX,1932-6203,NA,soil,terrestrial
WOS:000242170300004,Effects of external phosphate concentration on glucose-6-phosphate dehydrogenase gene expression in the arbuscular mycorrhizal fungus Glomus intraradices,CANADIAN JOURNAL OF MICROBIOLOGY,9,52,823-830,SEP,2006,"Stewart, L. I. | Jabaji-Hare, S. | Driscoll, B. T.",arbuscular mycorrhizal fungi | phosphorus | nutrient uptake | glucose-6-phosphate dehydrogenase | gene expression,10.1139/W06-038,NA,107KO,0008-4166,NA,soil,terrestrial
WOS:000328225600007,Phosphorus dynamics in sediments of a eutrophic lake derived from P-31 nuclear magnetic resonance spectroscopy,MARINE AND FRESHWATER RESEARCH,1,65,70-80,NA,2014,"Oezkundakci, Deniz | Hamilton, David P. | McDowell, Richard | Hill, Stefan",internal loading | Lake Okaro | sedimentation | temporal variability,10.1071/MF13033,NA,269EZ,1323-1650,NA,soil,terrestrial
WOS:000239655100003,Characterization of phosphorus in sequential extracts from lake sediments using P-31 nuclear magnetic resonance spectroscopy,CANADIAN JOURNAL OF FISHERIES AND AQUATIC SCIENCES,8,63,1686-1699,AUG,2006,"Reitzel, Kasper | Ahlgren, Joakim | Gogoll, Adolf | Jensen, Henning S. | Rydin, Emil",,10.1139/F06-070,NA,072EG,0706-652X,NA,soil,terrestrial
WOS:000414411700002,Physiological and genomic insights into the lifestyle of arsenite-oxidizing Herminiimonas arsenitoxidans,SCIENTIFIC REPORTS,NA,7,,NOV 3,2017,"Koh, Hyeon-Woo | Hur, Moonsuk | Kang, Myung-Suk | Ku, Youn-Bong | Ghai, Rohit | Park, Soo-Je",,10.1038/s41598-017-15164-4,NA,FL7FI,2045-2322,NA,soil,terrestrial
WOS:000423245500090,The fate of cyanuric acid in biological wastewater treatment system and its impact on biological nutrient removal,JOURNAL OF ENVIRONMENTAL MANAGEMENT,NA,206,901-909,JAN 15,2018,"An, Hongxue | Liu, Jian | Li, Xiaoming | Yang, Qi | Wang, Dongbo | Xie, Ting | Zhao, Jianwei | Xu, Qiuxiang | Chen, Fei | Wang, Yali | Yi, Kaixin | Sun, Jian | Tao, Ziletao | Zeng, Guangming",Cyanuric acid | Biodegradation | Biological nutrient removal | Microbial community,10.1016/j.jenvman.2017.11.073,NA,FT6DW,0301-4797,NA,soil,terrestrial
WOS:000168678400003,Response of spring wheat to phosphorus and sulphur starter fertilizers of differing acidification potential,JOURNAL OF AGRICULTURAL SCIENCE,NA,136,283-289,MAY,2001,"Goos, RJ | Johnson, BE",,NA,NA,432EC,0021-8596,NA,soil,terrestrial
WOS:000226712600036,Sediment depth attenuation of biogenic phosphorus compounds measured by P-31 NMR,ENVIRONMENTAL SCIENCE & TECHNOLOGY,3,39,867-872,FEB 1,2005,"Ahlgren, J | Tranvik, L | Gogoll, A | Waldeback, M | Markides, K | Rydin, E",,10.1021/es049590h,NA,893IN,0013-936X,NA,soil,terrestrial
WOS:000457234300001,Phosphorus Forms in Sediments of a River-Dominated Estuary,FRONTIERS IN MARINE SCIENCE,NA,5,,SEP 4,2018,"Watson, Sheree J. | Cade-Menun, Barbara J. | Needoba, Joseph A. | Peterson, Tawnya D.",phosphorus | P-31-nuclear magnetic resonance | sediments | river | estuary,10.3389/fmars.2018.00302,NA,HJ5PP,NA,NA,soil,terrestrial
WOS:000412914400022,External hyphae of Rhizophagus irregularis DAOM 197198 are less sensitive to low pH than roots in arbuscular mycorrhizae: evidence from axenic culture system,ENVIRONMENTAL MICROBIOLOGY REPORTS,5,9,649-657,OCT,2017,"Wang, Ning | Feng, Zengwei | Zhou, Yang | Zhu, Honghui | Yao, Qing",,10.1111/1758-2229.12573,NA,FJ7CH,1758-2229,NA,soil,terrestrial
WOS:000235658700023,Depth-related distribution of bacterial community in sediments of eutrophic Guanting reservoir,SCIENCE IN CHINA SERIES D-EARTH SCIENCES,NA,48,276-284,NOV,2005,"Qu, JH | Yuan, HL | Huang, HZ | Wang, ET",Guanting reservoir | sediment | bacterial community | 16S rDNA | eutrophication,10.1360/05yd0005,NA,016XX,1006-9313,NA,soil,terrestrial
WOS:000186322000016,"Location and quantification of phosphorus and other elements in fully hydrated, soil-grown arbuscular mycorrhizas: a cryo-analytical scanning electron microscopy study",NEW PHYTOLOGIST,2,160,429-441,NOV,2003,"Ryan, MH | McCully, ME | Huang, CX",arbuscular mycorrhizal fungi (AMF) | cryo-scanning electron microscopy | root intercellular spaces | root cell vacuoles | potassium | calcium | magnesium | phosphorus | host defence response | X-ray microanalysis,10.1046/j.1469-8137.2003.00884.x,NA,739BH,0028-646X,NA,soil,terrestrial
WOS:000316682500250,Using of Arbuscular Mycorrhizal Fungi to Reduce the Deficiency Effect of Phosphorous Fertilization on Maize Plants (Zea mays L.),LIFE SCIENCE JOURNAL-ACTA ZHENGZHOU UNIVERSITY OVERSEAS EDITION,4,9,1648-1654,NA,2012,"Almagrabi, O. A. | Abdelmoneim, T. S.",Maize | P-deficiency | Morphology | Mycorrhiza | Low-P | Physiology,NA,NA,113QK,1097-8135,NA,soil,terrestrial
WOS:000371452900010,"Sphingoaurantiacus polygranulatus gen. nov., sp nov., isolated from high-Arctic tundra soil, and emended descriptions of the genera Sandarakinorhabdus, Polymorphobacter and Rhizorhabdus and the species Sandarakinorhabdus limnophila, Rhizorhabdus argentea and Sphingomonas wittichii",INTERNATIONAL JOURNAL OF SYSTEMATIC AND EVOLUTIONARY MICROBIOLOGY,NA,66,91-100,JAN,2016,"Kim, MyongChol | Kang, OkChol | Zhang, Yumin | Ren, Lvzhi | Chang, Xulu | Jiang, Fan | Fang, Chengxiang | Zheng, Congyi | Peng, Fang",,10.1099/ijsem.0.000677,NA,DF6GC,1466-5026,NA,soil,terrestrial
WOS:000230369900006,"Biologically labile and refractory phosphorus loads from the agriculturally-managed Upper Eau Galle River Watershed, Wisconsin",LAKE AND RESERVOIR MANAGEMENT,2,21,165-173,JUN,2005,"James, WF | Barko, JW",adsorption-desorption | biological phosphorus availability | equilibrium phosphorus concentration | labile phosphorus forms | loading | phosphorus | refractory phosphorus forms | runoff | watershed,NA,NA,943QU,1040-2381,NA,soil,terrestrial
WOS:000173549800010,Microbial populations of an upflow anaerobic sludge blanket reactor treating wastewater from a gelatin industry,ENVIRONMENTAL TECHNOLOGY,12,22,1477-1485,DEC,2001,"Vieira, AMS | Bergamasco, R | Gimenes, ML | Nakamura, CV | Dias, BP",UASB reactor | gelatin industry | electron microscopy | coliform | methanogen bacteria,NA,NA,516JH,0959-3330,NA,soil,terrestrial
WOS:A1992JB84600016,PHOSPHATASE-ACTIVITIES AND PHOSPHORUS UPTAKE FROM INOSITOL PHOSPHATE BY ECTOMYCORRHIZAL FUNGI,CANADIAN JOURNAL OF BOTANY-REVUE CANADIENNE DE BOTANIQUE,4,70,794-801,APR,1992,"ANTIBUS, RK | SINSABAUGH, RL | LINKINS, AE",ACID PHOSPHATASE | ECTOMYCORRHIZAL FUNGI | PHYTASE,NA,NA,JB846,0008-4026,NA,soil,terrestrial
WOS:A1991GL87600013,PHOSPHATE-TRANSPORT IN CALCIUM-SATURATED SYSTEMS .1. THEORY,SOIL SCIENCE SOCIETY OF AMERICA JOURNAL,5,55,1275-1281,SEP-OCT,1991,"CHO, CM",,NA,NA,GL876,0361-5995,NA,soil,terrestrial
WOS:000394556400047,Evidence for organic phosphorus activation and transformation at the sediment-water interface during plant debris decomposition,SCIENCE OF THE TOTAL ENVIRONMENT,NA,583,458-465,APR 1,2017,"Zhang, Wenqiang | Zhu, Xiaolei | Jin, Xin | Meng, Xin | Tang, Wenzhong | Shan, Baoqing",Decomposition | Plant debris | Sediment | Solution P-31 NMR | Organic phosphorus,10.1016/j.scitotenv.2017.01.103,NA,EL3YK,0048-9697,NA,soil,terrestrial
WOS:000082247900004,Prospects for the recovery of phosphorus from animal manures: A review,ENVIRONMENTAL TECHNOLOGY,7,20,697-708,JUL,1999,"Greaves, J | Hobbs, P | Chadwick, D | Haygarth, P",manure | phosphorus | recovery | struvite,NA,NA,230JK,0959-3330,NA,soil,terrestrial
WOS:000230812300005,Reaction of phosphate compounds with a high-sllica allophane,CLAYS AND CLAY MINERALS,4,53,372-379,AUG,2005,"Okada, K | Nishimuta, K | Kameshima, Y | Nakajima, A | MacKenzie, KJD",allophane | phosphate-loading | sorption properties | structure change,10.1346/CCMN.2005.0530405,NA,949TZ,0009-8604,NA,soil,terrestrial
WOS:000377139500028,Organic matter and pH affect the analysis efficiency of P-31-NMR,JOURNAL OF ENVIRONMENTAL SCIENCES,NA,43,244-249,MAY,2016,"Zhang, Wenqiang | Jin, Xin | Rong, Nan | Li, Jie | Shan, Baoqing",P-31-NMR | pH | Organic matter | Extraction rate | Sediment,10.1016/j.jes.2015.10.018,NA,DN5VN,1001-0742,NA,soil,terrestrial
WOS:000265040700010,The nucleotidase/phosphatase SAL1 is a negative regulator of drought tolerance in Arabidopsis,PLANT JOURNAL,2,58,299-317,APR,2009,"Wilson, Pip B. | Estavillo, Gonzalo M. | Field, Katie J. | Pornsiriwong, Wannarat | Carroll, Adam J. | Howell, Katharine A. | Woo, Nick S. | Lake, Janice A. | Smith, Steven M. | Millar, A. Harvey | von Caemmerer, Susanne | Pogson, Barry J.",drought | water use efficiency | SAL1 | Arabidopsis | signal transduction | phosphoinositides (PI),10.1111/j.1365-313X.2008.03780.x,NA,431DE,0960-7412,NA,soil,terrestrial
WOS:000457293700137,"Characterization of phosphorus forms in a Eutrophic Lake, China",SCIENCE OF THE TOTAL ENVIRONMENT,NA,659,1437-1447,APR 1,2019,"Xie, Fazhi | Li, Lu | Song, Kang | Li, Guolian | Wu, Fengchang | Giesy, John P.",Phosphorus | Eutrophication | Nutrients | Molecular composition | Solid-state P-31 | Nuclear magnetic resonance,10.1016/j.scitotenv.2018.12.466,NA,HJ6JK,0048-9697,NA,soil,terrestrial
WOS:000448124000018,"The Effect of Irrigation Frequency, Phosphorus Fertigation, and Cultivar on Levels of Phenolic Compounds in Sweet Cherries",HORTSCIENCE,10,53,1507-1512,OCT,2018,"Ross, Kelly | Neilsen, Gerry | Neilsen, Denise",anthocyanins | flavonols | Prunus avium | tartaric esters | total phenolics,10.21273/HORTSCI13303-18,NA,GX9LD,0018-5345,NA,soil,terrestrial
WOS:A1991FZ64300030,VEGETATIVE GROWTH OF THE COMMON BEAN IN RESPONSE TO PHOSPHORUS-NUTRITION,CROP SCIENCE,2,31,380-387,MAR-APR,1991,"LYNCH, J | LAUCHLI, A | EPSTEIN, E",,NA,NA,FZ643,0011-183X,NA,soil,terrestrial
WOS:000499953500029,Long-term effects of silver nanoparticles on performance of phosphorus removal in a laboratory-scale vertical flow constructed wetland,JOURNAL OF ENVIRONMENTAL SCIENCES,NA,87,319-330,JAN,2020,"Huang, Juan | Xiao, Jun | Guo, Yang | Guan, Wenzu | Cao, Chong | Yan, Chunni | Wang, Mingyu",Silver nanoparticles (AgNPs) | Phosphorus removal | Constructed wetlands | Enzymatic activity | Microbial community,10.1016/j.jes.2019.07.012,NA,JR9RM,1001-0742,NA,soil,terrestrial
